App name,No.,Time,Source,Destination,Protocol,Length,Info
Pandora,1,0,172.30.1.1,172.30.1.250,DNS,112,Standard query 0x5cc6 A graph.facebook.com
Pandora,2,0.032415,172.30.1.250,172.30.1.1,DNS,152,Standard query response 0x5cc6 A graph.facebook.com CNAME star.c10r.facebook.com A 157.240.241.17
Pandora,3,0.037028,172.30.1.1,172.30.1.250,TCP,108,49952  >  443 [SYN] Seq=0 Win=65535 Len=0 MSS=9960 SACK_PERM=1 TSval=2470257875 TSecr=0 WS=512
Pandora,4,0.03948,172.30.1.1,172.30.1.250,TCP,108,49954  >  443 [SYN] Seq=0 Win=65535 Len=0 MSS=9960 SACK_PERM=1 TSval=2470257875 TSecr=0 WS=512
Pandora,5,0.065445,172.30.1.1,172.30.1.250,DNS,112,Standard query 0x59b5 A sessions.bugsnag.com
Pandora,6,0.072694,172.30.1.250,172.30.1.1,TCP,96,"443  >  49952 [SYN, ACK] Seq=0 Ack=1 Win=4096 Len=0 MSS=9960 WS=512"
Pandora,7,0.072801,172.30.1.1,172.30.1.250,TCP,88,49952  >  443 [ACK] Seq=1 Ack=1 Win=65536 Len=0
Pandora,8,0.075823,172.30.1.1,172.30.1.250,TLSv1.3,604,Client Hello
Pandora,9,0.076077,172.30.1.250,172.30.1.1,TCP,88,443  >  49952 [ACK] Seq=1 Ack=518 Win=2096128 Len=0
Pandora,10,0.080149,172.30.1.250,172.30.1.1,TCP,96,"443  >  49954 [SYN, ACK] Seq=0 Ack=1 Win=4096 Len=0 MSS=9960 WS=512"
Pandora,11,0.080337,172.30.1.1,172.30.1.250,TCP,88,49954  >  443 [ACK] Seq=1 Ack=1 Win=65536 Len=0
Pandora,12,0.080964,172.30.1.1,172.30.1.250,TLSv1.3,604,Client Hello
Pandora,13,0.081132,172.30.1.250,172.30.1.1,TCP,88,443  >  49954 [ACK] Seq=1 Ack=518 Win=2096128 Len=0
Pandora,14,0.10237,172.30.1.250,172.30.1.1,DNS,128,Standard query response 0x59b5 A sessions.bugsnag.com A 35.190.88.7
Pandora,15,0.105057,172.30.1.1,172.30.1.250,TCP,108,50420  >  443 [SYN] Seq=0 Win=65535 Len=0 MSS=9960 SACK_PERM=1 TSval=3392556549 TSecr=0 WS=512
Pandora,16,0.114905,172.30.1.250,172.30.1.1,TLSv1.3,2700,"Server Hello, Change Cipher Spec, Application Data"
Pandora,17,0.115214,172.30.1.1,172.30.1.250,TCP,88,49952  >  443 [ACK] Seq=518 Ack=2613 Win=85504 Len=0
Pandora,18,0.115237,172.30.1.250,172.30.1.1,TLSv1.3,720,"Application Data, Application Data"
Pandora,19,0.115291,172.30.1.1,172.30.1.250,TCP,88,49952  >  443 [ACK] Seq=518 Ack=3245 Win=91136 Len=0
Pandora,20,0.12397,172.30.1.1,172.30.1.250,TLSv1.3,152,"Change Cipher Spec, Application Data"
Pandora,21,0.124107,172.30.1.250,172.30.1.1,TCP,88,443  >  49952 [ACK] Seq=3245 Ack=582 Win=2096640 Len=0
Pandora,22,0.124364,172.30.1.1,172.30.1.250,TLSv1.3,792,Application Data
Pandora,23,0.124445,172.30.1.250,172.30.1.1,TCP,88,443  >  49952 [ACK] Seq=3245 Ack=1288 Win=2096128 Len=0
Pandora,24,0.130548,172.30.1.250,172.30.1.1,TLSv1.3,2700,"Server Hello, Change Cipher Spec, Application Data"
Pandora,25,0.130738,172.30.1.1,172.30.1.250,TCP,88,49954  >  443 [ACK] Seq=518 Ack=2613 Win=85504 Len=0
Pandora,26,0.130749,172.30.1.250,172.30.1.1,TLSv1.3,720,"Application Data, Application Data"
Pandora,27,0.130779,172.30.1.1,172.30.1.250,TCP,88,49954  >  443 [ACK] Seq=518 Ack=3245 Win=91136 Len=0
Pandora,28,0.133517,172.30.1.1,172.30.1.250,TLSv1.3,152,"Change Cipher Spec, Application Data"
Pandora,29,0.133648,172.30.1.250,172.30.1.1,TCP,88,443  >  49954 [ACK] Seq=3245 Ack=582 Win=2096640 Len=0
Pandora,30,0.133801,172.30.1.1,172.30.1.250,TLSv1.3,492,Application Data
Pandora,31,0.133866,172.30.1.250,172.30.1.1,TCP,88,443  >  49954 [ACK] Seq=3245 Ack=988 Win=2096640 Len=0
Pandora,32,0.147457,172.30.1.250,172.30.1.1,TCP,96,"443  >  50420 [SYN, ACK] Seq=0 Ack=1 Win=4096 Len=0 MSS=9960 WS=512"
Pandora,33,0.147575,172.30.1.1,172.30.1.250,TCP,88,50420  >  443 [ACK] Seq=1 Ack=1 Win=65536 Len=0
Pandora,34,0.149382,172.30.1.1,172.30.1.250,TLSv1.3,604,Client Hello
Pandora,35,0.149711,172.30.1.250,172.30.1.1,TCP,88,443  >  50420 [ACK] Seq=1 Ack=518 Win=2096128 Len=0
Pandora,36,0.157418,172.30.1.250,172.30.1.1,TLSv1.3,264,Application Data
Pandora,37,0.189435,172.30.1.1,172.30.1.250,DNS,116,Standard query 0x050f A imasdk.googleapis.com
Pandora,38,0.198802,172.30.1.1,172.30.1.250,TCP,88,49952  >  443 [ACK] Seq=1288 Ack=3422 Win=96256 Len=0
Pandora,39,0.213731,172.30.1.250,172.30.1.1,TLSv1.3,264,Application Data
Pandora,40,0.213884,172.30.1.250,172.30.1.1,TLSv1.3,2700,"Server Hello, Change Cipher Spec"
Pandora,41,0.214017,172.30.1.1,172.30.1.250,TCP,88,50420  >  443 [ACK] Seq=518 Ack=2613 Win=85504 Len=0
Pandora,42,0.214029,172.30.1.250,172.30.1.1,TLSv1.3,1460,Application Data
Pandora,43,0.214072,172.30.1.250,172.30.1.1,TLSv1.3,1492,Application Data
Pandora,44,0.214098,172.30.1.250,172.30.1.1,TLSv1.3,1880,Application Data
Pandora,45,0.214128,172.30.1.1,172.30.1.250,TCP,88,49952  >  443 [ACK] Seq=1288 Ack=4796 Win=116224 Len=0
Pandora,46,0.214132,172.30.1.1,172.30.1.250,TCP,88,49954  >  443 [ACK] Seq=988 Ack=4825 Win=116224 Len=0
Pandora,47,0.214135,172.30.1.1,172.30.1.250,TCP,88,50420  >  443 [ACK] Seq=518 Ack=4407 Win=91136 Len=0
Pandora,48,0.214827,172.30.1.1,172.30.1.250,TLSv1.3,492,Application Data
Pandora,49,0.215148,172.30.1.250,172.30.1.1,TCP,88,443  >  49954 [ACK] Seq=4825 Ack=1394 Win=2096640 Len=0
Pandora,50,0.217744,172.30.1.1,172.30.1.250,TLSv1.3,152,"Change Cipher Spec, Application Data"
Pandora,51,0.218502,172.30.1.250,172.30.1.1,TCP,88,443  >  50420 [ACK] Seq=4407 Ack=582 Win=2096640 Len=0
Pandora,52,0.218577,172.30.1.1,172.30.1.250,TLSv1.3,1288,Application Data
Pandora,53,0.21864,172.30.1.250,172.30.1.1,TCP,88,443  >  50420 [ACK] Seq=4407 Ack=1784 Win=2095616 Len=0
Pandora,54,0.22742,172.30.1.250,172.30.1.1,DNS,132,Standard query response 0x050f A imasdk.googleapis.com A 142.250.80.74
Pandora,55,0.229869,172.30.1.1,172.30.1.250,TCP,108,43962  >  443 [SYN] Seq=0 Win=65535 Len=0 MSS=9960 SACK_PERM=1 TSval=450289232 TSecr=0 WS=512
Pandora,56,0.268547,172.30.1.1,172.30.1.250,DNS,120,Standard query 0x69ff A device-api.urbanairship.com
Pandora,57,0.269569,172.30.1.1,172.30.1.250,DNS,120,Standard query 0x15ab A remote-data.urbanairship.com
Pandora,58,0.273624,172.30.1.250,172.30.1.1,TCP,96,"443  >  43962 [SYN, ACK] Seq=0 Ack=1 Win=4096 Len=0 MSS=9960 WS=512"
Pandora,59,0.273727,172.30.1.1,172.30.1.250,TCP,88,43962  >  443 [ACK] Seq=1 Ack=1 Win=65536 Len=0
Pandora,60,0.274505,172.30.1.1,172.30.1.250,TLSv1.3,604,Client Hello
Pandora,61,0.275092,172.30.1.250,172.30.1.1,TCP,88,443  >  43962 [ACK] Seq=1 Ack=518 Win=2096128 Len=0
Pandora,62,0.320676,172.30.1.250,172.30.1.1,TLSv1.3,1492,Application Data
Pandora,63,0.320806,172.30.1.250,172.30.1.1,DNS,136,Standard query response 0x69ff A device-api.urbanairship.com A 35.244.184.98
Pandora,64,0.320961,172.30.1.250,172.30.1.1,DNS,136,Standard query response 0x15ab A remote-data.urbanairship.com A 35.201.74.116
Pandora,65,0.323517,172.30.1.1,172.30.1.250,TCP,108,34878  >  443 [SYN] Seq=0 Win=65535 Len=0 MSS=9960 SACK_PERM=1 TSval=2965025657 TSecr=0 WS=512
Pandora,66,0.329978,172.30.1.1,172.30.1.250,TCP,108,60996  >  443 [SYN] Seq=0 Win=65535 Len=0 MSS=9960 SACK_PERM=1 TSval=1441549470 TSecr=0 WS=512
Pandora,67,0.331052,172.30.1.250,172.30.1.1,TLSv1.3,1392,"Server Hello, Change Cipher Spec"
Pandora,68,0.331209,172.30.1.1,172.30.1.250,TCP,88,43962  >  443 [ACK] Seq=518 Ack=1307 Win=85504 Len=0
Pandora,69,0.331259,172.30.1.250,172.30.1.1,TCP,1392,"443  >  43962 [PSH, ACK] Seq=1307 Ack=518 Win=2097152 Len=1306 [TCP segment of a reassembled PDU]"
Pandora,70,0.331291,172.30.1.1,172.30.1.250,TCP,88,43962  >  443 [ACK] Seq=518 Ack=2613 Win=105472 Len=0
Pandora,71,0.334607,172.30.1.250,172.30.1.1,TCP,1392,"443  >  43962 [PSH, ACK] Seq=2613 Ack=518 Win=2097152 Len=1306 [TCP segment of a reassembled PDU]"
Pandora,72,0.33534,172.30.1.1,172.30.1.250,TCP,88,43962  >  443 [ACK] Seq=518 Ack=3919 Win=125440 Len=0
Pandora,73,0.337617,172.30.1.250,172.30.1.1,TLSv1.3,860,Application Data
Pandora,74,0.337709,172.30.1.1,172.30.1.250,TCP,88,43962  >  443 [ACK] Seq=518 Ack=4690 Win=128000 Len=0
Pandora,75,0.340253,172.30.1.250,172.30.1.1,TLSv1.3,948,"Application Data, Application Data"
Pandora,76,0.343433,172.30.1.1,172.30.1.250,TLSv1.3,152,"Change Cipher Spec, Application Data"
Pandora,77,0.343575,172.30.1.250,172.30.1.1,TCP,88,443  >  43962 [ACK] Seq=4690 Ack=582 Win=2096640 Len=0
Pandora,78,0.343746,172.30.1.1,172.30.1.250,TLSv1.3,308,Application Data
Pandora,79,0.343815,172.30.1.250,172.30.1.1,TCP,88,443  >  43962 [ACK] Seq=4690 Ack=801 Win=2096640 Len=0
Pandora,80,0.362812,172.30.1.1,172.30.1.250,TCP,88,49954  >  443 [ACK] Seq=1394 Ack=6228 Win=136192 Len=0
Pandora,81,0.373788,172.30.1.250,172.30.1.1,TCP,96,"443  >  34878 [SYN, ACK] Seq=0 Ack=1 Win=4096 Len=0 MSS=9960 WS=512"
Pandora,82,0.373903,172.30.1.1,172.30.1.250,TCP,88,34878  >  443 [ACK] Seq=1 Ack=1 Win=65536 Len=0
Pandora,83,0.37392,172.30.1.250,172.30.1.1,TCP,96,"443  >  60996 [SYN, ACK] Seq=0 Ack=1 Win=4096 Len=0 MSS=9960 WS=512"
Pandora,84,0.373977,172.30.1.1,172.30.1.250,TCP,88,60996  >  443 [ACK] Seq=1 Ack=1 Win=65536 Len=0
Pandora,85,0.374585,172.30.1.1,172.30.1.250,TLSv1.3,604,Client Hello
Pandora,86,0.37546,172.30.1.1,172.30.1.250,TLSv1.3,604,Client Hello
Pandora,87,0.375857,172.30.1.250,172.30.1.1,TCP,88,443  >  34878 [ACK] Seq=1 Ack=518 Win=2096128 Len=0
Pandora,88,0.376216,172.30.1.250,172.30.1.1,TCP,88,443  >  60996 [ACK] Seq=1 Ack=518 Win=2096128 Len=0
Pandora,89,0.386996,172.30.1.1,172.30.1.250,TCP,88,50420  >  443 [ACK] Seq=1784 Ack=5266 Win=96256 Len=0
Pandora,90,0.404712,172.30.1.250,172.30.1.1,TLSv1.3,1956,"Application Data, Application Data"
Pandora,91,0.40493,172.30.1.250,172.30.1.1,TLSv1.3,212,"Application Data, Application Data"
Pandora,92,0.405011,172.30.1.1,172.30.1.250,TCP,88,43962  >  443 [ACK] Seq=801 Ack=6686 Win=132096 Len=0
Pandora,93,0.424397,172.30.1.250,172.30.1.1,TLSv1.3,2700,"Server Hello, Change Cipher Spec"
Pandora,94,0.424563,172.30.1.1,172.30.1.250,TCP,88,34878  >  443 [ACK] Seq=518 Ack=2613 Win=85504 Len=0
Pandora,95,0.424576,172.30.1.250,172.30.1.1,TLSv1.3,928,Application Data
Pandora,96,0.424611,172.30.1.250,172.30.1.1,TLSv1.3,2700,"Server Hello, Change Cipher Spec"
Pandora,97,0.424698,172.30.1.1,172.30.1.250,TCP,88,34878  >  443 [ACK] Seq=518 Ack=3455 Win=91136 Len=0
Pandora,98,0.424702,172.30.1.1,172.30.1.250,TCP,88,60996  >  443 [ACK] Seq=518 Ack=2613 Win=85504 Len=0
Pandora,99,0.424712,172.30.1.250,172.30.1.1,TLSv1.3,928,Application Data
Pandora,100,0.42474,172.30.1.1,172.30.1.250,TCP,88,60996  >  443 [ACK] Seq=518 Ack=3455 Win=91136 Len=0
Pandora,101,0.427024,172.30.1.1,172.30.1.250,TLSv1.3,152,"Change Cipher Spec, Application Data"
Pandora,102,0.427043,172.30.1.1,172.30.1.250,TLSv1.3,152,"Change Cipher Spec, Application Data"
Pandora,103,0.427163,172.30.1.250,172.30.1.1,TCP,88,443  >  34878 [ACK] Seq=3455 Ack=582 Win=2096640 Len=0
Pandora,104,0.427253,172.30.1.250,172.30.1.1,TCP,88,443  >  60996 [ACK] Seq=3455 Ack=582 Win=2096640 Len=0
Pandora,105,0.428632,172.30.1.1,172.30.1.250,DNS,108,Standard query 0x975b A api2.branch.io
Pandora,106,0.429967,172.30.1.1,172.30.1.250,TLSv1.3,908,Application Data
Pandora,107,0.429981,172.30.1.1,172.30.1.250,TLSv1.3,544,Application Data
Pandora,108,0.430052,172.30.1.250,172.30.1.1,TCP,88,443  >  34878 [ACK] Seq=3455 Ack=1401 Win=2096128 Len=0
Pandora,109,0.430171,172.30.1.250,172.30.1.1,TCP,88,443  >  60996 [ACK] Seq=3455 Ack=1038 Win=2096128 Len=0
Pandora,110,0.482053,172.30.1.250,172.30.1.1,DNS,172,Standard query response 0x975b A api2.branch.io A 18.164.124.34 A 18.164.124.63 A 18.164.124.112 A 18.164.124.85
Pandora,111,0.484234,172.30.1.1,172.30.1.250,TCP,108,59726  >  443 [SYN] Seq=0 Win=65535 Len=0 MSS=9960 SACK_PERM=1 TSval=493385336 TSecr=0 WS=512
Pandora,112,0.515385,172.30.1.250,172.30.1.1,TCP,96,"443  >  59726 [SYN, ACK] Seq=0 Ack=1 Win=4096 Len=0 MSS=9960 WS=512"
Pandora,113,0.515504,172.30.1.1,172.30.1.250,TCP,88,59726  >  443 [ACK] Seq=1 Ack=1 Win=65536 Len=0
Pandora,114,0.517161,172.30.1.1,172.30.1.250,TLSv1.3,604,Client Hello
Pandora,115,0.517614,172.30.1.250,172.30.1.1,TCP,88,443  >  59726 [ACK] Seq=1 Ack=518 Win=2096128 Len=0
Pandora,116,0.527414,172.30.1.250,172.30.1.1,TLSv1.3,1052,"Application Data, Application Data"
Pandora,117,0.535702,172.30.1.250,172.30.1.1,TLSv1.3,1144,"Application Data, Application Data"
Pandora,118,0.539077,172.30.1.250,172.30.1.1,TLSv1.3,1392,Application Data
Pandora,119,0.539159,172.30.1.1,172.30.1.250,TCP,88,60996  >  443 [ACK] Seq=1038 Ack=5818 Win=116224 Len=0
Pandora,120,0.542638,172.30.1.250,172.30.1.1,TLSv1.3,1004,"Application Data, Application Data"
Pandora,121,0.543467,172.30.1.1,172.30.1.250,TLSv1.3,112,Application Data
Pandora,122,0.54365,172.30.1.250,172.30.1.1,TCP,88,443  >  49952 [ACK] Seq=4796 Ack=1312 Win=2096640 Len=0
Pandora,123,0.543725,172.30.1.1,172.30.1.250,TCP,88,"49952  >  443 [FIN, ACK] Seq=1312 Ack=4796 Win=116224 Len=0"
Pandora,124,0.543947,172.30.1.250,172.30.1.1,TCP,88,443  >  49952 [ACK] Seq=4796 Ack=1313 Win=2096640 Len=0
Pandora,125,0.558447,172.30.1.1,172.30.1.250,TLSv1.3,608,Application Data
Pandora,126,0.55861,172.30.1.250,172.30.1.1,TCP,88,443  >  34878 [ACK] Seq=4419 Ack=1920 Win=2096128 Len=0
Pandora,127,0.560162,172.30.1.250,172.30.1.1,TLSv1.3,1392,"Server Hello, Change Cipher Spec, Application Data"
Pandora,128,0.560359,172.30.1.1,172.30.1.250,TCP,88,59726  >  443 [ACK] Seq=518 Ack=1307 Win=85504 Len=0
Pandora,129,0.56167,172.30.1.1,172.30.1.250,TLSv1.3,968,Application Data
Pandora,130,0.561784,172.30.1.250,172.30.1.1,TCP,88,443  >  49954 [ACK] Seq=6228 Ack=2275 Win=2096128 Len=0
Pandora,131,0.561843,172.30.1.1,172.30.1.250,TLSv1.3,116,Application Data
Pandora,132,0.561854,172.30.1.250,172.30.1.1,TCP,88,443  >  49954 [ACK] Seq=6228 Ack=2302 Win=2096128 Len=0
Pandora,133,0.563531,172.30.1.250,172.30.1.1,TCP,1392,"443  >  59726 [PSH, ACK] Seq=1307 Ack=518 Win=2097152 Len=1306 [TCP segment of a reassembled PDU]"
Pandora,134,0.563607,172.30.1.1,172.30.1.250,TCP,88,59726  >  443 [ACK] Seq=518 Ack=2613 Win=105472 Len=0
Pandora,135,0.570188,172.30.1.250,172.30.1.1,TLSv1.3,1468,"Application Data, Application Data, Application Data"
Pandora,136,0.570468,172.30.1.1,172.30.1.250,TCP,88,59726  >  443 [ACK] Seq=518 Ack=3992 Win=125440 Len=0
Pandora,137,0.576177,172.30.1.1,172.30.1.250,TLSv1.3,152,"Change Cipher Spec, Application Data"
Pandora,138,0.57633,172.30.1.250,172.30.1.1,TCP,88,443  >  59726 [ACK] Seq=3992 Ack=582 Win=2096640 Len=0
Pandora,139,0.576982,172.30.1.1,172.30.1.250,TLSv1.3,1448,Application Data
Pandora,140,0.577185,172.30.1.250,172.30.1.1,TCP,88,443  >  59726 [ACK] Seq=3992 Ack=1942 Win=2095616 Len=0
Pandora,141,0.585671,172.30.1.250,172.30.1.1,TLSv1.3,112,Application Data
Pandora,142,0.585853,172.30.1.1,172.30.1.250,TCP,88,49952  >  443 [RST] Seq=1313 Win=0 Len=0
Pandora,143,0.585889,172.30.1.250,172.30.1.1,TCP,88,"443  >  49952 [RST, ACK] Seq=4820 Ack=1313 Win=65024 Len=0"
Pandora,144,0.591301,172.30.1.1,172.30.1.250,TCP,88,60996  >  443 [ACK] Seq=1038 Ack=6734 Win=121344 Len=0
Pandora,145,0.616441,172.30.1.250,172.30.1.1,TLSv1.3,232,Application Data
Pandora,146,0.628566,172.30.1.250,172.30.1.1,TLSv1.3,544,Application Data
Pandora,147,0.659178,172.30.1.1,172.30.1.250,TCP,88,59726  >  443 [ACK] Seq=1942 Ack=4138 Win=128512 Len=0
Pandora,148,0.670922,172.30.1.1,172.30.1.250,TCP,88,34878  >  443 [ACK] Seq=1920 Ack=4876 Win=101376 Len=0
Pandora,149,0.724761,172.30.1.250,172.30.1.1,TLSv1.3,928,Application Data
Pandora,150,0.724964,172.30.1.1,172.30.1.250,TCP,88,59726  >  443 [ACK] Seq=1942 Ack=4979 Win=131072 Len=0
Pandora,151,0.737849,172.30.1.1,172.30.1.250,DNS,108,Standard query 0xbf47 A cdn.branch.io
Pandora,152,0.835979,172.30.1.1,172.30.1.250,DNS,120,Standard query 0x0c07 A android-tuner.pandora.com
Pandora,153,0.839614,172.30.1.1,172.30.1.250,DNS,104,Standard query 0xd39d A pandora.com
Pandora,154,0.84353,172.30.1.1,172.30.1.250,DNS,108,Standard query 0x045c A www.pandora.com
Pandora,155,0.90308,172.30.1.1,172.30.1.250,DNS,136,Standard query 0xad8e A pandoramedia-mkt-prod1-t.campaign.adobe.com
Pandora,156,0.907431,172.30.1.1,172.30.1.250,DNS,108,Standard query 0xeaf1 A zc.adswizz.com
Pandora,157,1.016915,172.30.1.1,172.30.1.250,DNS,136,Standard query 0x7911 A pandora-im-config.s3.us-east-1.amazonaws.com
Pandora,158,1.069585,172.30.1.1,172.30.1.250,DNS,116,Standard query 0xa66f A pubads.g.doubleclick.net
Pandora,159,1.07955,172.30.1.1,172.30.1.250,DNS,112,Standard query 0x260d A adserver.pandora.com
Pandora,160,1.683566,172.30.1.1,172.30.1.250,DNS,132,Standard query 0x0fc5 A mediaserver-cont-dc6-2-v4v6.pandora.com
Pandora,161,2.095484,172.30.1.250,172.30.1.1,DNS,120,Standard query response 0xd39d A pandora.com A 208.85.40.158
Pandora,162,2.095924,172.30.1.250,172.30.1.1,DNS,148,Standard query response 0x045c A www.pandora.com CNAME www.gslb.pandora.com A 208.85.41.59
Pandora,163,2.096078,172.30.1.250,172.30.1.1,DNS,208,Standard query response 0xad8e A pandoramedia-mkt-prod1-t.campaign.adobe.com CNAME pandoramedia-mkt-prod1-lb.campaign.adobe.com A 52.35.86.6 A 54.191.219.73
Pandora,164,2.096256,172.30.1.250,172.30.1.1,DNS,216,Standard query response 0xeaf1 A zc.adswizz.com CNAME d3rx39c3zit24x.cloudfront.net A 13.226.34.44 A 13.226.34.46 A 13.226.34.123 A 13.226.34.36
Pandora,165,2.097598,172.30.1.1,172.30.1.250,TCP,108,38290  >  443 [SYN] Seq=0 Win=65535 Len=0 MSS=9960 SACK_PERM=1 TSval=3904655739 TSecr=0 WS=512
Pandora,166,2.098733,172.30.1.1,172.30.1.250,TCP,108,50608  >  443 [SYN] Seq=0 Win=65535 Len=0 MSS=9960 SACK_PERM=1 TSval=1215453498 TSecr=0 WS=512
Pandora,167,2.10142,172.30.1.1,172.30.1.250,TCP,108,57152  >  443 [SYN] Seq=0 Win=65535 Len=0 MSS=9960 SACK_PERM=1 TSval=3254096253 TSecr=0 WS=512
Pandora,168,2.104065,172.30.1.1,172.30.1.250,TCP,108,57158  >  443 [SYN] Seq=0 Win=65535 Len=0 MSS=9960 SACK_PERM=1 TSval=3254096253 TSecr=0 WS=512
Pandora,169,2.10594,172.30.1.1,172.30.1.250,TCP,108,57160  >  443 [SYN] Seq=0 Win=65535 Len=0 MSS=9960 SACK_PERM=1 TSval=3254096253 TSecr=0 WS=512
Pandora,170,2.108186,172.30.1.1,172.30.1.250,TCP,108,42192  >  443 [SYN] Seq=0 Win=65535 Len=0 MSS=9960 SACK_PERM=1 TSval=814609888 TSecr=0 WS=512
Pandora,171,2.109693,172.30.1.1,172.30.1.250,TCP,108,57176  >  443 [SYN] Seq=0 Win=65535 Len=0 MSS=9960 SACK_PERM=1 TSval=3254096254 TSecr=0 WS=512
Pandora,172,2.11095,172.30.1.1,172.30.1.250,TCP,108,57180  >  443 [SYN] Seq=0 Win=65535 Len=0 MSS=9960 SACK_PERM=1 TSval=3254096254 TSecr=0 WS=512
Pandora,173,2.11193,172.30.1.1,172.30.1.250,TCP,108,57192  >  443 [SYN] Seq=0 Win=65535 Len=0 MSS=9960 SACK_PERM=1 TSval=3254096254 TSecr=0 WS=512
Pandora,174,2.112883,172.30.1.1,172.30.1.250,TCP,108,57204  >  443 [SYN] Seq=0 Win=65535 Len=0 MSS=9960 SACK_PERM=1 TSval=3254096254 TSecr=0 WS=512
Pandora,175,2.113334,172.30.1.250,172.30.1.1,DNS,168,Standard query response 0x0c07 A android-tuner.pandora.com CNAME android-tuner.gslb.pandora.com A 199.116.164.236
Pandora,176,2.113941,172.30.1.250,172.30.1.1,DNS,156,Standard query response 0xa66f A pubads.g.doubleclick.net CNAME pubads46.g.doubleclick.net A 142.251.41.2
Pandora,177,2.114255,172.30.1.250,172.30.1.1,DNS,128,Standard query response 0x260d A adserver.pandora.com A 208.85.40.143
Pandora,178,2.114474,172.30.1.250,172.30.1.1,DNS,148,Standard query response 0x0fc5 A mediaserver-cont-dc6-2-v4v6.pandora.com A 208.85.46.34
Pandora,179,2.117109,172.30.1.1,172.30.1.250,TCP,108,47060  >  443 [SYN] Seq=0 Win=65535 Len=0 MSS=9960 SACK_PERM=1 TSval=1180332272 TSecr=0 WS=512
Pandora,180,2.120149,172.30.1.1,172.30.1.250,TCP,108,47068  >  443 [SYN] Seq=0 Win=65535 Len=0 MSS=9960 SACK_PERM=1 TSval=1180332273 TSecr=0 WS=512
Pandora,181,2.121473,172.30.1.1,172.30.1.250,TCP,108,53284  >  443 [SYN] Seq=0 Win=65535 Len=0 MSS=9960 SACK_PERM=1 TSval=1908672898 TSecr=0 WS=512
Pandora,182,2.123493,172.30.1.1,172.30.1.250,TCP,108,47074  >  443 [SYN] Seq=0 Win=65535 Len=0 MSS=9960 SACK_PERM=1 TSval=1180332273 TSecr=0 WS=512
Pandora,183,2.124374,172.30.1.1,172.30.1.250,TCP,108,45962  >  443 [SYN] Seq=0 Win=65535 Len=0 MSS=9960 SACK_PERM=1 TSval=3887109233 TSecr=0 WS=512
Pandora,184,2.125345,172.30.1.1,172.30.1.250,TCP,108,57880  >  80 [SYN] Seq=0 Win=65535 Len=0 MSS=9960 SACK_PERM=1 TSval=568940497 TSecr=0 WS=512
Pandora,185,2.126101,172.30.1.1,172.30.1.250,TCP,108,45976  >  443 [SYN] Seq=0 Win=65535 Len=0 MSS=9960 SACK_PERM=1 TSval=3887109233 TSecr=0 WS=512
Pandora,186,2.126939,172.30.1.1,172.30.1.250,TCP,108,57890  >  80 [SYN] Seq=0 Win=65535 Len=0 MSS=9960 SACK_PERM=1 TSval=568940497 TSecr=0 WS=512
Pandora,187,2.12775,172.30.1.1,172.30.1.250,TCP,108,45978  >  443 [SYN] Seq=0 Win=65535 Len=0 MSS=9960 SACK_PERM=1 TSval=3887109234 TSecr=0 WS=512
Pandora,188,2.128478,172.30.1.1,172.30.1.250,TCP,108,47080  >  443 [SYN] Seq=0 Win=65535 Len=0 MSS=9960 SACK_PERM=1 TSval=1180332274 TSecr=0 WS=512
Pandora,189,2.129422,172.30.1.1,172.30.1.250,TCP,108,47090  >  443 [SYN] Seq=0 Win=65535 Len=0 MSS=9960 SACK_PERM=1 TSval=1180332274 TSecr=0 WS=512
Pandora,190,2.130097,172.30.1.1,172.30.1.250,TCP,108,47102  >  443 [SYN] Seq=0 Win=65535 Len=0 MSS=9960 SACK_PERM=1 TSval=1180332275 TSecr=0 WS=512
Pandora,191,2.130789,172.30.1.1,172.30.1.250,TCP,108,47108  >  443 [SYN] Seq=0 Win=65535 Len=0 MSS=9960 SACK_PERM=1 TSval=1180332275 TSecr=0 WS=512
Pandora,192,2.131723,172.30.1.1,172.30.1.250,TCP,108,47120  >  443 [SYN] Seq=0 Win=65535 Len=0 MSS=9960 SACK_PERM=1 TSval=1180332275 TSecr=0 WS=512
Pandora,193,2.149747,172.30.1.250,172.30.1.1,DNS,288,Standard query response 0x7911 A pandora-im-config.s3.us-east-1.amazonaws.com CNAME s3-r-w.us-east-1.amazonaws.com A 52.217.166.234 A 52.216.221.18 A 52.216.145.222 A 54.231.232.18 A 52.217.106.216 A 52.216.44.10 A 52.216.114.62 A 52.217.84.152
Pandora,194,2.152829,172.30.1.1,172.30.1.250,TCP,108,57312  >  443 [SYN] Seq=0 Win=65535 Len=0 MSS=9960 SACK_PERM=1 TSval=2830659046 TSecr=0 WS=512
Pandora,195,2.173527,172.30.1.250,172.30.1.1,TCP,96,"443  >  53284 [SYN, ACK] Seq=0 Ack=1 Win=4096 Len=0 MSS=9960 WS=512"
Pandora,196,2.173651,172.30.1.1,172.30.1.250,TCP,88,53284  >  443 [ACK] Seq=1 Ack=1 Win=65536 Len=0
Pandora,197,2.173671,172.30.1.250,172.30.1.1,TCP,96,"443  >  42192 [SYN, ACK] Seq=0 Ack=1 Win=4096 Len=0 MSS=9960 WS=512"
Pandora,198,2.173733,172.30.1.1,172.30.1.250,TCP,88,42192  >  443 [ACK] Seq=1 Ack=1 Win=65536 Len=0
Pandora,199,2.177087,172.30.1.1,172.30.1.250,TCP,108,57220  >  443 [SYN] Seq=0 Win=65535 Len=0 MSS=9960 SACK_PERM=1 TSval=3254096330 TSecr=0 WS=512
Pandora,200,2.17775,172.30.1.1,172.30.1.250,TLSv1.3,604,Client Hello
Pandora,201,2.177909,172.30.1.1,172.30.1.250,TLSv1.3,604,Client Hello
Pandora,202,2.178035,172.30.1.250,172.30.1.1,TCP,88,443  >  42192 [ACK] Seq=1 Ack=518 Win=2096128 Len=0
Pandora,203,2.178091,172.30.1.250,172.30.1.1,TCP,96,"443  >  47060 [SYN, ACK] Seq=0 Ack=1 Win=4096 Len=0 MSS=9960 WS=512"
Pandora,204,2.178154,172.30.1.250,172.30.1.1,TCP,96,"443  >  47068 [SYN, ACK] Seq=0 Ack=1 Win=4096 Len=0 MSS=9960 WS=512"
Pandora,205,2.178641,172.30.1.250,172.30.1.1,TCP,88,443  >  53284 [ACK] Seq=1 Ack=518 Win=2096128 Len=0
Pandora,206,2.178668,172.30.1.250,172.30.1.1,TCP,96,"443  >  47074 [SYN, ACK] Seq=0 Ack=1 Win=4096 Len=0 MSS=9960 WS=512"
Pandora,207,2.17888,172.30.1.250,172.30.1.1,TCP,96,"80  >  57880 [SYN, ACK] Seq=0 Ack=1 Win=4096 Len=0 MSS=9960 WS=512"
Pandora,208,2.180688,172.30.1.250,172.30.1.1,TCP,96,"80  >  57890 [SYN, ACK] Seq=0 Ack=1 Win=4096 Len=0 MSS=9960 WS=512"
Pandora,209,2.1808,172.30.1.250,172.30.1.1,TCP,96,"443  >  47080 [SYN, ACK] Seq=0 Ack=1 Win=4096 Len=0 MSS=9960 WS=512"
Pandora,210,2.180853,172.30.1.250,172.30.1.1,TCP,96,"443  >  47090 [SYN, ACK] Seq=0 Ack=1 Win=4096 Len=0 MSS=9960 WS=512"
Pandora,211,2.180952,172.30.1.1,172.30.1.250,TCP,88,47060  >  443 [ACK] Seq=1 Ack=1 Win=65536 Len=0
Pandora,212,2.180966,172.30.1.1,172.30.1.250,TCP,88,47068  >  443 [ACK] Seq=1 Ack=1 Win=65536 Len=0
Pandora,213,2.180974,172.30.1.1,172.30.1.250,TCP,88,47074  >  443 [ACK] Seq=1 Ack=1 Win=65536 Len=0
Pandora,214,2.180982,172.30.1.1,172.30.1.250,TCP,88,57880  >  80 [ACK] Seq=1 Ack=1 Win=65536 Len=0
Pandora,215,2.180989,172.30.1.1,172.30.1.250,HTTP,344,GET /images/fa/41/5d/37/6d9c44ce91df685effe798ec/1080W_1080H.jpg HTTP/1.1 
Pandora,216,2.181071,172.30.1.1,172.30.1.250,TLSv1.2,604,Client Hello
Pandora,217,2.181149,172.30.1.1,172.30.1.250,TLSv1.2,604,Client Hello
Pandora,218,2.181194,172.30.1.1,172.30.1.250,TLSv1.2,604,Client Hello
Pandora,219,2.181226,172.30.1.1,172.30.1.250,TCP,88,57890  >  80 [ACK] Seq=1 Ack=1 Win=65536 Len=0
Pandora,220,2.181234,172.30.1.1,172.30.1.250,TCP,88,47080  >  443 [ACK] Seq=1 Ack=1 Win=65536 Len=0
Pandora,221,2.181239,172.30.1.1,172.30.1.250,TCP,88,47090  >  443 [ACK] Seq=1 Ack=1 Win=65536 Len=0
Pandora,222,2.181245,172.30.1.1,172.30.1.250,HTTP,344,GET /images/af/6b/99/1a/076849d7b573183a44276aaa/1080W_1080H.jpg HTTP/1.1 
Pandora,223,2.18133,172.30.1.250,172.30.1.1,TCP,88,443  >  47060 [ACK] Seq=1 Ack=518 Win=2096128 Len=0
Pandora,224,2.18139,172.30.1.250,172.30.1.1,TCP,88,443  >  47068 [ACK] Seq=1 Ack=518 Win=2096128 Len=0
Pandora,225,2.181438,172.30.1.250,172.30.1.1,TCP,88,443  >  47074 [ACK] Seq=1 Ack=518 Win=2096128 Len=0
Pandora,226,2.181482,172.30.1.250,172.30.1.1,TCP,88,80  >  57880 [ACK] Seq=1 Ack=256 Win=2096640 Len=0
Pandora,227,2.181524,172.30.1.250,172.30.1.1,TCP,88,80  >  57890 [ACK] Seq=1 Ack=256 Win=2096640 Len=0
Pandora,228,2.181555,172.30.1.1,172.30.1.250,TLSv1.2,604,Client Hello
Pandora,229,2.181642,172.30.1.250,172.30.1.1,TCP,88,443  >  47080 [ACK] Seq=1 Ack=518 Win=2096128 Len=0
Pandora,230,2.181715,172.30.1.1,172.30.1.250,TLSv1.2,604,Client Hello
Pandora,231,2.181802,172.30.1.250,172.30.1.1,TCP,88,443  >  47090 [ACK] Seq=1 Ack=518 Win=2096128 Len=0
Pandora,232,2.183258,172.30.1.250,172.30.1.1,TCP,96,"443  >  47108 [SYN, ACK] Seq=0 Ack=1 Win=4096 Len=0 MSS=9960 WS=512"
Pandora,233,2.183387,172.30.1.1,172.30.1.250,TCP,88,47108  >  443 [ACK] Seq=1 Ack=1 Win=65536 Len=0
Pandora,234,2.187238,172.30.1.250,172.30.1.1,TCP,96,"443  >  47120 [SYN, ACK] Seq=0 Ack=1 Win=4096 Len=0 MSS=9960 WS=512"
Pandora,235,2.187363,172.30.1.1,172.30.1.250,TCP,88,47120  >  443 [ACK] Seq=1 Ack=1 Win=65536 Len=0
Pandora,236,2.187382,172.30.1.250,172.30.1.1,TCP,96,"443  >  47102 [SYN, ACK] Seq=0 Ack=1 Win=4096 Len=0 MSS=9960 WS=512"
Pandora,237,2.187442,172.30.1.1,172.30.1.250,TCP,88,47102  >  443 [ACK] Seq=1 Ack=1 Win=65536 Len=0
Pandora,238,2.188042,172.30.1.1,172.30.1.250,TLSv1.2,604,Client Hello
Pandora,239,2.188205,172.30.1.250,172.30.1.1,TCP,88,443  >  47120 [ACK] Seq=1 Ack=518 Win=2096128 Len=0
Pandora,240,2.188453,172.30.1.1,172.30.1.250,TLSv1.2,604,Client Hello
Pandora,241,2.188667,172.30.1.250,172.30.1.1,TCP,88,443  >  47108 [ACK] Seq=1 Ack=518 Win=2096128 Len=0
Pandora,242,2.188733,172.30.1.1,172.30.1.250,TLSv1.2,604,Client Hello
Pandora,243,2.188912,172.30.1.250,172.30.1.1,TCP,88,443  >  47102 [ACK] Seq=1 Ack=518 Win=2096128 Len=0
Pandora,244,2.213611,172.30.1.250,172.30.1.1,TCP,96,"443  >  57152 [SYN, ACK] Seq=0 Ack=1 Win=4096 Len=0 MSS=9960 WS=512"
Pandora,245,2.213857,172.30.1.1,172.30.1.250,TCP,88,57152  >  443 [ACK] Seq=1 Ack=1 Win=65536 Len=0
Pandora,246,2.215231,172.30.1.1,172.30.1.250,TLSv1.2,604,Client Hello
Pandora,247,2.215621,172.30.1.250,172.30.1.1,TCP,88,443  >  57152 [ACK] Seq=1 Ack=518 Win=2096128 Len=0
Pandora,248,2.219932,172.30.1.250,172.30.1.1,TCP,96,"443  >  38290 [SYN, ACK] Seq=0 Ack=1 Win=4096 Len=0 MSS=9960 WS=512"
Pandora,249,2.220132,172.30.1.1,172.30.1.250,TCP,88,38290  >  443 [ACK] Seq=1 Ack=1 Win=65536 Len=0
Pandora,250,2.220184,172.30.1.250,172.30.1.1,TLSv1.3,1392,"Server Hello, Change Cipher Spec, Application Data"
Pandora,251,2.220422,172.30.1.1,172.30.1.250,TCP,88,42192  >  443 [ACK] Seq=518 Ack=1307 Win=85504 Len=0
Pandora,252,2.222186,172.30.1.1,172.30.1.250,TLSv1.2,604,Client Hello
Pandora,253,2.222884,172.30.1.250,172.30.1.1,TCP,88,443  >  38290 [ACK] Seq=1 Ack=518 Win=2096128 Len=0
Pandora,254,2.22298,172.30.1.250,172.30.1.1,TLSv1.3,4760,"Application Data, Application Data, Application Data"
Pandora,255,2.223076,172.30.1.1,172.30.1.250,TCP,88,42192  >  443 [ACK] Seq=518 Ack=5978 Win=105472 Len=0
Pandora,256,2.228188,172.30.1.1,172.30.1.250,TLSv1.3,152,"Change Cipher Spec, Application Data"
Pandora,257,2.22829,172.30.1.250,172.30.1.1,TCP,88,443  >  42192 [ACK] Seq=5978 Ack=582 Win=2096640 Len=0
Pandora,258,2.228448,172.30.1.1,172.30.1.250,TLSv1.3,308,Application Data
Pandora,259,2.228503,172.30.1.250,172.30.1.1,TCP,88,443  >  42192 [ACK] Seq=5978 Ack=804 Win=2096640 Len=0
Pandora,260,2.233305,172.30.1.250,172.30.1.1,TCP,96,"443  >  57158 [SYN, ACK] Seq=0 Ack=1 Win=4096 Len=0 MSS=9960 WS=512"
Pandora,261,2.23345,172.30.1.250,172.30.1.1,TCP,96,"443  >  57312 [SYN, ACK] Seq=0 Ack=1 Win=4096 Len=0 MSS=9960 WS=512"
Pandora,262,2.233578,172.30.1.1,172.30.1.250,TCP,88,57158  >  443 [ACK] Seq=1 Ack=1 Win=65536 Len=0
Pandora,263,2.233605,172.30.1.1,172.30.1.250,TCP,88,57312  >  443 [ACK] Seq=1 Ack=1 Win=65536 Len=0
Pandora,264,2.234817,172.30.1.1,172.30.1.250,TLSv1.2,604,Client Hello
Pandora,265,2.23496,172.30.1.1,172.30.1.250,TLSv1.2,604,Client Hello
Pandora,266,2.23509,172.30.1.250,172.30.1.1,TCP,88,443  >  57158 [ACK] Seq=1 Ack=518 Win=2096128 Len=0
Pandora,267,2.235165,172.30.1.250,172.30.1.1,TCP,88,443  >  57312 [ACK] Seq=1 Ack=518 Win=2096128 Len=0
Pandora,268,2.235877,172.30.1.250,172.30.1.1,TCP,96,"443  >  50608 [SYN, ACK] Seq=0 Ack=1 Win=4096 Len=0 MSS=9960 WS=512"
Pandora,269,2.235952,172.30.1.1,172.30.1.250,TCP,88,50608  >  443 [ACK] Seq=1 Ack=1 Win=65536 Len=0
Pandora,270,2.235967,172.30.1.250,172.30.1.1,TCP,96,"443  >  57160 [SYN, ACK] Seq=0 Ack=1 Win=4096 Len=0 MSS=9960 WS=512"
Pandora,271,2.236026,172.30.1.1,172.30.1.250,TCP,88,57160  >  443 [ACK] Seq=1 Ack=1 Win=65536 Len=0
Pandora,272,2.23604,172.30.1.250,172.30.1.1,TCP,96,"443  >  57176 [SYN, ACK] Seq=0 Ack=1 Win=4096 Len=0 MSS=9960 WS=512"
Pandora,273,2.236099,172.30.1.1,172.30.1.250,TCP,88,57176  >  443 [ACK] Seq=1 Ack=1 Win=65536 Len=0
Pandora,274,2.236112,172.30.1.250,172.30.1.1,TCP,96,"443  >  57192 [SYN, ACK] Seq=0 Ack=1 Win=4096 Len=0 MSS=9960 WS=512"
Pandora,275,2.236163,172.30.1.1,172.30.1.250,TCP,88,57192  >  443 [ACK] Seq=1 Ack=1 Win=65536 Len=0
Pandora,276,2.236176,172.30.1.250,172.30.1.1,TCP,96,"443  >  57180 [SYN, ACK] Seq=0 Ack=1 Win=4096 Len=0 MSS=9960 WS=512"
Pandora,277,2.236212,172.30.1.1,172.30.1.250,TCP,88,57180  >  443 [ACK] Seq=1 Ack=1 Win=65536 Len=0
Pandora,278,2.236491,172.30.1.250,172.30.1.1,TLSv1.3,1392,"Server Hello, Change Cipher Spec"
Pandora,279,2.236601,172.30.1.1,172.30.1.250,TCP,88,53284  >  443 [ACK] Seq=518 Ack=1307 Win=85504 Len=0
Pandora,280,2.236688,172.30.1.1,172.30.1.250,TLSv1.2,604,Client Hello
Pandora,281,2.236816,172.30.1.1,172.30.1.250,TLSv1.2,604,Client Hello
Pandora,282,2.236981,172.30.1.250,172.30.1.1,TCP,88,443  >  50608 [ACK] Seq=1 Ack=518 Win=2096128 Len=0
Pandora,283,2.237082,172.30.1.250,172.30.1.1,TCP,88,443  >  57192 [ACK] Seq=1 Ack=518 Win=2096128 Len=0
Pandora,284,2.237407,172.30.1.1,172.30.1.250,TLSv1.2,604,Client Hello
Pandora,285,2.23759,172.30.1.250,172.30.1.1,TCP,88,443  >  57180 [ACK] Seq=1 Ack=518 Win=2096128 Len=0
Pandora,286,2.238872,172.30.1.250,172.30.1.1,TLSv1.3,3316,Application Data
Pandora,287,2.238939,172.30.1.1,172.30.1.250,TCP,88,53284  >  443 [ACK] Seq=518 Ack=4535 Win=105472 Len=0
Pandora,288,2.238952,172.30.1.250,172.30.1.1,TCP,96,"443  >  45962 [SYN, ACK] Seq=0 Ack=1 Win=4096 Len=0 MSS=9960 WS=512"
Pandora,289,2.239018,172.30.1.1,172.30.1.250,TCP,88,45962  >  443 [ACK] Seq=1 Ack=1 Win=65536 Len=0
Pandora,290,2.239033,172.30.1.250,172.30.1.1,TCP,96,"443  >  57204 [SYN, ACK] Seq=0 Ack=1 Win=4096 Len=0 MSS=9960 WS=512"
Pandora,291,2.239078,172.30.1.250,172.30.1.1,TCP,96,"443  >  45976 [SYN, ACK] Seq=0 Ack=1 Win=4096 Len=0 MSS=9960 WS=512"
Pandora,292,2.239131,172.30.1.1,172.30.1.250,TCP,88,57204  >  443 [ACK] Seq=1 Ack=1 Win=65536 Len=0
Pandora,293,2.23914,172.30.1.1,172.30.1.250,TCP,88,45976  >  443 [ACK] Seq=1 Ack=1 Win=65536 Len=0
Pandora,294,2.239153,172.30.1.250,172.30.1.1,TCP,96,"443  >  45978 [SYN, ACK] Seq=0 Ack=1 Win=4096 Len=0 MSS=9960 WS=512"
Pandora,295,2.239203,172.30.1.1,172.30.1.250,TCP,88,45978  >  443 [ACK] Seq=1 Ack=1 Win=65536 Len=0
Pandora,296,2.239454,172.30.1.1,172.30.1.250,TLSv1.2,604,Client Hello
Pandora,297,2.239561,172.30.1.250,172.30.1.1,TCP,88,443  >  57204 [ACK] Seq=1 Ack=518 Win=2096128 Len=0
Pandora,298,2.239593,172.30.1.1,172.30.1.250,TLSv1.2,604,Client Hello
Pandora,299,2.239638,172.30.1.1,172.30.1.250,TLSv1.2,604,Client Hello
Pandora,300,2.23971,172.30.1.250,172.30.1.1,TCP,88,443  >  57176 [ACK] Seq=1 Ack=518 Win=2096128 Len=0
Pandora,301,2.239761,172.30.1.250,172.30.1.1,TCP,88,443  >  45962 [ACK] Seq=1 Ack=518 Win=2096128 Len=0
Pandora,302,2.240001,172.30.1.1,172.30.1.250,TLSv1.2,604,Client Hello
Pandora,303,2.240096,172.30.1.250,172.30.1.1,TCP,88,443  >  45976 [ACK] Seq=1 Ack=518 Win=2096128 Len=0
Pandora,304,2.240561,172.30.1.1,172.30.1.250,TLSv1.2,604,Client Hello
Pandora,305,2.240645,172.30.1.250,172.30.1.1,TCP,88,443  >  45978 [ACK] Seq=1 Ack=518 Win=2096128 Len=0
Pandora,306,2.241859,172.30.1.1,172.30.1.250,TLSv1.2,604,Client Hello
Pandora,307,2.24217,172.30.1.250,172.30.1.1,TCP,88,443  >  57160 [ACK] Seq=1 Ack=518 Win=2096128 Len=0
Pandora,308,2.245093,172.30.1.1,172.30.1.250,TLSv1.3,152,"Change Cipher Spec, Application Data"
Pandora,309,2.24523,172.30.1.250,172.30.1.1,TCP,88,443  >  53284 [ACK] Seq=4535 Ack=582 Win=2096640 Len=0
Pandora,310,2.247371,172.30.1.1,172.30.1.250,TLSv1.3,132,Application Data
Pandora,311,2.247437,172.30.1.250,172.30.1.1,TCP,88,443  >  53284 [ACK] Seq=4535 Ack=628 Win=2096640 Len=0
Pandora,312,2.247595,172.30.1.1,172.30.1.250,TLSv1.3,124,Application Data
Pandora,313,2.247613,172.30.1.250,172.30.1.1,TCP,88,443  >  53284 [ACK] Seq=4535 Ack=665 Win=2096640 Len=0
Pandora,314,2.247735,172.30.1.1,172.30.1.250,TLSv1.3,124,Application Data
Pandora,315,2.247784,172.30.1.250,172.30.1.1,TCP,88,443  >  53284 [ACK] Seq=4535 Ack=700 Win=2096640 Len=0
Pandora,316,2.24912,172.30.1.1,172.30.1.250,TLSv1.3,6492,Application Data
Pandora,317,2.249229,172.30.1.250,172.30.1.1,TCP,88,443  >  53284 [ACK] Seq=4535 Ack=7103 Win=2090496 Len=0
Pandora,318,2.26508,172.30.1.250,172.30.1.1,TCP,10048,80  >  57890 [ACK] Seq=1 Ack=256 Win=2097152 Len=9960 [TCP segment of a reassembled PDU]
Pandora,319,2.265308,172.30.1.1,172.30.1.250,TCP,88,57890  >  80 [ACK] Seq=256 Ack=9961 Win=85504 Len=0
Pandora,320,2.265332,172.30.1.250,172.30.1.1,TCP,1180,"80  >  57890 [PSH, ACK] Seq=9961 Ack=256 Win=2097152 Len=1092 [TCP segment of a reassembled PDU]"
Pandora,321,2.265371,172.30.1.1,172.30.1.250,TCP,88,57890  >  80 [ACK] Seq=256 Ack=11053 Win=105472 Len=0
Pandora,322,2.267964,172.30.1.250,172.30.1.1,TCP,8684,"80  >  57890 [PSH, ACK] Seq=11053 Ack=256 Win=2097152 Len=8596 [TCP segment of a reassembled PDU]"
Pandora,323,2.268043,172.30.1.1,172.30.1.250,TCP,88,57890  >  80 [ACK] Seq=256 Ack=19649 Win=125440 Len=0
Pandora,324,2.271253,172.30.1.250,172.30.1.1,TCP,1316,"80  >  57890 [PSH, ACK] Seq=19649 Ack=256 Win=2097152 Len=1228 [TCP segment of a reassembled PDU]"
Pandora,325,2.271316,172.30.1.1,172.30.1.250,TCP,88,57890  >  80 [ACK] Seq=256 Ack=20877 Win=145408 Len=0
Pandora,326,2.274284,172.30.1.250,172.30.1.1,TCP,2544,"80  >  57890 [PSH, ACK] Seq=20877 Ack=256 Win=2097152 Len=2456 [TCP segment of a reassembled PDU]"
Pandora,327,2.274359,172.30.1.1,172.30.1.250,TCP,88,57890  >  80 [ACK] Seq=256 Ack=23333 Win=165376 Len=0
Pandora,328,2.277961,172.30.1.250,172.30.1.1,TLSv1.2,2700,Server Hello
Pandora,329,2.278248,172.30.1.250,172.30.1.1,TCP,7456,"80  >  57890 [PSH, ACK] Seq=23333 Ack=256 Win=2097152 Len=7368 [TCP segment of a reassembled PDU]"
Pandora,330,2.278396,172.30.1.1,172.30.1.250,TCP,88,47074  >  443 [ACK] Seq=518 Ack=2613 Win=85504 Len=0
Pandora,331,2.27843,172.30.1.1,172.30.1.250,TCP,88,57890  >  80 [ACK] Seq=256 Ack=30701 Win=185344 Len=0
Pandora,332,2.288419,172.30.1.250,172.30.1.1,TLSv1.2,736,"Certificate, Server Key Exchange, Server Hello Done"
Pandora,333,2.289791,172.30.1.250,172.30.1.1,TCP,2544,"80  >  57880 [PSH, ACK] Seq=1 Ack=256 Win=2097152 Len=2456 [TCP segment of a reassembled PDU]"
Pandora,334,2.290057,172.30.1.1,172.30.1.250,TCP,88,47074  >  443 [ACK] Seq=518 Ack=3261 Win=91136 Len=0
Pandora,335,2.290086,172.30.1.1,172.30.1.250,TCP,88,57880  >  80 [ACK] Seq=256 Ack=2457 Win=85504 Len=0
Pandora,336,2.29064,172.30.1.250,172.30.1.1,TCP,3772,"80  >  57880 [PSH, ACK] Seq=2457 Ack=256 Win=2097152 Len=3684 [TCP segment of a reassembled PDU]"
Pandora,337,2.29078,172.30.1.1,172.30.1.250,TCP,88,57880  >  80 [ACK] Seq=256 Ack=6141 Win=93184 Len=0
Pandora,338,2.294325,172.30.1.250,172.30.1.1,TCP,7456,"80  >  57880 [PSH, ACK] Seq=6141 Ack=256 Win=2097152 Len=7368 [TCP segment of a reassembled PDU]"
Pandora,339,2.29444,172.30.1.1,172.30.1.250,TCP,88,57880  >  80 [ACK] Seq=256 Ack=13509 Win=113152 Len=0
Pandora,340,2.296805,172.30.1.250,172.30.1.1,TCP,6228,"80  >  57880 [PSH, ACK] Seq=13509 Ack=256 Win=2097152 Len=6140 [TCP segment of a reassembled PDU]"
Pandora,341,2.29688,172.30.1.1,172.30.1.250,TCP,88,57880  >  80 [ACK] Seq=256 Ack=19649 Win=133120 Len=0
Pandora,342,2.300049,172.30.1.1,172.30.1.250,TLSv1.2,212,"Client Key Exchange, Change Cipher Spec, Encrypted Handshake Message"
Pandora,343,2.300147,172.30.1.250,172.30.1.1,TCP,88,443  >  47074 [ACK] Seq=3261 Ack=644 Win=2096640 Len=0
Pandora,344,2.301932,172.30.1.250,172.30.1.1,TLSv1.2,3348,"Server Hello, Certificate, Server Key Exchange, Server Hello Done"
Pandora,345,2.302395,172.30.1.250,172.30.1.1,TCP,2544,"80  >  57880 [PSH, ACK] Seq=19649 Ack=256 Win=2097152 Len=2456 [TCP segment of a reassembled PDU]"
Pandora,346,2.302993,172.30.1.1,172.30.1.250,TCP,88,47060  >  443 [ACK] Seq=518 Ack=3261 Win=85504 Len=0
Pandora,347,2.303029,172.30.1.1,172.30.1.250,TCP,88,57880  >  80 [ACK] Seq=256 Ack=22105 Win=153088 Len=0
Pandora,348,2.303098,172.30.1.250,172.30.1.1,TLSv1.2,3348,"Server Hello, Certificate, Server Key Exchange, Server Hello Done"
Pandora,349,2.30351,172.30.1.1,172.30.1.250,TCP,88,47068  >  443 [ACK] Seq=518 Ack=3261 Win=85504 Len=0
Pandora,350,2.303562,172.30.1.250,172.30.1.1,TLSv1.2,3348,"Server Hello, Certificate, Server Key Exchange, Server Hello Done"
Pandora,351,2.30384,172.30.1.250,172.30.1.1,TLSv1.2,3348,"Server Hello, Certificate, Server Key Exchange, Server Hello Done"
Pandora,352,2.304239,172.30.1.250,172.30.1.1,TLSv1.2,2700,Server Hello
Pandora,353,2.304413,172.30.1.1,172.30.1.250,TCP,88,47080  >  443 [ACK] Seq=518 Ack=3261 Win=85504 Len=0
Pandora,354,2.304439,172.30.1.1,172.30.1.250,TCP,88,47090  >  443 [ACK] Seq=518 Ack=3261 Win=85504 Len=0
Pandora,355,2.30446,172.30.1.1,172.30.1.250,TCP,88,47108  >  443 [ACK] Seq=518 Ack=2613 Win=85504 Len=0
Pandora,356,2.307835,172.30.1.1,172.30.1.250,TLSv1.2,212,"Client Key Exchange, Change Cipher Spec, Encrypted Handshake Message"
Pandora,357,2.30808,172.30.1.250,172.30.1.1,TCP,88,443  >  47080 [ACK] Seq=3261 Ack=644 Win=2096640 Len=0
Pandora,358,2.308276,172.30.1.1,172.30.1.250,TLSv1.2,212,"Client Key Exchange, Change Cipher Spec, Encrypted Handshake Message"
Pandora,359,2.30837,172.30.1.250,172.30.1.1,TCP,88,443  >  47068 [ACK] Seq=3261 Ack=644 Win=2096640 Len=0
Pandora,360,2.3113,172.30.1.1,172.30.1.250,TLSv1.2,212,"Client Key Exchange, Change Cipher Spec, Encrypted Handshake Message"
Pandora,361,2.311492,172.30.1.250,172.30.1.1,TCP,88,443  >  47060 [ACK] Seq=3261 Ack=644 Win=2096640 Len=0
Pandora,362,2.313449,172.30.1.250,172.30.1.1,TLSv1.2,736,"Certificate, Server Key Exchange, Server Hello Done"
Pandora,363,2.313648,172.30.1.1,172.30.1.250,TCP,88,47108  >  443 [ACK] Seq=518 Ack=3261 Win=91136 Len=0
Pandora,364,2.313666,172.30.1.250,172.30.1.1,TCP,1316,"80  >  57890 [PSH, ACK] Seq=30701 Ack=256 Win=2097152 Len=1228 [TCP segment of a reassembled PDU]"
Pandora,365,2.313719,172.30.1.250,172.30.1.1,TLSv1.2,3348,"Server Hello, Certificate, Server Key Exchange, Server Hello Done"
Pandora,366,2.313889,172.30.1.250,172.30.1.1,TLSv1.2,3348,"Server Hello, Certificate, Server Key Exchange, Server Hello Done"
Pandora,367,2.314015,172.30.1.1,172.30.1.250,TCP,88,57890  >  80 [ACK] Seq=256 Ack=31929 Win=205312 Len=0
Pandora,368,2.314022,172.30.1.1,172.30.1.250,TCP,88,47102  >  443 [ACK] Seq=518 Ack=3261 Win=85504 Len=0
Pandora,369,2.314028,172.30.1.1,172.30.1.250,TCP,88,47120  >  443 [ACK] Seq=518 Ack=3261 Win=85504 Len=0
