App name,No.,Time,Source,Destination,Protocol,Length,Info
Google Fi,1,0,172.30.1.1,172.30.1.250,DNS,124,Standard query 0x4a51 A connectivitycheck.gstatic.com
Google Play service,2,0.009306,172.30.1.1,172.30.1.250,DNS,132,Standard query 0x016e A telephonyspamprotect-pa.googleapis.com
Google Fi,3,0.035201,172.30.1.1,172.30.1.250,DNS,140,Standard query response 0x4a51 A connectivitycheck.gstatic.com A 142.250.80.67
Google Play service,4,0.0354,172.30.1.1,172.30.1.250,DNS,388,Standard query response 0x016e A telephonyspamprotect-pa.googleapis.com A 142.250.80.10 A 142.250.80.42 A 142.250.80.74 A 142.250.80.106 A 142.250.176.202 A 142.251.40.202 A 142.251.40.234 A 172.217.165.138 A 142.250.65.234 A 142.251.41.10 A 142.251.32.106 A 142.251.35.170 A 142.251.40.170 A 142.250.64.74 A 142.250.64.106 A 142.250.72.106
Messenger,5,0.223711,172.30.1.1,172.30.1.250,DNS,116,Standard query 0xff0e A edge-mqtt.facebook.com
Messenger,6,0.224678,172.30.1.1,172.30.1.250,TCP,108,35052  >  443 [SYN] Seq=0 Win=65535 Len=0 MSS=9960 SACK_PERM=1 TSval=3540614364 TSecr=0 WS=256
Messenger,7,0.246341,172.30.1.1,172.30.1.250,DNS,156,Standard query response 0xff0e A edge-mqtt.facebook.com CNAME mqtt.c10r.facebook.com A 157.240.245.17
Messenger,8,0.246752,172.30.1.250,172.30.1.1,TCP,96,"443  >  35052 [SYN, ACK] Seq=0 Ack=1 Win=2048 Len=0 MSS=9960 WS=256"
Messenger,9,0.246808,172.30.1.1,172.30.1.250,TCP,88,35052  >  443 [ACK] Seq=1 Ack=1 Win=65536 Len=0
Messenger,10,0.249412,172.30.1.1,172.30.1.250,TLSv1.3,488,Client Hello
Messenger,11,0.249517,172.30.1.250,172.30.1.1,TCP,88,443  >  35052 [ACK] Seq=1 Ack=400 Win=523776 Len=0
Messenger,12,0.250796,172.30.1.1,172.30.1.250,TLSv1.3,496,"Change Cipher Spec, Application Data"
Messenger,13,0.250867,172.30.1.250,172.30.1.1,TCP,88,443  >  35052 [ACK] Seq=1 Ack=809 Win=523264 Len=0
Messenger,14,0.274376,172.30.1.250,172.30.1.1,TLSv1.3,304,"Server Hello, Change Cipher Spec, Application Data"
Messenger,15,0.274524,172.30.1.1,172.30.1.250,TCP,88,35052  >  443 [ACK] Seq=809 Ack=217 Win=66816 Len=0
Messenger,16,0.274537,172.30.1.250,172.30.1.1,TLSv1.3,204,"Application Data, Application Data"
Messenger,17,0.274564,172.30.1.1,172.30.1.250,TCP,88,35052  >  443 [ACK] Seq=809 Ack=335 Win=66816 Len=0
Messenger,18,0.277139,172.30.1.1,172.30.1.250,TLSv1.3,172,"Application Data, Application Data"
Messenger,19,0.277202,172.30.1.250,172.30.1.1,TCP,88,443  >  35052 [ACK] Seq=335 Ack=893 Win=524032 Len=0
Messenger,20,0.279731,172.30.1.1,172.30.1.250,TLSv1.3,120,Application Data
Messenger,21,0.279813,172.30.1.250,172.30.1.1,TCP,88,443  >  35052 [ACK] Seq=335 Ack=924 Win=524032 Len=0
Messenger,22,0.298429,172.30.1.250,172.30.1.1,TLSv1.3,268,Application Data
Messenger,23,0.298602,172.30.1.1,172.30.1.250,TCP,88,35052  >  443 [ACK] Seq=924 Ack=514 Win=67840 Len=0
Messenger,24,0.314518,172.30.1.250,172.30.1.1,TLSv1.3,168,Application Data
Messenger,25,0.314618,172.30.1.1,172.30.1.250,TCP,88,35052  >  443 [ACK] Seq=924 Ack=596 Win=67840 Len=0
Messenger,26,0.403636,172.30.1.1,172.30.1.250,TLSv1.3,344,Application Data
Messenger,27,0.403823,172.30.1.250,172.30.1.1,TCP,88,443  >  35052 [ACK] Seq=596 Ack=1182 Win=523776 Len=0
Messenger,28,0.404107,172.30.1.1,172.30.1.250,TLSv1.3,140,Application Data
Messenger,29,0.404122,172.30.1.250,172.30.1.1,TCP,88,443  >  35052 [ACK] Seq=596 Ack=1234 Win=523776 Len=0
Messenger,30,0.41554,172.30.1.1,172.30.1.250,TLSv1.3,312,Application Data
Messenger,31,0.415744,172.30.1.250,172.30.1.1,TCP,88,443  >  35052 [ACK] Seq=596 Ack=1458 Win=523520 Len=0
Messenger,32,0.422952,172.30.1.1,172.30.1.250,TLSv1.3,352,Application Data
Messenger,33,0.423268,172.30.1.250,172.30.1.1,TCP,88,443  >  35052 [ACK] Seq=596 Ack=1723 Win=523264 Len=0
Messenger,34,0.43663,172.30.1.1,172.30.1.250,TLSv1.3,324,Application Data
Messenger,35,0.436833,172.30.1.250,172.30.1.1,TCP,88,443  >  35052 [ACK] Seq=596 Ack=1960 Win=523008 Len=0
Messenger,36,0.437767,172.30.1.1,172.30.1.250,TLSv1.3,444,Application Data
Messenger,37,0.437854,172.30.1.250,172.30.1.1,TCP,88,443  >  35052 [ACK] Seq=596 Ack=2318 Win=522752 Len=0
Messenger,38,0.45183,172.30.1.1,172.30.1.250,TLSv1.3,388,Application Data
Messenger,39,0.451995,172.30.1.250,172.30.1.1,TCP,88,443  >  35052 [ACK] Seq=596 Ack=2620 Win=523264 Len=0
Messenger,40,0.484511,172.30.1.250,172.30.1.1,TLSv1.3,124,Application Data
Messenger,41,0.484674,172.30.1.1,172.30.1.250,TCP,88,35052  >  443 [ACK] Seq=2620 Ack=631 Win=67840 Len=0
Messenger,42,0.496324,172.30.1.1,172.30.1.250,DNS,120,Standard query 0xce03 A chat-e2ee-mini.facebook.com
Messenger,43,0.498469,172.30.1.1,172.30.1.250,DNS,108,Standard query 0x335d A web.facebook.com
Messenger,44,0.499893,172.30.1.1,172.30.1.250,TCP,108,38424  >  443 [SYN] Seq=0 Win=65535 Len=0 MSS=9960 SACK_PERM=1 TSval=342313641 TSecr=0 WS=256
Messenger,45,0.500728,172.30.1.1,172.30.1.250,TLSv1.3,312,Application Data
Messenger,46,0.5008,172.30.1.250,172.30.1.1,TCP,88,443  >  35052 [ACK] Seq=631 Ack=2846 Win=524032 Len=0
Messenger,47,0.522822,172.30.1.250,172.30.1.1,TLSv1.3,160,"Application Data, Application Data"
Messenger,48,0.522973,172.30.1.1,172.30.1.250,TCP,88,35052  >  443 [ACK] Seq=2846 Ack=705 Win=67840 Len=0
Messenger,49,0.526369,172.30.1.250,172.30.1.1,TLSv1.3,524,"Application Data, Application Data, Application Data, Application Data"
Messenger,50,0.526461,172.30.1.1,172.30.1.250,TCP,88,35052  >  443 [ACK] Seq=2846 Ack=1142 Win=68864 Len=0
Messenger,51,0.530615,172.30.1.250,172.30.1.1,TLSv1.3,324,Application Data
Messenger,52,0.530772,172.30.1.1,172.30.1.250,TCP,88,35052  >  443 [ACK] Seq=2846 Ack=1378 Win=69888 Len=0
Messenger,53,0.546475,172.30.1.1,172.30.1.250,DNS,168,Standard query response 0x335d A web.facebook.com CNAME star.facebook.com CNAME star.c10r.facebook.com A 157.240.245.13
Messenger,54,0.586788,172.30.1.1,172.30.1.250,DNS,172,Standard query response 0xce03 A chat-e2ee-mini.facebook.com CNAME chat-e2ee-mini.c10r.facebook.com A 157.240.245.38
Messenger,55,0.587314,172.30.1.250,172.30.1.1,TCP,96,"443  >  38424 [SYN, ACK] Seq=0 Ack=1 Win=2048 Len=0 MSS=9960 WS=256"
Messenger,56,0.587563,172.30.1.1,172.30.1.250,TCP,88,38424  >  443 [ACK] Seq=1 Ack=1 Win=65536 Len=0
Messenger,57,0.590671,172.30.1.250,172.30.1.1,TLSv1.3,124,Application Data
Messenger,58,0.597831,172.30.1.1,172.30.1.250,TLSv1.3,496,Client Hello
Messenger,59,0.59994,172.30.1.1,172.30.1.250,TCP,108,35064  >  5222 [SYN] Seq=0 Win=65535 Len=0 MSS=9960 SACK_PERM=1 TSval=3168891735 TSecr=0 WS=256
Messenger,60,0.601812,172.30.1.1,172.30.1.250,TCP,88,35052  >  443 [ACK] Seq=2846 Ack=1413 Win=69888 Len=0
Messenger,61,0.602211,172.30.1.250,172.30.1.1,TCP,88,443  >  38424 [ACK] Seq=1 Ack=411 Win=523776 Len=0
Messenger,62,0.629268,172.30.1.250,172.30.1.1,TCP,96,"5222  >  35064 [SYN, ACK] Seq=0 Ack=1 Win=2048 Len=0 MSS=9960 WS=256"
Messenger,63,0.629512,172.30.1.1,172.30.1.250,TCP,88,35064  >  5222 [ACK] Seq=1 Ack=1 Win=65536 Len=0
Messenger,64,0.630314,172.30.1.1,172.30.1.250,TCP,92,"35064  >  5222 [PSH, ACK] Seq=1 Ack=1 Win=65536 Len=4 [TCP segment of a reassembled PDU]"
Messenger,65,0.630443,172.30.1.1,172.30.1.250,TCP,96,"35064  >  5222 [PSH, ACK] Seq=5 Ack=1 Win=65536 Len=7 [TCP segment of a reassembled PDU]"
Messenger,66,0.630577,172.30.1.250,172.30.1.1,TCP,88,5222  >  35064 [ACK] Seq=1 Ack=12 Win=524032 Len=0
Messenger,67,0.634278,172.30.1.1,172.30.1.250,TCP,92,"35064  >  5222 [PSH, ACK] Seq=12 Ack=1 Win=65536 Len=4 [TCP segment of a reassembled PDU]"
Messenger,68,0.634414,172.30.1.250,172.30.1.1,TCP,88,5222  >  35064 [ACK] Seq=1 Ack=16 Win=524032 Len=0
Messenger,69,0.635647,172.30.1.1,172.30.1.250,TCP,1840,"35064  >  5222 [PSH, ACK] Seq=16 Ack=1 Win=65536 Len=1752 [TCP segment of a reassembled PDU]"
Messenger,70,0.635784,172.30.1.250,172.30.1.1,TCP,88,5222  >  35064 [ACK] Seq=1 Ack=1768 Win=522496 Len=0
Messenger,71,0.63697,172.30.1.250,172.30.1.1,TLSv1.3,300,"Server Hello, Change Cipher Spec, Application Data"
Messenger,72,0.637098,172.30.1.1,172.30.1.250,TCP,88,38424  >  443 [ACK] Seq=411 Ack=213 Win=66816 Len=0
Messenger,73,0.63842,172.30.1.1,172.30.1.250,TLSv1.3,164,"Change Cipher Spec, Application Data"
Messenger,74,0.63853,172.30.1.250,172.30.1.1,TCP,88,443  >  38424 [ACK] Seq=213 Ack=487 Win=524032 Len=0
Messenger,75,0.639469,172.30.1.1,172.30.1.250,TLSv1.3,1596,Application Data
Messenger,76,0.63957,172.30.1.250,172.30.1.1,TCP,88,443  >  38424 [ACK] Seq=213 Ack=1997 Win=522496 Len=0
Messenger,77,0.660137,172.30.1.250,172.30.1.1,TLSv1.3,340,"Application Data, Application Data"
Messenger,78,0.660282,172.30.1.1,172.30.1.250,TCP,88,38424  >  443 [ACK] Seq=1997 Ack=466 Win=67840 Len=0
Messenger,79,0.660879,172.30.1.1,172.30.1.250,TLSv1.3,124,Application Data
Messenger,80,0.660972,172.30.1.250,172.30.1.1,TCP,88,443  >  38424 [ACK] Seq=466 Ack=2035 Win=522496 Len=0
Messenger,81,0.666174,172.30.1.250,172.30.1.1,TLSv1.3,292,Application Data
Messenger,82,0.666342,172.30.1.250,172.30.1.1,TLSv1.3,132,Application Data
Messenger,83,0.666432,172.30.1.1,172.30.1.250,TCP,88,35052  >  443 [ACK] Seq=2846 Ack=1617 Win=70912 Len=0
Messenger,84,0.666444,172.30.1.1,172.30.1.250,TCP,88,38424  >  443 [ACK] Seq=2035 Ack=510 Win=67840 Len=0
Messenger,85,0.714627,172.30.1.250,172.30.1.1,TCP,144,"5222  >  35064 [PSH, ACK] Seq=1 Ack=1768 Win=524288 Len=57 [TCP segment of a reassembled PDU]"
Messenger,86,0.714828,172.30.1.1,172.30.1.250,TCP,88,35064  >  5222 [ACK] Seq=1768 Ack=58 Win=65536 Len=0
Messenger,87,0.722649,172.30.1.250,172.30.1.1,TCP,144,"5222  >  35064 [PSH, ACK] Seq=58 Ack=1768 Win=524288 Len=57 [TCP segment of a reassembled PDU]"
Messenger,88,0.722875,172.30.1.1,172.30.1.250,TCP,88,35064  >  5222 [ACK] Seq=1768 Ack=115 Win=65536 Len=0
Messenger,89,0.745243,172.30.1.1,172.30.1.250,TCP,132,"35064  >  5222 [PSH, ACK] Seq=1768 Ack=115 Win=65536 Len=44 [TCP segment of a reassembled PDU]"
Messenger,90,0.745458,172.30.1.250,172.30.1.1,TCP,88,5222  >  35064 [ACK] Seq=115 Ack=1812 Win=524032 Len=0
Messenger,91,0.774629,172.30.1.250,172.30.1.1,TLSv1.3,2316,"Application Data, Application Data"
Messenger,92,0.774779,172.30.1.1,172.30.1.250,TCP,88,38424  >  443 [ACK] Seq=2035 Ack=2738 Win=87808 Len=0
Messenger,93,0.802734,172.30.1.250,172.30.1.1,TLSv1.3,396,Application Data
Messenger,94,0.802967,172.30.1.1,172.30.1.250,TCP,88,35052  >  443 [ACK] Seq=2846 Ack=1927 Win=72192 Len=0
Messenger,95,0.846915,172.30.1.250,172.30.1.1,TLSv1.3,308,Application Data
Messenger,96,0.847253,172.30.1.1,172.30.1.250,TCP,88,35052  >  443 [ACK] Seq=2846 Ack=2149 Win=73216 Len=0
Messenger,97,0.874653,172.30.1.250,172.30.1.1,TCP,184,"5222  >  35064 [PSH, ACK] Seq=115 Ack=1812 Win=524288 Len=96 [TCP segment of a reassembled PDU]"
Messenger,98,0.874827,172.30.1.1,172.30.1.250,TCP,88,35064  >  5222 [ACK] Seq=1812 Ack=211 Win=65536 Len=0
Messenger,99,0.930832,172.30.1.250,172.30.1.1,TCP,124,"5222  >  35064 [PSH, ACK] Seq=211 Ack=1812 Win=524288 Len=37 [TCP segment of a reassembled PDU]"
Messenger,100,0.931298,172.30.1.1,172.30.1.250,TCP,88,35064  >  5222 [ACK] Seq=1812 Ack=248 Win=65536 Len=0
netd,101,0.964334,172.30.1.250,172.30.1.1,TCP,108,48038  >  853 [SYN] Seq=0 Win=65535 Len=0 MSS=1460 SACK_PERM=1 TSval=3006667980 TSecr=0 WS=256
netd,102,2.978451,172.30.1.250,172.30.1.1,TCP,108,[TCP Retransmission] 48038  >  853 [SYN] Seq=0 Win=65535 Len=0 MSS=1460 SACK_PERM=1 TSval=3006669996 TSecr=0 WS=256
Google Play service,103,4.992565,172.30.1.1,172.30.1.250,DNS,108,Standard query 0xc51f A mtalk.google.com
Google Play service,104,5.018289,172.30.1.1,172.30.1.250,DNS,156,Standard query response 0xc51f A mtalk.google.com CNAME mobile-gtalk.l.google.com A 142.251.16.188
Google Play service,105,5.02838,172.30.1.1,172.30.1.250,TCP,108,59034  >  5228 [SYN] Seq=0 Win=65535 Len=0 MSS=9960 SACK_PERM=1 TSval=1445637693 TSecr=0 WS=256
Google Play service,106,5.05704,172.30.1.250,172.30.1.1,TCP,96,"5228  >  59034 [SYN, ACK] Seq=0 Ack=1 Win=2048 Len=0 MSS=9960 WS=256"
Google Play service,107,5.057322,172.30.1.1,172.30.1.250,TCP,88,59034  >  5228 [ACK] Seq=1 Ack=1 Win=65536 Len=0
Google Play service,108,5.059077,172.30.1.1,172.30.1.250,TLSv1.3,624,Client Hello
Google Play service,109,5.059426,172.30.1.250,172.30.1.1,TCP,88,5228  >  59034 [ACK] Seq=1 Ack=537 Win=523520 Len=0
Google Play service,110,5.100296,172.30.1.250,172.30.1.1,TLSv1.3,292,"Server Hello, Change Cipher Spec, Application Data"
Google Play service,111,5.100551,172.30.1.1,172.30.1.250,TCP,88,59034  >  5228 [ACK] Seq=537 Ack=204 Win=66816 Len=0
Google Play service,112,5.101141,172.30.1.1,172.30.1.250,TLSv1.3,152,"Change Cipher Spec, Application Data"
Google Play service,113,5.10122,172.30.1.250,172.30.1.1,TCP,88,5228  >  59034 [ACK] Seq=204 Ack=601 Win=524032 Len=0
Google Play service,114,5.10497,172.30.1.1,172.30.1.250,TLSv1.3,484,Application Data
Google Play service,115,5.105073,172.30.1.250,172.30.1.1,TCP,88,5228  >  59034 [ACK] Seq=204 Ack=999 Win=523776 Len=0
Google Play service,116,5.146507,172.30.1.250,172.30.1.1,TLSv1.3,624,"Application Data, Application Data"
Google Play service,117,5.146647,172.30.1.1,172.30.1.250,TCP,88,59034  >  5228 [ACK] Seq=999 Ack=739 Win=67840 Len=0
Google Play service,118,5.165802,172.30.1.250,172.30.1.1,TLSv1.3,204,"Application Data, Application Data"
Google Play service,119,5.165941,172.30.1.1,172.30.1.250,TCP,88,59034  >  5228 [ACK] Seq=999 Ack=857 Win=67840 Len=0
netd,120,7.203191,172.30.1.250,172.30.1.1,TCP,108,[TCP Retransmission] 48038  >  853 [SYN] Seq=0 Win=65535 Len=0 MSS=1460 SACK_PERM=1 TSval=3006674220 TSecr=0 WS=256
netd,121,15.394456,172.30.1.250,172.30.1.1,TCP,108,[TCP Retransmission] 48038  >  853 [SYN] Seq=0 Win=65535 Len=0 MSS=1460 SACK_PERM=1 TSval=3006682412 TSecr=0 WS=256
Gmail,122,19.205945,172.30.1.1,172.30.1.250,DNS,108,Standard query 0x7e77 A inbox.google.com
Gmail,123,19.273508,172.30.1.1,172.30.1.250,DNS,124,Standard query response 0x7e77 A inbox.google.com A 142.250.72.101
Gmail,124,19.283842,172.30.1.1,172.30.1.250,TCP,108,57524  >  443 [SYN] Seq=0 Win=65535 Len=0 MSS=9960 SACK_PERM=1 TSval=1094156816 TSecr=0 WS=256
Gmail,125,19.329527,172.30.1.250,172.30.1.1,TCP,96,"443  >  57524 [SYN, ACK] Seq=0 Ack=1 Win=2048 Len=0 MSS=9960 WS=256"
Gmail,126,19.329761,172.30.1.1,172.30.1.250,TCP,88,57524  >  443 [ACK] Seq=1 Ack=1 Win=65536 Len=0
Gmail,127,19.331039,172.30.1.1,172.30.1.250,TLSv1.3,604,Client Hello
Gmail,128,19.331326,172.30.1.250,172.30.1.1,TCP,88,443  >  57524 [ACK] Seq=1 Ack=518 Win=523520 Len=0
Gmail,129,19.41306,172.30.1.250,172.30.1.1,TLSv1.3,4512,"Server Hello, Change Cipher Spec, Application Data"
Gmail,130,19.413273,172.30.1.1,172.30.1.250,TCP,88,57524  >  443 [ACK] Seq=518 Ack=4424 Win=85504 Len=0
Google Fi,131,19.425212,172.30.1.1,172.30.1.250,DNS,112,Standard query 0x31c8 A lens.l.google.com
Google Fi,132,19.454307,172.30.1.1,172.30.1.250,DNS,128,Standard query response 0x31c8 A lens.l.google.com A 108.177.122.127
Gmail,133,19.5109,172.30.1.1,172.30.1.250,TLSv1.3,160,"Change Cipher Spec, Application Data"
Gmail,134,19.511075,172.30.1.250,172.30.1.1,TCP,88,443  >  57524 [ACK] Seq=4424 Ack=592 Win=524032 Len=0
Gmail,135,19.514699,172.30.1.1,172.30.1.250,TLSv1.3,180,Application Data
Gmail,136,19.514792,172.30.1.250,172.30.1.1,TCP,88,443  >  57524 [ACK] Seq=4424 Ack=684 Win=524032 Len=0
Gmail,137,19.515333,172.30.1.1,172.30.1.250,TLSv1.3,1008,Application Data
Gmail,138,19.51539,172.30.1.250,172.30.1.1,TCP,88,443  >  57524 [ACK] Seq=4424 Ack=1604 Win=523008 Len=0
Gmail,139,19.541558,172.30.1.250,172.30.1.1,TLSv1.3,972,"Application Data, Application Data, Application Data"
Gmail,140,19.541656,172.30.1.1,172.30.1.250,TCP,88,57524  >  443 [ACK] Seq=1604 Ack=5309 Win=94464 Len=0
Gmail,141,19.583686,172.30.1.1,172.30.1.250,TLSv1.3,120,Application Data
Gmail,142,19.583727,172.30.1.1,172.30.1.250,TLSv1.3,364,Application Data
Gmail,143,19.583902,172.30.1.250,172.30.1.1,TCP,88,443  >  57524 [ACK] Seq=5309 Ack=1910 Win=523776 Len=0
Gmail,144,19.761066,172.30.1.250,172.30.1.1,TLSv1.3,1148,Application Data
Gmail,145,19.761193,172.30.1.1,172.30.1.250,TCP,88,57524  >  443 [ACK] Seq=1910 Ack=6368 Win=103168 Len=0
Gmail,146,19.766644,172.30.1.250,172.30.1.1,TLSv1.3,972,"Application Data, Application Data, Application Data, Application Data"
Gmail,147,19.766722,172.30.1.1,172.30.1.250,TCP,88,57524  >  443 [ACK] Seq=1910 Ack=7252 Win=112128 Len=0
Google Fi,148,19.782808,172.30.1.1,172.30.1.250,DNS,116,Standard query 0x4898 A android.googleapis.com
Google Fi,149,19.811947,172.30.1.1,172.30.1.250,DNS,372,Standard query response 0x4898 A android.googleapis.com A 142.250.80.74 A 142.250.80.106 A 142.251.40.234 A 172.217.165.138 A 142.250.65.234 A 142.250.81.234 A 142.251.41.10 A 142.251.32.106 A 142.251.35.170 A 142.251.40.106 A 142.251.40.138 A 142.251.40.170 A 142.250.64.74 A 142.250.72.106 A 142.250.80.10 A 142.250.80.42
Gmail,150,19.813839,172.30.1.1,172.30.1.250,TLSv1.3,128,Application Data
Gmail,151,19.814028,172.30.1.250,172.30.1.1,TCP,88,443  >  57524 [ACK] Seq=7252 Ack=1949 Win=524032 Len=0
Google Fi,152,19.82093,172.30.1.1,172.30.1.250,UDP,1324,55429  >  443 Len=1250
Google Fi,153,19.833529,172.30.1.1,172.30.1.250,UDP,156,55429  >  443 Len=79
Google Fi,154,19.858399,172.30.1.250,172.30.1.1,UDP,1324,443  >  55429 Len=1250
Google Fi,155,19.85861,172.30.1.250,172.30.1.1,UDP,868,443  >  55429 Len=792
Google Fi,156,19.861287,172.30.1.250,172.30.1.1,UDP,160,443  >  55429 Len=83
Google Fi,157,19.862149,172.30.1.1,172.30.1.250,UDP,1324,55429  >  443 Len=1250
Google Fi,158,19.862451,172.30.1.1,172.30.1.250,UDP,108,55429  >  443 Len=33
Google Fi,159,19.863253,172.30.1.1,172.30.1.250,UDP,1320,55429  >  443 Len=1246
Google Fi,160,19.863409,172.30.1.1,172.30.1.250,UDP,532,55429  >  443 Len=456
Google Fi,161,19.863587,172.30.1.1,172.30.1.250,UDP,252,55429  >  443 Len=178
Google Fi,162,19.884904,172.30.1.250,172.30.1.1,UDP,200,443  >  55429 Len=126
Google Fi,163,19.885058,172.30.1.250,172.30.1.1,UDP,100,443  >  55429 Len=25
Google Fi,164,19.885107,172.30.1.250,172.30.1.1,UDP,104,443  >  55429 Len=29
Google Fi,165,19.886949,172.30.1.1,172.30.1.250,UDP,108,55429  >  443 Len=33
Google Fi,166,20.404847,172.30.1.250,172.30.1.1,UDP,636,443  >  55429 Len=561
Google Fi,167,20.407641,172.30.1.250,172.30.1.1,UDP,100,443  >  55429 Len=25
Google Fi,168,20.409475,172.30.1.250,172.30.1.1,UDP,636,443  >  55429 Len=561
Google Fi,169,20.410184,172.30.1.1,172.30.1.250,UDP,112,55429  >  443 Len=36
Google Fi,170,20.410451,172.30.1.1,172.30.1.250,UDP,108,55429  >  443 Len=33
Google Fi,171,20.457627,172.30.1.250,172.30.1.1,UDP,100,443  >  55429 Len=25
Gmail,172,28.047265,172.30.1.1,172.30.1.250,TLSv1.3,1084,Application Data
Gmail,173,28.047455,172.30.1.250,172.30.1.1,TCP,88,443  >  57524 [ACK] Seq=7252 Ack=2946 Win=523264 Len=0
Gmail,174,28.047522,172.30.1.1,172.30.1.250,TLSv1.3,144,Application Data
Gmail,175,28.047537,172.30.1.250,172.30.1.1,TCP,88,443  >  57524 [ACK] Seq=7252 Ack=3003 Win=523008 Len=0
Gmail,176,28.109609,172.30.1.1,172.30.1.250,TLSv1.3,560,Application Data
Gmail,177,28.109713,172.30.1.250,172.30.1.1,TCP,88,443  >  57524 [ACK] Seq=7252 Ack=3476 Win=523776 Len=0
Gmail,178,28.111637,172.30.1.1,172.30.1.250,TLSv1.3,204,Application Data
Gmail,179,28.11179,172.30.1.250,172.30.1.1,TCP,88,443  >  57524 [ACK] Seq=7252 Ack=3594 Win=523520 Len=0
Gmail,180,28.400075,172.30.1.250,172.30.1.1,TLSv1.3,3188,"Application Data, Application Data, Application Data"
Gmail,181,28.400268,172.30.1.1,172.30.1.250,TCP,88,57524  >  443 [ACK] Seq=3594 Ack=10351 Win=132096 Len=0
Gmail,182,28.400288,172.30.1.250,172.30.1.1,TLSv1.3,5256,"Application Data, Application Data, Application Data, Application Data, Application Data, Application Data, Application Data, Application Data, Application Data, Application Data"
Gmail,183,28.400328,172.30.1.1,172.30.1.250,TCP,88,57524  >  443 [ACK] Seq=3594 Ack=15519 Win=152064 Len=0
Gmail,184,28.402081,172.30.1.1,172.30.1.250,TLSv1.3,124,Application Data
Gmail,185,28.40212,172.30.1.1,172.30.1.250,TLSv1.3,128,Application Data
Gmail,186,28.402296,172.30.1.250,172.30.1.1,TCP,88,443  >  57524 [ACK] Seq=15519 Ack=3668 Win=524032 Len=0
Google Play service,187,28.407905,172.30.1.1,172.30.1.250,TCP,108,37858  >  443 [SYN] Seq=0 Win=65535 Len=0 MSS=9960 SACK_PERM=1 TSval=3375146520 TSecr=0 WS=256
Google Play service,188,28.436486,172.30.1.250,172.30.1.1,TCP,96,"443  >  37858 [SYN, ACK] Seq=0 Ack=1 Win=2048 Len=0 MSS=9960 WS=256"
Google Play service,189,28.436729,172.30.1.1,172.30.1.250,TCP,88,37858  >  443 [ACK] Seq=1 Ack=1 Win=65536 Len=0
Gmail,190,28.438812,172.30.1.1,172.30.1.250,DNS,112,Standard query 0x0613 A www.googleapis.com
Gmail,191,28.446393,172.30.1.1,172.30.1.250,DNS,368,Standard query response 0x0613 A www.googleapis.com A 142.250.80.106 A 142.250.80.74 A 142.250.80.42 A 142.250.72.106 A 142.250.64.106 A 142.250.64.74 A 142.251.40.170 A 142.251.40.138 A 142.251.40.106 A 142.251.35.170 A 142.251.32.106 A 142.250.65.234 A 172.217.165.138 A 142.251.40.234 A 142.251.40.202 A 142.250.176.202
Gmail,192,28.44884,172.30.1.1,172.30.1.250,UDP,1324,46121  >  443 Len=1250
Google Play service,193,28.462245,172.30.1.1,172.30.1.250,TLSv1.3,632,Client Hello
Google Play service,194,28.462439,172.30.1.250,172.30.1.1,TCP,88,443  >  37858 [ACK] Seq=1 Ack=545 Win=523520 Len=0
Google Play service,195,28.476044,172.30.1.1,172.30.1.250,TCP,108,37862  >  443 [SYN] Seq=0 Win=65535 Len=0 MSS=9960 SACK_PERM=1 TSval=3375146587 TSecr=0 WS=256
Gmail,196,28.477439,172.30.1.250,172.30.1.1,UDP,1324,443  >  46121 Len=1250
Gmail,197,28.479974,172.30.1.1,172.30.1.250,UDP,1324,46121  >  443 Len=1250
Gmail,198,28.48732,172.30.1.250,172.30.1.1,UDP,1324,443  >  46121 Len=1250
Gmail,199,28.487401,172.30.1.250,172.30.1.1,UDP,1324,443  >  46121 Len=1250
Gmail,200,28.487645,172.30.1.1,172.30.1.250,UDP,116,46121  >  443 Len=41
Gmail,201,28.488153,172.30.1.1,172.30.1.250,TLSv1.3,720,Application Data
Gmail,202,28.488208,172.30.1.250,172.30.1.1,TCP,88,443  >  57524 [ACK] Seq=15519 Ack=4301 Win=523520 Len=0
Gmail,203,28.488386,172.30.1.1,172.30.1.250,TLSv1.3,144,Application Data
Gmail,204,28.488423,172.30.1.250,172.30.1.1,TCP,88,443  >  57524 [ACK] Seq=15519 Ack=4358 Win=523520 Len=0
Google Play service,205,28.497608,172.30.1.250,172.30.1.1,TLSv1.3,292,"Server Hello, Change Cipher Spec, Application Data"
Google Play service,206,28.497782,172.30.1.1,172.30.1.250,TCP,88,37858  >  443 [ACK] Seq=545 Ack=204 Win=66816 Len=0
Gmail,207,28.506567,172.30.1.1,172.30.1.250,TCP,108,49622  >  443 [SYN] Seq=0 Win=65535 Len=0 MSS=9960 SACK_PERM=1 TSval=2114040542 TSecr=0 WS=256
Gmail,208,28.507985,172.30.1.250,172.30.1.1,UDP,1324,443  >  46121 Len=1250
Google Play service,209,28.508064,172.30.1.250,172.30.1.1,TCP,96,"443  >  37862 [SYN, ACK] Seq=0 Ack=1 Win=2048 Len=0 MSS=9960 WS=256"
Google Play service,210,28.508171,172.30.1.1,172.30.1.250,TCP,88,37862  >  443 [ACK] Seq=1 Ack=1 Win=65536 Len=0
Gmail,211,28.508186,172.30.1.250,172.30.1.1,UDP,248,443  >  46121 Len=172
Gmail,212,28.508994,172.30.1.1,172.30.1.250,UDP,116,46121  >  443 Len=41
Google Play service,213,28.511514,172.30.1.1,172.30.1.250,TLSv1.3,632,Client Hello
Google Play service,214,28.511831,172.30.1.250,172.30.1.1,TCP,88,443  >  37862 [ACK] Seq=1 Ack=545 Win=523520 Len=0
Gmail,215,28.530469,172.30.1.250,172.30.1.1,TCP,96,"443  >  49622 [SYN, ACK] Seq=0 Ack=1 Win=2048 Len=0 MSS=9960 WS=256"
Gmail,216,28.53057,172.30.1.1,172.30.1.250,TCP,88,49622  >  443 [ACK] Seq=1 Ack=1 Win=65536 Len=0
Gmail,217,28.538827,172.30.1.1,172.30.1.250,UDP,160,46121  >  443 Len=83
Gmail,218,28.539236,172.30.1.1,172.30.1.250,UDP,148,46121  >  443 Len=72
Gmail,219,28.539971,172.30.1.1,172.30.1.250,UDP,108,46121  >  443 Len=33
Gmail,220,28.540783,172.30.1.1,172.30.1.250,TLSv1.3,604,Client Hello
Gmail,221,28.540928,172.30.1.250,172.30.1.1,TCP,88,443  >  49622 [ACK] Seq=1 Ack=518 Win=523520 Len=0
Google Play service,222,28.542453,172.30.1.1,172.30.1.250,TLSv1.3,152,"Change Cipher Spec, Application Data"
Google Play service,223,28.542604,172.30.1.250,172.30.1.1,TCP,88,443  >  37858 [ACK] Seq=204 Ack=609 Win=524032 Len=0
Gmail,224,28.54382,172.30.1.1,172.30.1.250,DNS,124,Standard query 0xf94b A peoplestack-pa.googleapis.com
Gmail,225,28.54864,172.30.1.1,172.30.1.250,UDP,612,46121  >  443 Len=535
Google Play service,226,28.559803,172.30.1.250,172.30.1.1,TLSv1.3,292,"Server Hello, Change Cipher Spec, Application Data"
Google Play service,227,28.560145,172.30.1.1,172.30.1.250,TCP,88,37862  >  443 [ACK] Seq=545 Ack=204 Win=66816 Len=0
Google Play service,228,28.560626,172.30.1.1,172.30.1.250,TLSv1.3,152,"Change Cipher Spec, Application Data"
Google Play service,229,28.56069,172.30.1.250,172.30.1.1,TCP,88,443  >  37862 [ACK] Seq=204 Ack=609 Win=524032 Len=0
Gmail,230,28.561319,172.30.1.250,172.30.1.1,UDP,920,443  >  46121 Len=844
Gmail,231,28.562323,172.30.1.250,172.30.1.1,UDP,196,443  >  46121 Len=121
Gmail,232,28.562374,172.30.1.1,172.30.1.250,DNS,380,Standard query response 0xf94b A peoplestack-pa.googleapis.com A 142.251.35.170 A 142.251.40.106 A 142.251.40.138 A 142.251.40.170 A 142.250.64.74 A 142.250.64.106 A 142.250.72.106 A 142.250.80.42 A 142.250.80.74 A 142.250.80.106 A 142.250.176.202 A 142.251.40.202 A 142.251.40.234 A 142.250.65.234 A 142.251.41.10 A 142.251.32.106
Gmail,233,28.563388,172.30.1.1,172.30.1.250,UDP,108,46121  >  443 Len=34
Google Play service,234,28.563479,172.30.1.1,172.30.1.250,TLSv1.3,1160,Application Data
Google Play service,235,28.56353,172.30.1.250,172.30.1.1,TCP,88,443  >  37862 [ACK] Seq=204 Ack=1683 Win=523008 Len=0
Gmail,236,28.564927,172.30.1.1,172.30.1.250,TCP,108,59498  >  443 [SYN] Seq=0 Win=65535 Len=0 MSS=9960 SACK_PERM=1 TSval=3242898983 TSecr=0 WS=256
Gmail,237,28.574365,172.30.1.250,172.30.1.1,UDP,104,443  >  46121 Len=27
Google Play service,238,28.576576,172.30.1.1,172.30.1.250,TLSv1.3,1360,Application Data
Google Play service,239,28.576677,172.30.1.250,172.30.1.1,TCP,88,443  >  37858 [ACK] Seq=204 Ack=1882 Win=523008 Len=0
Gmail,240,28.598741,172.30.1.1,172.30.1.250,DNS,124,Standard query 0xc913 A notifications-pa.googleapis.com
Gmail,241,28.606455,172.30.1.1,172.30.1.250,UDP,108,46121  >  443 Len=33
Gmail,242,28.609545,172.30.1.250,172.30.1.1,TLSv1.3,1488,"Server Hello, Change Cipher Spec"
Gmail,243,28.609761,172.30.1.1,172.30.1.250,TCP,88,49622  >  443 [ACK] Seq=518 Ack=1401 Win=85504 Len=0
Gmail,244,28.614051,172.30.1.250,172.30.1.1,TLSv1.3,3484,Application Data
Gmail,245,28.614129,172.30.1.250,172.30.1.1,TCP,96,"443  >  59498 [SYN, ACK] Seq=0 Ack=1 Win=2048 Len=0 MSS=9960 WS=256"
Gmail,246,28.614204,172.30.1.1,172.30.1.250,TCP,88,49622  >  443 [ACK] Seq=518 Ack=4799 Win=105472 Len=0
Gmail,247,28.614212,172.30.1.1,172.30.1.250,TCP,88,59498  >  443 [ACK] Seq=1 Ack=1 Win=65536 Len=0
Gmail,248,28.614455,172.30.1.1,172.30.1.250,TLSv1.3,604,Client Hello
Gmail,249,28.614555,172.30.1.1,172.30.1.250,TLSv1.3,160,"Change Cipher Spec, Application Data"
Gmail,250,28.614599,172.30.1.250,172.30.1.1,TCP,88,443  >  49622 [ACK] Seq=4799 Ack=592 Win=524032 Len=0
Gmail,251,28.614644,172.30.1.250,172.30.1.1,TCP,88,443  >  59498 [ACK] Seq=1 Ack=518 Win=523520 Len=0
Google Play service,252,28.622393,172.30.1.250,172.30.1.1,TLSv1.3,2076,"Application Data, Application Data, Application Data, Application Data, Application Data"
Google Play service,253,28.622494,172.30.1.1,172.30.1.250,TCP,88,37862  >  443 [ACK] Seq=1683 Ack=2192 Win=70656 Len=0
Gmail,254,28.630884,172.30.1.250,172.30.1.1,TLSv1.3,160,Application Data
Gmail,255,28.630975,172.30.1.1,172.30.1.250,TCP,88,57524  >  443 [ACK] Seq=4358 Ack=15592 Win=152064 Len=0
Gmail,256,28.631556,172.30.1.250,172.30.1.1,TLSv1.3,1488,Application Data
Gmail,257,28.631671,172.30.1.1,172.30.1.250,TCP,88,57524  >  443 [ACK] Seq=4358 Ack=16992 Win=171776 Len=0
Gmail,258,28.673993,172.30.1.250,172.30.1.1,TLSv1.3,1488,Application Data
Gmail,259,28.674159,172.30.1.1,172.30.1.250,DNS,380,Standard query response 0xc913 A notifications-pa.googleapis.com A 142.251.40.138 A 142.251.40.170 A 142.250.64.74 A 142.250.80.10 A 142.250.80.42 A 142.250.80.74 A 142.250.80.106 A 142.250.176.202 A 142.251.40.202 A 142.251.40.234 A 172.217.165.138 A 142.250.65.234 A 142.251.41.10 A 142.251.32.106 A 142.251.35.170 A 142.251.40.106
Gmail,260,28.675364,172.30.1.1,172.30.1.250,TCP,88,57524  >  443 [ACK] Seq=4358 Ack=18392 Win=191744 Len=0
Gmail,261,28.680509,172.30.1.1,172.30.1.250,TCP,108,59502  >  443 [SYN] Seq=0 Win=65535 Len=0 MSS=9960 SACK_PERM=1 TSval=3242899093 TSecr=0 WS=256
Gmail,262,28.681905,172.30.1.1,172.30.1.250,TCP,108,59504  >  443 [SYN] Seq=0 Win=65535 Len=0 MSS=9960 SACK_PERM=1 TSval=3242899098 TSecr=0 WS=256
Gmail,263,28.68264,172.30.1.250,172.30.1.1,TLSv1.3,1080,"Application Data, Application Data, Application Data, Application Data"
Google Play service,264,28.682743,172.30.1.250,172.30.1.1,TLSv1.3,2112,"Application Data, Application Data, Application Data, Application Data, Application Data"
Gmail,265,28.682803,172.30.1.250,172.30.1.1,TLSv1.3,944,"Application Data, Application Data"
Gmail,266,28.682838,172.30.1.250,172.30.1.1,TLSv1.3,4896,"Server Hello, Change Cipher Spec, Application Data"
Gmail,267,28.682965,172.30.1.1,172.30.1.250,TCP,88,57524  >  443 [ACK] Seq=4358 Ack=19385 Win=194560 Len=0
Google Play service,268,28.682972,172.30.1.1,172.30.1.250,TCP,88,37858  >  443 [ACK] Seq=1882 Ack=2227 Win=70656 Len=0
Gmail,269,28.682977,172.30.1.1,172.30.1.250,TCP,88,49622  >  443 [ACK] Seq=592 Ack=5657 Win=112384 Len=0
Gmail,270,28.682982,172.30.1.1,172.30.1.250,TCP,88,59498  >  443 [ACK] Seq=518 Ack=4811 Win=85504 Len=0
Gmail,271,28.684282,172.30.1.1,172.30.1.250,TLSv1.3,128,Application Data
Gmail,272,28.684372,172.30.1.250,172.30.1.1,TCP,88,443  >  57524 [ACK] Seq=19385 Ack=4397 Win=524032 Len=0
Gmail,273,28.686746,172.30.1.1,172.30.1.250,UDP,1324,38237  >  443 Len=1250
Gmail,274,28.687926,172.30.1.1,172.30.1.250,TCP,108,38710  >  443 [SYN] Seq=0 Win=65535 Len=0 MSS=9960 SACK_PERM=1 TSval=2261964443 TSecr=0 WS=256
Gmail,275,28.696947,172.30.1.1,172.30.1.250,TLSv1.3,160,"Change Cipher Spec, Application Data"
Gmail,276,28.697045,172.30.1.250,172.30.1.1,TCP,88,443  >  59498 [ACK] Seq=4811 Ack=592 Win=524032 Len=0
Gmail,277,28.697204,172.30.1.1,172.30.1.250,TLSv1.3,180,Application Data
Gmail,278,28.697245,172.30.1.250,172.30.1.1,TCP,88,443  >  59498 [ACK] Seq=4811 Ack=684 Win=524032 Len=0
Gmail,279,28.697437,172.30.1.1,172.30.1.250,TLSv1.3,1036,Application Data
Gmail,280,28.697478,172.30.1.250,172.30.1.1,TCP,88,443  >  59498 [ACK] Seq=4811 Ack=1631 Win=523008 Len=0
Gmail,281,28.698815,172.30.1.1,172.30.1.250,TLSv1.3,128,Application Data
Gmail,282,28.698887,172.30.1.250,172.30.1.1,TCP,88,443  >  59498 [ACK] Seq=4811 Ack=1673 Win=523008 Len=0
Gmail,283,28.699363,172.30.1.1,172.30.1.250,TLSv1.3,120,Application Data
Gmail,284,28.699406,172.30.1.250,172.30.1.1,TCP,88,443  >  59498 [ACK] Seq=4811 Ack=1704 Win=523008 Len=0
Gmail,285,28.733535,172.30.1.250,172.30.1.1,TCP,96,"443  >  59502 [SYN, ACK] Seq=0 Ack=1 Win=2048 Len=0 MSS=9960 WS=256"
Gmail,286,28.733661,172.30.1.1,172.30.1.250,TCP,88,59502  >  443 [ACK] Seq=1 Ack=1 Win=65536 Len=0
Gmail,287,28.733679,172.30.1.250,172.30.1.1,TCP,96,"443  >  59504 [SYN, ACK] Seq=0 Ack=1 Win=2048 Len=0 MSS=9960 WS=256"
Gmail,288,28.733775,172.30.1.250,172.30.1.1,UDP,1324,443  >  38237 Len=1250
Gmail,289,28.733837,172.30.1.250,172.30.1.1,TCP,96,"443  >  38710 [SYN, ACK] Seq=0 Ack=1 Win=2048 Len=0 MSS=9960 WS=256"
Gmail,290,28.733881,172.30.1.1,172.30.1.250,TCP,88,59504  >  443 [ACK] Seq=1 Ack=1 Win=65536 Len=0
Gmail,291,28.733889,172.30.1.1,172.30.1.250,TCP,88,38710  >  443 [ACK] Seq=1 Ack=1 Win=65536 Len=0
Gmail,292,28.7339,172.30.1.250,172.30.1.1,UDP,1324,443  >  38237 Len=1250
Gmail,293,28.733921,172.30.1.250,172.30.1.1,UDP,1324,443  >  38237 Len=1250
Gmail,294,28.734285,172.30.1.1,172.30.1.250,UDP,116,38237  >  443 Len=41
Gmail,295,28.734505,172.30.1.1,172.30.1.250,TLSv1.3,604,Client Hello
Gmail,296,28.734646,172.30.1.250,172.30.1.1,TCP,88,443  >  38710 [ACK] Seq=1 Ack=518 Win=523520 Len=0
Gmail,297,28.7348,172.30.1.1,172.30.1.250,TLSv1.3,604,Client Hello
Gmail,298,28.734984,172.30.1.250,172.30.1.1,TCP,88,443  >  59502 [ACK] Seq=1 Ack=518 Win=523520 Len=0
Gmail,299,28.73555,172.30.1.1,172.30.1.250,TLSv1.3,604,Client Hello
Gmail,300,28.735728,172.30.1.250,172.30.1.1,TCP,88,443  >  59504 [ACK] Seq=1 Ack=518 Win=523520 Len=0
Gmail,301,28.753106,172.30.1.250,172.30.1.1,TLSv1.3,968,"Application Data, Application Data"
Gmail,302,28.753782,172.30.1.1,172.30.1.250,TCP,88,59498  >  443 [ACK] Seq=1704 Ack=5691 Win=95232 Len=0
Gmail,303,28.753794,172.30.1.1,172.30.1.250,TLSv1.3,120,Application Data
Gmail,304,28.753815,172.30.1.250,172.30.1.1,TLSv1.3,120,Application Data
Gmail,305,28.753899,172.30.1.250,172.30.1.1,TCP,88,443  >  59498 [ACK] Seq=5722 Ack=1735 Win=524032 Len=0
Gmail,306,28.754342,172.30.1.1,172.30.1.250,TCP,88,59498  >  443 [ACK] Seq=1735 Ack=5722 Win=95232 Len=0
Gmail,307,28.758651,172.30.1.250,172.30.1.1,UDP,1324,443  >  38237 Len=1250
Gmail,308,28.759049,172.30.1.250,172.30.1.1,UDP,256,443  >  38237 Len=182
Gmail,309,28.759567,172.30.1.1,172.30.1.250,UDP,116,38237  >  443 Len=41
Gmail,310,28.766431,172.30.1.250,172.30.1.1,UDP,392,443  >  46121 Len=318
Gmail,311,28.766506,172.30.1.250,172.30.1.1,UDP,112,443  >  46121 Len=37
Gmail,312,28.767084,172.30.1.250,172.30.1.1,TLSv1.3,2888,"Server Hello, Change Cipher Spec"
Gmail,313,28.767291,172.30.1.1,172.30.1.250,UDP,112,46121  >  443 Len=36
Gmail,314,28.767326,172.30.1.1,172.30.1.250,TCP,88,38710  >  443 [ACK] Seq=518 Ack=2801 Win=85504 Len=0
Gmail,315,28.767464,172.30.1.250,172.30.1.1,TLSv1.3,2096,Application Data
Gmail,316,28.767506,172.30.1.1,172.30.1.250,TCP,88,38710  >  443 [ACK] Seq=518 Ack=4811 Win=91136 Len=0
Gmail,317,28.768399,172.30.1.1,172.30.1.250,UDP,160,38237  >  443 Len=83
Gmail,318,28.768544,172.30.1.1,172.30.1.250,UDP,148,38237  >  443 Len=71
Gmail,319,28.768966,172.30.1.1,172.30.1.250,TLSv1.3,160,"Change Cipher Spec, Application Data"
Gmail,320,28.76902,172.30.1.250,172.30.1.1,TCP,88,443  >  38710 [ACK] Seq=4811 Ack=592 Win=524032 Len=0
Gmail,321,28.769282,172.30.1.1,172.30.1.250,UDP,648,38237  >  443 Len=572
Gmail,322,28.769341,172.30.1.1,172.30.1.250,UDP,1320,38237  >  443 Len=1246
Gmail,323,28.76937,172.30.1.1,172.30.1.250,UDP,432,38237  >  443 Len=357
Gmail,324,28.773012,172.30.1.250,172.30.1.1,TLSv1.3,1488,"Server Hello, Change Cipher Spec"
Gmail,325,28.773202,172.30.1.1,172.30.1.250,TCP,88,59502  >  443 [ACK] Seq=518 Ack=1401 Win=85504 Len=0
Gmail,326,28.777244,172.30.1.250,172.30.1.1,TCP,2888,"443  >  59502 [PSH, ACK] Seq=1401 Ack=518 Win=524288 Len=2800 [TCP segment of a reassembled PDU]"
Gmail,327,28.777348,172.30.1.1,172.30.1.250,TCP,88,59502  >  443 [ACK] Seq=518 Ack=4201 Win=105472 Len=0
Gmail,328,28.778358,172.30.1.250,172.30.1.1,TLSv1.3,696,Application Data
Gmail,329,28.778406,172.30.1.250,172.30.1.1,TLSv1.3,4896,"Server Hello, Change Cipher Spec, Application Data"
Gmail,330,28.778536,172.30.1.1,172.30.1.250,TCP,88,59502  >  443 [ACK] Seq=518 Ack=4810 Win=111104 Len=0
Gmail,331,28.778542,172.30.1.1,172.30.1.250,TCP,88,59504  >  443 [ACK] Seq=518 Ack=4811 Win=85504 Len=0
Gmail,332,28.788622,172.30.1.1,172.30.1.250,TLSv1.3,160,"Change Cipher Spec, Application Data"
Gmail,333,28.788727,172.30.1.250,172.30.1.1,TCP,88,443  >  59502 [ACK] Seq=4810 Ack=592 Win=524032 Len=0
Gmail,334,28.788945,172.30.1.1,172.30.1.250,TLSv1.3,160,"Change Cipher Spec, Application Data"
Gmail,335,28.788997,172.30.1.250,172.30.1.1,TCP,88,443  >  59504 [ACK] Seq=4811 Ack=592 Win=524032 Len=0
Gmail,336,28.789161,172.30.1.1,172.30.1.250,TCP,88,"59504  >  443 [FIN, ACK] Seq=592 Ack=4811 Win=85504 Len=0"
Gmail,337,28.78919,172.30.1.250,172.30.1.1,TCP,88,443  >  59504 [ACK] Seq=4811 Ack=593 Win=524032 Len=0
Gmail,338,28.789237,172.30.1.1,172.30.1.250,TLSv1.3,180,Application Data
Gmail,339,28.789267,172.30.1.250,172.30.1.1,TCP,88,443  >  59502 [ACK] Seq=4810 Ack=684 Win=524032 Len=0
Gmail,340,28.78939,172.30.1.1,172.30.1.250,TLSv1.3,784,Application Data
Gmail,341,28.789449,172.30.1.250,172.30.1.1,TCP,88,443  >  59502 [ACK] Seq=4810 Ack=1379 Win=523264 Len=0
Gmail,342,28.789478,172.30.1.1,172.30.1.250,TLSv1.3,184,Application Data
Gmail,343,28.789509,172.30.1.250,172.30.1.1,TCP,88,443  >  59502 [ACK] Seq=4810 Ack=1475 Win=523264 Len=0
Gmail,344,28.789848,172.30.1.1,172.30.1.250,TLSv1.3,216,Application Data
Gmail,345,28.789891,172.30.1.250,172.30.1.1,TCP,88,443  >  59502 [ACK] Seq=4810 Ack=1602 Win=523008 Len=0
Gmail,346,28.789917,172.30.1.1,172.30.1.250,TLSv1.3,128,Application Data
Gmail,347,28.789949,172.30.1.250,172.30.1.1,TCP,88,443  >  59502 [ACK] Seq=4810 Ack=1644 Win=523008 Len=0
Gmail,348,28.790001,172.30.1.1,172.30.1.250,TLSv1.3,120,Application Data
Gmail,349,28.790038,172.30.1.250,172.30.1.1,TCP,88,443  >  59502 [ACK] Seq=4810 Ack=1675 Win=523008 Len=0
Gmail,350,28.790062,172.30.1.1,172.30.1.250,TLSv1.3,120,Application Data
Gmail,351,28.790089,172.30.1.250,172.30.1.1,TCP,88,443  >  59502 [ACK] Seq=4810 Ack=1706 Win=523008 Len=0
Gmail,352,28.793668,172.30.1.1,172.30.1.250,UDP,108,46121  >  443 Len=33
Gmail,353,28.794062,172.30.1.250,172.30.1.1,UDP,944,443  >  38237 Len=870
Gmail,354,28.794128,172.30.1.250,172.30.1.1,TLSv1.3,972,"Application Data, Application Data"
Gmail,355,28.794171,172.30.1.1,172.30.1.250,TCP,88,38710  >  443 [ACK] Seq=592 Ack=5697 Win=96768 Len=0
Gmail,356,28.79418,172.30.1.250,172.30.1.1,UDP,196,443  >  38237 Len=121
Gmail,357,28.794196,172.30.1.250,172.30.1.1,UDP,104,443  >  38237 Len=27
Gmail,358,28.794458,172.30.1.1,172.30.1.250,UDP,108,38237  >  443 Len=33
Gmail,359,28.797816,172.30.1.250,172.30.1.1,UDP,100,443  >  38237 Len=25
Gmail,360,28.814455,172.30.1.250,172.30.1.1,TLSv1.3,968,"Application Data, Application Data"
Gmail,361,28.814694,172.30.1.1,172.30.1.250,TCP,88,59504  >  443 [RST] Seq=593 Win=0 Len=0
Gmail,362,28.814774,172.30.1.250,172.30.1.1,TCP,88,"443  >  59504 [RST, ACK] Seq=5691 Ack=593 Win=65280 Len=0"
Gmail,363,28.818407,172.30.1.250,172.30.1.1,TLSv1.3,1000,"Application Data, Application Data, Application Data"
Gmail,364,28.818504,172.30.1.1,172.30.1.250,TCP,88,59502  >  443 [ACK] Seq=1706 Ack=5721 Win=116736 Len=0
Gmail,365,28.818515,172.30.1.250,172.30.1.1,UDP,100,443  >  46121 Len=25
Gmail,366,28.819023,172.30.1.1,172.30.1.250,TLSv1.3,120,Application Data
Gmail,367,28.819113,172.30.1.250,172.30.1.1,TCP,88,443  >  59502 [ACK] Seq=5721 Ack=1737 Win=524032 Len=0
Gmail,368,28.819704,172.30.1.1,172.30.1.250,UDP,108,38237  >  443 Len=33
Gmail,369,28.999964,172.30.1.1,172.30.1.250,UDP,108,38237  >  443 Len=33
Gmail,370,29.005099,172.30.1.250,172.30.1.1,TLSv1.3,308,Application Data
Gmail,371,29.005213,172.30.1.1,172.30.1.250,TCP,88,59502  >  443 [ACK] Seq=1737 Ack=5940 Win=122368 Len=0
Gmail,372,29.010657,172.30.1.250,172.30.1.1,TLSv1.3,676,"Application Data, Application Data"
Gmail,373,29.01076,172.30.1.250,172.30.1.1,UDP,708,443  >  38237 Len=631
Gmail,374,29.01081,172.30.1.1,172.30.1.250,TCP,88,59502  >  443 [ACK] Seq=1737 Ack=6528 Win=128000 Len=0
Gmail,375,29.010822,172.30.1.250,172.30.1.1,UDP,320,443  >  38237 Len=244
Gmail,376,29.011865,172.30.1.1,172.30.1.250,UDP,112,38237  >  443 Len=35
Gmail,377,29.016118,172.30.1.1,172.30.1.250,TLSv1.3,128,Application Data
Gmail,378,29.016262,172.30.1.250,172.30.1.1,TCP,88,443  >  59502 [ACK] Seq=6528 Ack=1776 Win=524032 Len=0
Gmail,379,29.030423,172.30.1.250,172.30.1.1,UDP,712,443  >  38237 Len=637
Gmail,380,29.030948,172.30.1.1,172.30.1.250,UDP,108,38237  >  443 Len=33
Gmail,381,29.064481,172.30.1.250,172.30.1.1,UDP,100,443  >  38237 Len=25
Gmail,382,29.334578,172.30.1.250,172.30.1.1,TLSv1.3,1708,"Application Data, Application Data"
Gmail,383,29.33476,172.30.1.1,172.30.1.250,TCP,88,59498  >  443 [ACK] Seq=1735 Ack=7341 Win=104704 Len=0
Gmail,384,29.334886,172.30.1.250,172.30.1.1,TLSv1.3,10048,"Application Data, Application Data, Application Data, Application Data, Application Data, Application Data, Application Data"
Gmail,385,29.335005,172.30.1.1,172.30.1.250,TCP,88,59498  >  443 [ACK] Seq=1735 Ack=17301 Win=124672 Len=0
