App name,No.,Time,Source,Destination,Protocol,Length,Info
Google Play service,1,0,172.30.1.1,172.30.1.250,DNS,120,Standard query 0x2d25 A voilatile-pa.googleapis.com
Google Play service,2,0.032738,172.30.1.250,172.30.1.1,DNS,376,Standard query response 0x2d25 A voilatile-pa.googleapis.com A 142.250.80.74 A 142.250.80.106 A 142.250.176.202 A 142.251.40.202 A 142.251.40.234 A 172.217.165.138 A 142.250.65.170 A 142.250.65.202 A 142.250.65.234 A 142.250.81.234 A 142.251.41.10 A 142.251.32.106 A 142.251.35.170 A 142.251.40.106 A 142.251.40.138 A 142.251.40.170
WhatsApp,3,0.264762,172.30.1.1,172.30.1.250,TCP,108,54988  >  443 [SYN] Seq=0 Win=65535 Len=0 MSS=9960 SACK_PERM TSval=243103017 TSecr=0 WS=512
WhatsApp,4,0.306882,172.30.1.250,172.30.1.1,TCP,96,"443  >  54988 [SYN, ACK] Seq=0 Ack=1 Win=4096 Len=0 MSS=9960 WS=512"
WhatsApp,5,0.307037,172.30.1.1,172.30.1.250,TCP,88,54988  >  443 [ACK] Seq=1 Ack=1 Win=65536 Len=0
WhatsApp,6,0.311341,172.30.1.1,172.30.1.250,TCP,92,"54988  >  443 [PSH, ACK] Seq=1 Ack=1 Win=65536 Len=4 [TCP segment of a reassembled PDU]"
WhatsApp,7,0.311549,172.30.1.250,172.30.1.1,TCP,88,443  >  54988 [ACK] Seq=1 Ack=5 Win=2096640 Len=0
WhatsApp,8,0.31162,172.30.1.1,172.30.1.250,SSL,100,Continuation Data
WhatsApp,9,0.311657,172.30.1.250,172.30.1.1,TCP,88,443  >  54988 [ACK] Seq=1 Ack=16 Win=2096640 Len=0
WhatsApp,10,0.316112,172.30.1.1,172.30.1.250,TCP,92,"54988  >  443 [PSH, ACK] Seq=16 Ack=1 Win=65536 Len=3 [TCP segment of a reassembled PDU]"
WhatsApp,11,0.316225,172.30.1.250,172.30.1.1,TCP,88,443  >  54988 [ACK] Seq=1 Ack=19 Win=2096640 Len=0
WhatsApp,12,0.316291,172.30.1.1,172.30.1.250,SSL,352,Continuation Data
WhatsApp,13,0.316332,172.30.1.250,172.30.1.1,TCP,88,443  >  54988 [ACK] Seq=1 Ack=284 Win=2096640 Len=0
WhatsApp,14,0.39332,172.30.1.250,172.30.1.1,SSL,200,Continuation Data
WhatsApp,15,0.393854,172.30.1.1,172.30.1.250,TCP,88,54988  >  443 [ACK] Seq=284 Ack=115 Win=65536 Len=0
WhatsApp,16,0.398609,172.30.1.1,172.30.1.250,TCP,92,"54988  >  443 [PSH, ACK] Seq=284 Ack=115 Win=65536 Len=3 [TCP segment of a reassembled PDU]"
WhatsApp,17,0.398761,172.30.1.250,172.30.1.1,TCP,88,443  >  54988 [ACK] Seq=115 Ack=287 Win=2096640 Len=0
WhatsApp,18,0.398891,172.30.1.1,172.30.1.250,SSL,328,Continuation Data
WhatsApp,19,0.398942,172.30.1.250,172.30.1.1,TCP,88,443  >  54988 [ACK] Seq=115 Ack=528 Win=2096640 Len=0
WhatsApp,20,0.54922,172.30.1.250,172.30.1.1,SSL,132,Continuation Data
WhatsApp,21,0.549307,172.30.1.1,172.30.1.250,TCP,88,54988  >  443 [ACK] Seq=528 Ack=161 Win=65536 Len=0
WhatsApp,22,0.557391,172.30.1.250,172.30.1.1,SSL,284,Continuation Data
WhatsApp,23,0.557463,172.30.1.1,172.30.1.250,TCP,88,54988  >  443 [ACK] Seq=528 Ack=356 Win=67072 Len=0
WhatsApp,24,0.623206,172.30.1.250,172.30.1.1,SSL,124,Continuation Data
WhatsApp,25,0.62337,172.30.1.1,172.30.1.250,TCP,88,54988  >  443 [ACK] Seq=528 Ack=393 Win=67072 Len=0
Messenger,26,2.836886,172.30.1.1,172.30.1.250,DNS,108,Standard query 0x1b39 A web.facebook.com
Messenger,27,2.842272,172.30.1.1,172.30.1.250,TCP,108,37150  >  443 [SYN] Seq=0 Win=65535 Len=0 MSS=9960 SACK_PERM TSval=553149746 TSecr=0 WS=512
Messenger,28,2.951009,172.30.1.250,172.30.1.1,DNS,168,Standard query response 0x1b39 A web.facebook.com CNAME star.facebook.com CNAME star.c10r.facebook.com A 157.240.241.17
Messenger,29,2.95144,172.30.1.250,172.30.1.1,TCP,96,"443  >  37150 [SYN, ACK] Seq=0 Ack=1 Win=4096 Len=0 MSS=9960 WS=512"
Messenger,30,2.951613,172.30.1.1,172.30.1.250,TCP,88,37150  >  443 [ACK] Seq=1 Ack=1 Win=65536 Len=0
Messenger,31,2.955009,172.30.1.1,172.30.1.250,TLSv1.3,496,Client Hello
Messenger,32,2.955273,172.30.1.250,172.30.1.1,TCP,88,443  >  37150 [ACK] Seq=1 Ack=411 Win=2096640 Len=0
Messenger,33,2.993279,172.30.1.250,172.30.1.1,TLSv1.3,300,"Server Hello, Change Cipher Spec, Application Data"
Messenger,34,2.993589,172.30.1.1,172.30.1.250,TCP,88,37150  >  443 [ACK] Seq=411 Ack=213 Win=67072 Len=0
Messenger,35,2.995151,172.30.1.1,172.30.1.250,TLSv1.3,164,"Change Cipher Spec, Application Data"
Messenger,36,2.995233,172.30.1.250,172.30.1.1,TCP,88,443  >  37150 [ACK] Seq=213 Ack=487 Win=2096640 Len=0
Messenger,37,2.996265,172.30.1.1,172.30.1.250,TLSv1.3,1532,Application Data
Messenger,38,2.996343,172.30.1.250,172.30.1.1,TCP,88,443  >  37150 [ACK] Seq=213 Ack=1933 Win=2095616 Len=0
Messenger,39,3.022837,172.30.1.250,172.30.1.1,TLSv1.3,340,"Application Data, Application Data"
Messenger,40,3.023044,172.30.1.1,172.30.1.250,TCP,88,37150  >  443 [ACK] Seq=1933 Ack=466 Win=68096 Len=0
Messenger,41,3.023938,172.30.1.1,172.30.1.250,TLSv1.3,124,Application Data
Messenger,42,3.023991,172.30.1.250,172.30.1.1,TCP,88,443  >  37150 [ACK] Seq=466 Ack=1971 Win=2095616 Len=0
Messenger,43,3.045486,172.30.1.250,172.30.1.1,TLSv1.3,132,Application Data
Messenger,44,3.045651,172.30.1.1,172.30.1.250,TCP,88,37150  >  443 [ACK] Seq=1971 Ack=510 Win=68096 Len=0
Messenger,45,3.078116,172.30.1.250,172.30.1.1,TLSv1.3,1040,Application Data
Messenger,46,3.078269,172.30.1.1,172.30.1.250,TCP,88,37150  >  443 [ACK] Seq=1971 Ack=1463 Win=69632 Len=0
Google Play service,47,3.905466,172.30.1.1,172.30.1.250,DNS,116,Standard query 0xee97 A android.googleapis.com
Google Play service,48,3.983825,172.30.1.250,172.30.1.1,DNS,372,Standard query response 0xee97 A android.googleapis.com A 172.217.165.138 A 142.250.65.170 A 142.250.65.202 A 142.250.65.234 A 142.250.81.234 A 142.251.41.10 A 142.251.32.106 A 142.251.35.170 A 142.251.40.106 A 142.251.40.138 A 142.251.40.170 A 142.250.72.106 A 142.250.80.10 A 142.250.80.42 A 142.250.80.74 A 142.250.80.106
Google Play service,49,3.990997,172.30.1.1,172.30.1.250,TCP,108,59080  >  443 [SYN] Seq=0 Win=65535 Len=0 MSS=9960 SACK_PERM TSval=2331098206 TSecr=0 WS=512
Google Play service,50,4.003993,172.30.1.1,172.30.1.250,TCP,108,59084  >  443 [SYN] Seq=0 Win=65535 Len=0 MSS=9960 SACK_PERM TSval=2331098220 TSecr=0 WS=512
Google Play service,51,4.016778,172.30.1.250,172.30.1.1,TCP,96,"443  >  59080 [SYN, ACK] Seq=0 Ack=1 Win=4096 Len=0 MSS=9960 WS=512"
Google Play service,52,4.016877,172.30.1.1,172.30.1.250,TCP,88,59080  >  443 [ACK] Seq=1 Ack=1 Win=65536 Len=0
Google Play service,53,4.019578,172.30.1.1,172.30.1.250,TLSv1.3,632,Client Hello
Google Play service,54,4.019753,172.30.1.250,172.30.1.1,TCP,88,443  >  59080 [ACK] Seq=1 Ack=545 Win=2096128 Len=0
Google Play service,55,4.028253,172.30.1.250,172.30.1.1,TCP,96,"443  >  59084 [SYN, ACK] Seq=0 Ack=1 Win=4096 Len=0 MSS=9960 WS=512"
Google Play service,56,4.028369,172.30.1.1,172.30.1.250,TCP,88,59084  >  443 [ACK] Seq=1 Ack=1 Win=65536 Len=0
Google Play service,57,4.031341,172.30.1.1,172.30.1.250,TLSv1.3,632,Client Hello
Google Play service,58,4.031554,172.30.1.250,172.30.1.1,TCP,88,443  >  59084 [ACK] Seq=1 Ack=545 Win=2096128 Len=0
Google Play service,59,4.076834,172.30.1.250,172.30.1.1,TLSv1.3,292,"Server Hello, Change Cipher Spec, Application Data"
Google Play service,60,4.076984,172.30.1.1,172.30.1.250,TCP,88,59080  >  443 [ACK] Seq=545 Ack=204 Win=67072 Len=0
Google Play service,61,4.080704,172.30.1.1,172.30.1.250,TLSv1.3,152,"Change Cipher Spec, Application Data"
Google Play service,62,4.080846,172.30.1.250,172.30.1.1,TCP,88,443  >  59080 [ACK] Seq=204 Ack=609 Win=2096640 Len=0
Google Play service,63,4.088146,172.30.1.250,172.30.1.1,TLSv1.3,292,"Server Hello, Change Cipher Spec, Application Data"
Google Play service,64,4.088482,172.30.1.1,172.30.1.250,TCP,88,59084  >  443 [ACK] Seq=545 Ack=204 Win=67072 Len=0
Google Play service,65,4.090917,172.30.1.1,172.30.1.250,TLSv1.3,1212,Application Data
Google Play service,66,4.090999,172.30.1.250,172.30.1.1,TCP,88,443  >  59080 [ACK] Seq=204 Ack=1734 Win=2095616 Len=0
Google Play service,67,4.09174,172.30.1.1,172.30.1.250,TLSv1.3,152,"Change Cipher Spec, Application Data"
Google Play service,68,4.091788,172.30.1.250,172.30.1.1,TCP,88,443  >  59084 [ACK] Seq=204 Ack=609 Win=2096640 Len=0
Google Play service,69,4.107628,172.30.1.1,172.30.1.250,TLSv1.3,2116,Application Data
Google Play service,70,4.107796,172.30.1.250,172.30.1.1,TCP,88,443  >  59084 [ACK] Seq=204 Ack=2639 Win=2094592 Len=0
Google Play service,71,4.16327,172.30.1.250,172.30.1.1,TLSv1.3,1976,"Application Data, Application Data, Application Data, Application Data, Application Data"
Google Play service,72,4.163515,172.30.1.1,172.30.1.250,TCP,88,59080  >  443 [ACK] Seq=1734 Ack=2091 Win=70656 Len=0
Google Play service,73,4.198638,172.30.1.250,172.30.1.1,TLSv1.3,2076,"Application Data, Application Data, Application Data"
Google Play service,74,4.198724,172.30.1.1,172.30.1.250,TCP,88,59084  >  443 [ACK] Seq=2639 Ack=2191 Win=70656 Len=0
Google Play service,75,4.206047,172.30.1.250,172.30.1.1,TLSv1.3,240,"Application Data, Application Data"
Google Play service,76,4.206278,172.30.1.1,172.30.1.250,TCP,88,59084  >  443 [ACK] Seq=2639 Ack=2342 Win=74752 Len=0
Messages,77,4.556206,172.30.1.1,172.30.1.250,DNS,132,Standard query 0x505c A instantmessaging-pa-us.googleapis.com
Messages,78,4.626482,172.30.1.250,172.30.1.1,DNS,148,Standard query response 0x505c A instantmessaging-pa-us.googleapis.com A 216.239.36.158
Messages,79,4.63131,172.30.1.1,172.30.1.250,TCP,108,53696  >  443 [SYN] Seq=0 Win=65535 Len=0 MSS=9960 SACK_PERM TSval=3709564806 TSecr=0 WS=512
Messages,80,4.65834,172.30.1.250,172.30.1.1,TCP,96,"443  >  53696 [SYN, ACK] Seq=0 Ack=1 Win=4096 Len=0 MSS=9960 WS=512"
Messages,81,4.658523,172.30.1.1,172.30.1.250,TCP,88,53696  >  443 [ACK] Seq=1 Ack=1 Win=65536 Len=0
Messages,82,4.658778,172.30.1.1,172.30.1.250,TLSv1.3,604,Client Hello
Messages,83,4.659021,172.30.1.250,172.30.1.1,TCP,88,443  >  53696 [ACK] Seq=1 Ack=518 Win=2096128 Len=0
Messages,84,4.69992,172.30.1.250,172.30.1.1,TLSv1.3,4904,"Server Hello, Change Cipher Spec, Application Data"
Messages,85,4.70019,172.30.1.1,172.30.1.250,TCP,88,53696  >  443 [ACK] Seq=518 Ack=4818 Win=85504 Len=0
Messages,86,4.70685,172.30.1.1,172.30.1.250,TLSv1.3,160,"Change Cipher Spec, Application Data"
Messages,87,4.706934,172.30.1.250,172.30.1.1,TCP,88,443  >  53696 [ACK] Seq=4818 Ack=592 Win=2096640 Len=0
Messages,88,4.707072,172.30.1.1,172.30.1.250,TLSv1.3,184,Application Data
Messages,89,4.707105,172.30.1.250,172.30.1.1,TCP,88,443  >  53696 [ACK] Seq=4818 Ack=690 Win=2096640 Len=0
Messages,90,4.707189,172.30.1.1,172.30.1.250,TLSv1.3,440,Application Data
Messages,91,4.707201,172.30.1.250,172.30.1.1,TCP,88,443  >  53696 [ACK] Seq=4818 Ack=1042 Win=2096128 Len=0
Messages,92,4.707484,172.30.1.1,172.30.1.250,TLSv1.3,7020,Application Data
Messages,93,4.707551,172.30.1.250,172.30.1.1,TCP,88,443  >  53696 [ACK] Seq=4818 Ack=7975 Win=2089472 Len=0
Messages,94,4.707574,172.30.1.1,172.30.1.250,TLSv1.3,120,Application Data
Messages,95,4.707583,172.30.1.250,172.30.1.1,TCP,88,443  >  53696 [ACK] Seq=4818 Ack=8006 Win=2089472 Len=0
Messages,96,4.73793,172.30.1.250,172.30.1.1,TLSv1.3,988,"Application Data, Application Data"
Messages,97,4.738069,172.30.1.1,172.30.1.250,TCP,88,53696  >  443 [ACK] Seq=8006 Ack=5720 Win=95232 Len=0
Messages,98,4.738092,172.30.1.250,172.30.1.1,TLSv1.3,120,Application Data
Messages,99,4.738202,172.30.1.1,172.30.1.250,TCP,88,53696  >  443 [ACK] Seq=8006 Ack=5751 Win=95232 Len=0
Messages,100,4.738243,172.30.1.1,172.30.1.250,TLSv1.3,120,Application Data
Messages,101,4.738293,172.30.1.250,172.30.1.1,TCP,88,443  >  53696 [ACK] Seq=5751 Ack=8037 Win=2089472 Len=0
Google Fi,102,4.932248,172.30.1.1,172.30.1.250,DNS,124,Standard query 0x31a5 A ficontinuity-pa.googleapis.com
Messages,103,4.934266,172.30.1.250,172.30.1.1,TLSv1.3,808,"Application Data, Application Data, Application Data"
Messages,104,4.934547,172.30.1.1,172.30.1.250,TCP,88,53696  >  443 [ACK] Seq=8037 Ack=6471 Win=104960 Len=0
Messages,105,4.936563,172.30.1.1,172.30.1.250,TLSv1.3,128,Application Data
Messages,106,4.937952,172.30.1.250,172.30.1.1,TCP,88,443  >  53696 [ACK] Seq=6471 Ack=8076 Win=2096640 Len=0
Messages,107,4.97343,172.30.1.1,172.30.1.250,QUIC,1324,"Initial, DCID=767e0476ff4b53fe, PKN: 1, PADDING, CRYPTO, CRYPTO, PING, PING, CRYPTO, CRYPTO, CRYPTO, PING, PING, PADDING, PING, CRYPTO, PING, PADDING, CRYPTO, PING, PADDING, PING, CRYPTO, PING, PADDING"
Messages,108,4.974021,172.30.1.1,172.30.1.250,TLSv1.3,192,Application Data
Messages,109,4.974027,172.30.1.1,172.30.1.250,TLSv1.3,200,Application Data
Messages,110,4.97403,172.30.1.1,172.30.1.250,TLSv1.3,368,Application Data
Messages,111,4.974034,172.30.1.1,172.30.1.250,TLSv1.3,388,Application Data
Messages,112,4.974038,172.30.1.1,172.30.1.250,TLSv1.3,120,Application Data
Messages,113,4.974041,172.30.1.1,172.30.1.250,TLSv1.3,120,Application Data
Messages,114,4.974086,172.30.1.250,172.30.1.1,TCP,88,443  >  53696 [ACK] Seq=6471 Ack=8934 Win=2096128 Len=0
Messages,115,4.979245,172.30.1.1,172.30.1.250,TLSv1.3,196,Application Data
Messages,116,4.979338,172.30.1.250,172.30.1.1,TCP,88,443  >  53696 [ACK] Seq=6471 Ack=9044 Win=2096128 Len=0
Messages,117,4.979387,172.30.1.1,172.30.1.250,TLSv1.3,368,Application Data
Messages,118,4.979392,172.30.1.1,172.30.1.250,TLSv1.3,120,Application Data
Messages,119,4.979414,172.30.1.250,172.30.1.1,TCP,88,443  >  53696 [ACK] Seq=6471 Ack=9354 Win=2095616 Len=0
Google Fi,120,4.988009,172.30.1.250,172.30.1.1,DNS,380,Standard query response 0x31a5 A ficontinuity-pa.googleapis.com A 142.251.40.106 A 142.251.40.138 A 142.251.40.170 A 142.250.72.106 A 142.250.80.42 A 142.250.80.74 A 142.250.80.106 A 142.250.176.202 A 142.251.40.202 A 142.251.40.234 A 172.217.165.138 A 142.250.65.170 A 142.250.65.202 A 142.250.65.234 A 142.250.81.234 A 142.251.41.10
Google Fi,121,4.991897,172.30.1.1,172.30.1.250,TCP,108,36440  >  443 [SYN] Seq=0 Win=65535 Len=0 MSS=9960 SACK_PERM TSval=1497580276 TSecr=0 WS=512
Messages,122,5.01856,172.30.1.250,172.30.1.1,QUIC,1324,"Initial, SCID=767e0476ff4b53fe, PKN: 1, ACK, CRYPTO, PADDING"
Messages,123,5.021194,172.30.1.1,172.30.1.250,QUIC,1324,"Initial, DCID=767e0476ff4b53fe, PKN: 2, ACK, PADDING"
Messages,124,5.025429,172.30.1.250,172.30.1.1,QUIC,1324,"Handshake, SCID=767e0476ff4b53fe"
Messages,125,5.025525,172.30.1.250,172.30.1.1,QUIC,1324,"Handshake, SCID=767e0476ff4b53fe"
Messages,126,5.026494,172.30.1.1,172.30.1.250,QUIC,116,"Handshake, DCID=767e0476ff4b53fe"
Google Fi,127,5.02818,172.30.1.250,172.30.1.1,TCP,96,"443  >  36440 [SYN, ACK] Seq=0 Ack=1 Win=4096 Len=0 MSS=9960 WS=512"
Google Fi,128,5.028348,172.30.1.1,172.30.1.250,TCP,88,36440  >  443 [ACK] Seq=1 Ack=1 Win=65536 Len=0
Google Fi,129,5.03115,172.30.1.1,172.30.1.250,TLSv1.3,604,Client Hello
Google Fi,130,5.031331,172.30.1.250,172.30.1.1,TCP,88,443  >  36440 [ACK] Seq=1 Ack=518 Win=2096128 Len=0
Messages,131,5.053491,172.30.1.250,172.30.1.1,TLSv1.3,196,"Application Data, Application Data"
Messages,132,5.06304,172.30.1.250,172.30.1.1,TLSv1.3,660,"Application Data, Application Data, Application Data"
Messages,133,5.063878,172.30.1.1,172.30.1.250,TCP,88,53696  >  443 [ACK] Seq=9354 Ack=7152 Win=114688 Len=0
Messages,134,5.065479,172.30.1.1,172.30.1.250,TLSv1.3,128,Application Data
Messages,135,5.065571,172.30.1.250,172.30.1.1,TCP,88,443  >  53696 [ACK] Seq=7152 Ack=9393 Win=2096640 Len=0
Messages,136,5.069408,172.30.1.250,172.30.1.1,QUIC,1324,"Handshake, SCID=767e0476ff4b53fe"
Messages,137,5.069541,172.30.1.250,172.30.1.1,QUIC,260,Protected Payload (KP0)
Messages,138,5.070785,172.30.1.1,172.30.1.250,QUIC,116,"Handshake, DCID=767e0476ff4b53fe"
Messages,139,5.075557,172.30.1.1,172.30.1.250,QUIC,160,"Handshake, DCID=767e0476ff4b53fe"
Messages,140,5.07621,172.30.1.1,172.30.1.250,QUIC,148,"Protected Payload (KP0), DCID=767e0476ff4b53fe"
Google Fi,141,5.079605,172.30.1.250,172.30.1.1,TLSv1.3,2760,"Server Hello, Change Cipher Spec"
Google Fi,142,5.079958,172.30.1.1,172.30.1.250,TCP,88,36440  >  443 [ACK] Seq=518 Ack=2673 Win=85504 Len=0
Google Fi,143,5.079993,172.30.1.250,172.30.1.1,TLSv1.3,2088,Application Data
Google Fi,144,5.08005,172.30.1.1,172.30.1.250,TCP,88,36440  >  443 [ACK] Seq=518 Ack=4673 Win=91136 Len=0
Messages,145,5.082505,172.30.1.250,172.30.1.1,TLSv1.3,604,"Application Data, Application Data"
Messages,146,5.082564,172.30.1.250,172.30.1.1,TLSv1.3,132,Application Data
Messages,147,5.082821,172.30.1.1,172.30.1.250,TCP,88,53696  >  443 [ACK] Seq=9393 Ack=7713 Win=124416 Len=0
Google Fi,148,5.091064,172.30.1.1,172.30.1.250,TLSv1.3,152,"Change Cipher Spec, Application Data"
Google Fi,149,5.091249,172.30.1.250,172.30.1.1,TCP,88,443  >  36440 [ACK] Seq=4673 Ack=582 Win=2096640 Len=0
Google Fi,150,5.093743,172.30.1.1,172.30.1.250,TLSv1.3,400,Application Data
Google Fi,151,5.09387,172.30.1.250,172.30.1.1,TCP,88,443  >  36440 [ACK] Seq=4673 Ack=894 Win=2096640 Len=0
Messages,152,5.097508,172.30.1.1,172.30.1.250,QUIC,108,"Protected Payload (KP0), DCID=767e0476ff4b53fe"
Messages,153,5.113079,172.30.1.250,172.30.1.1,QUIC,960,Protected Payload (KP0)
Messages,154,5.113211,172.30.1.250,172.30.1.1,QUIC,196,Protected Payload (KP0)
Messages,155,5.11416,172.30.1.1,172.30.1.250,QUIC,108,"Protected Payload (KP0), DCID=767e0476ff4b53fe"
Messages,156,5.13826,172.30.1.250,172.30.1.1,QUIC,100,Protected Payload (KP0)
Google Fi,157,5.148761,172.30.1.250,172.30.1.1,TLSv1.3,3524,"Application Data, Application Data, Application Data, Application Data, Application Data"
Google Fi,158,5.148935,172.30.1.1,172.30.1.250,TCP,88,36440  >  443 [ACK] Seq=894 Ack=8109 Win=111104 Len=0
Google Fi,159,5.155663,172.30.1.1,172.30.1.250,DNS,108,Standard query 0xa196 A dns.google.com
Google Fi,160,5.193112,172.30.1.250,172.30.1.1,DNS,140,Standard query response 0xa196 A dns.google.com A 8.8.4.4 A 8.8.8.8
Messages,161,5.359134,172.30.1.1,172.30.1.250,QUIC,992,"Protected Payload (KP0), DCID=767e0476ff4b53fe"
Messages,162,5.360194,172.30.1.1,172.30.1.250,QUIC,108,"Protected Payload (KP0), DCID=767e0476ff4b53fe"
Messages,163,5.400144,172.30.1.250,172.30.1.1,QUIC,104,Protected Payload (KP0)
Messages,164,5.422826,172.30.1.250,172.30.1.1,QUIC,100,Protected Payload (KP0)
Messages,165,5.427122,172.30.1.1,172.30.1.250,QUIC,108,"Protected Payload (KP0), DCID=767e0476ff4b53fe"
Messages,166,5.817803,172.30.1.250,172.30.1.1,QUIC,424,Protected Payload (KP0)
Messages,167,5.818815,172.30.1.1,172.30.1.250,QUIC,112,"Protected Payload (KP0), DCID=767e0476ff4b53fe"
Messages,168,5.824458,172.30.1.250,172.30.1.1,QUIC,424,Protected Payload (KP0)
Messages,169,5.826351,172.30.1.1,172.30.1.250,QUIC,108,"Protected Payload (KP0), DCID=767e0476ff4b53fe"
Messages,170,5.8776,172.30.1.250,172.30.1.1,QUIC,100,Protected Payload (KP0)
Google Play service,171,6.888981,172.30.1.1,172.30.1.250,DNS,108,Standard query 0xa037 A mtalk.google.com
Google Play service,172,6.95731,172.30.1.250,172.30.1.1,DNS,156,Standard query response 0xa037 A mtalk.google.com CNAME mobile-gtalk.l.google.com A 142.251.163.188
Google Play service,173,6.963186,172.30.1.1,172.30.1.250,TCP,108,33286  >  5228 [SYN] Seq=0 Win=65535 Len=0 MSS=9960 SACK_PERM TSval=4109318754 TSecr=0 WS=512
Google Play service,174,6.998281,172.30.1.250,172.30.1.1,TCP,96,"5228  >  33286 [SYN, ACK] Seq=0 Ack=1 Win=4096 Len=0 MSS=9960 WS=512"
Google Play service,175,6.998561,172.30.1.1,172.30.1.250,TCP,88,33286  >  5228 [ACK] Seq=1 Ack=1 Win=65536 Len=0
Google Play service,176,7.000072,172.30.1.1,172.30.1.250,TLSv1.3,604,Client Hello
Google Play service,177,7.000444,172.30.1.250,172.30.1.1,TCP,88,5228  >  33286 [ACK] Seq=1 Ack=518 Win=2096128 Len=0
Google Play service,178,7.036,172.30.1.250,172.30.1.1,TLSv1.3,2760,"Server Hello, Change Cipher Spec"
Google Play service,179,7.036326,172.30.1.1,172.30.1.250,TCP,88,33286  >  5228 [ACK] Seq=518 Ack=2673 Win=85504 Len=0
Google Play service,180,7.039379,172.30.1.250,172.30.1.1,TLSv1.3,4100,Application Data
Google Play service,181,7.039556,172.30.1.1,172.30.1.250,TCP,88,33286  >  5228 [ACK] Seq=518 Ack=6685 Win=93696 Len=0
Google Play service,182,7.05557,172.30.1.1,172.30.1.250,TLSv1.3,152,"Change Cipher Spec, Application Data"
Google Play service,183,7.055743,172.30.1.250,172.30.1.1,TCP,88,5228  >  33286 [ACK] Seq=6685 Ack=582 Win=2096640 Len=0
Google Play service,184,7.060471,172.30.1.1,172.30.1.250,TLSv1.3,588,Application Data
Google Play service,185,7.060592,172.30.1.250,172.30.1.1,TCP,88,5228  >  33286 [ACK] Seq=6685 Ack=1081 Win=2096128 Len=0
Google Play service,186,7.111513,172.30.1.250,172.30.1.1,TLSv1.3,624,"Application Data, Application Data"
Google Play service,187,7.111662,172.30.1.1,172.30.1.250,TCP,88,33286  >  5228 [ACK] Seq=1081 Ack=7220 Win=101888 Len=0
Google Play service,188,7.120282,172.30.1.250,172.30.1.1,TLSv1.3,204,"Application Data, Application Data"
Google Play service,189,7.120426,172.30.1.1,172.30.1.250,TCP,88,33286  >  5228 [ACK] Seq=1081 Ack=7338 Win=101888 Len=0
OneDrive,190,7.579893,172.30.1.1,172.30.1.250,DNS,124,Standard query 0x4d9c A self.events.data.microsoft.com
OneDrive,191,7.64191,172.30.1.250,172.30.1.1,DNS,244,Standard query response 0x4d9c A self.events.data.microsoft.com CNAME self-events-data.trafficmanager.net CNAME onedscolprdcus06.centralus.cloudapp.azure.com A 13.89.179.8
OneDrive,192,7.645522,172.30.1.1,172.30.1.250,TCP,108,35576  >  443 [SYN] Seq=0 Win=65535 Len=0 MSS=9960 SACK_PERM TSval=2238049420 TSecr=0 WS=512
OneDrive,193,7.724633,172.30.1.250,172.30.1.1,TCP,96,"443  >  35576 [SYN, ACK] Seq=0 Ack=1 Win=4096 Len=0 MSS=9960 WS=512"
OneDrive,194,7.724888,172.30.1.1,172.30.1.250,TCP,88,35576  >  443 [ACK] Seq=1 Ack=1 Win=65536 Len=0
OneDrive,195,7.731642,172.30.1.1,172.30.1.250,TLSv1.2,604,Client Hello
OneDrive,196,7.732029,172.30.1.250,172.30.1.1,TCP,88,443  >  35576 [ACK] Seq=1 Ack=518 Win=2096128 Len=0
OneDrive,197,7.823604,172.30.1.250,172.30.1.1,TLSv1.2,6380,"Server Hello, Certificate, Certificate Status, Server Key Exchange, Server Hello Done"
OneDrive,198,7.825153,172.30.1.1,172.30.1.250,TCP,88,35576  >  443 [ACK] Seq=518 Ack=6293 Win=85504 Len=0
OneDrive,199,7.846684,172.30.1.1,172.30.1.250,TLSv1.2,244,"Client Key Exchange, Change Cipher Spec, Encrypted Handshake Message"
OneDrive,200,7.846895,172.30.1.250,172.30.1.1,TCP,88,443  >  35576 [ACK] Seq=6293 Ack=676 Win=2096640 Len=0
OneDrive,201,7.931931,172.30.1.250,172.30.1.1,TLSv1.2,140,"Change Cipher Spec, Encrypted Handshake Message"
OneDrive,202,7.932248,172.30.1.1,172.30.1.250,TCP,88,35576  >  443 [ACK] Seq=676 Ack=6344 Win=85504 Len=0
OneDrive,203,7.934655,172.30.1.1,172.30.1.250,TLSv1.2,1116,Application Data
OneDrive,204,7.934773,172.30.1.250,172.30.1.1,TCP,88,443  >  35576 [ACK] Seq=6344 Ack=1705 Win=2095616 Len=0
OneDrive,205,8.040009,172.30.1.250,172.30.1.1,TLSv1.2,616,Application Data
OneDrive,206,8.040741,172.30.1.1,172.30.1.250,TCP,88,35576  >  443 [ACK] Seq=1705 Ack=6871 Win=98304 Len=0
Messages,207,9.366402,172.30.1.1,172.30.1.250,QUIC,716,"Protected Payload (KP0), DCID=767e0476ff4b53fe"
Messages,208,9.36658,172.30.1.1,172.30.1.250,QUIC,108,"Protected Payload (KP0), DCID=767e0476ff4b53fe"
Messages,209,9.466692,172.30.1.1,172.30.1.250,QUIC,716,"Protected Payload (KP0), DCID=767e0476ff4b53fe"
Messages,210,9.66628,172.30.1.1,172.30.1.250,QUIC,108,"Protected Payload (KP0), DCID=767e0476ff4b53fe"
Messages,211,9.698589,172.30.1.250,172.30.1.1,QUIC,104,Protected Payload (KP0)
Messages,212,9.698787,172.30.1.250,172.30.1.1,QUIC,100,Protected Payload (KP0)
Messages,213,9.698844,172.30.1.250,172.30.1.1,QUIC,100,Protected Payload (KP0)
Messages,214,9.701025,172.30.1.1,172.30.1.250,QUIC,108,"Protected Payload (KP0), DCID=767e0476ff4b53fe"
Messages,215,9.707644,172.30.1.250,172.30.1.1,QUIC,104,Protected Payload (KP0)
Messages,216,10.13166,172.30.1.250,172.30.1.1,QUIC,192,Protected Payload (KP0)
Messages,217,10.134315,172.30.1.1,172.30.1.250,QUIC,112,"Protected Payload (KP0), DCID=767e0476ff4b53fe"
Messages,218,10.204076,172.30.1.250,172.30.1.1,QUIC,100,Protected Payload (KP0)
Messages,219,13.515903,172.30.1.1,172.30.1.250,QUIC,716,"Protected Payload (KP0), DCID=767e0476ff4b53fe"
Messages,220,13.518865,172.30.1.1,172.30.1.250,QUIC,108,"Protected Payload (KP0), DCID=767e0476ff4b53fe"
Messages,221,13.789794,172.30.1.1,172.30.1.250,QUIC,716,"Protected Payload (KP0), DCID=767e0476ff4b53fe"
Messages,222,13.811692,172.30.1.250,172.30.1.1,QUIC,104,Protected Payload (KP0)
Messages,223,13.81185,172.30.1.250,172.30.1.1,QUIC,100,Protected Payload (KP0)
Messages,224,13.811912,172.30.1.250,172.30.1.1,QUIC,100,Protected Payload (KP0)
Messages,225,13.811958,172.30.1.250,172.30.1.1,QUIC,100,Protected Payload (KP0)
Messages,226,13.815672,172.30.1.1,172.30.1.250,QUIC,108,"Protected Payload (KP0), DCID=767e0476ff4b53fe"
Messages,227,13.816203,172.30.1.1,172.30.1.250,QUIC,108,"Protected Payload (KP0), DCID=767e0476ff4b53fe"
Messages,228,13.842753,172.30.1.250,172.30.1.1,QUIC,100,Protected Payload (KP0)
Messages,229,13.849358,172.30.1.250,172.30.1.1,QUIC,100,Protected Payload (KP0)
Messages,230,13.939213,172.30.1.250,172.30.1.1,QUIC,192,Protected Payload (KP0)
Messages,231,13.940513,172.30.1.1,172.30.1.250,QUIC,112,"Protected Payload (KP0), DCID=767e0476ff4b53fe"
Messages,232,13.946591,172.30.1.250,172.30.1.1,QUIC,192,Protected Payload (KP0)
Messages,233,14.007102,172.30.1.250,172.30.1.1,QUIC,100,Protected Payload (KP0)
Messages,234,15.157621,172.30.1.250,172.30.1.1,TLSv1.3,124,Application Data
Messages,235,15.160688,172.30.1.1,172.30.1.250,TLSv1.3,124,Application Data
Messages,236,15.160798,172.30.1.250,172.30.1.1,TCP,88,443  >  53696 [ACK] Seq=7751 Ack=9428 Win=2096640 Len=0
Messages,237,15.161005,172.30.1.1,172.30.1.250,TLSv1.3,124,Application Data
Messages,238,15.161039,172.30.1.250,172.30.1.1,TCP,88,443  >  53696 [ACK] Seq=7751 Ack=9463 Win=2096640 Len=0
Messages,239,17.606184,172.30.1.1,172.30.1.250,QUIC,716,"Protected Payload (KP0), DCID=767e0476ff4b53fe"
Messages,240,17.606694,172.30.1.1,172.30.1.250,QUIC,108,"Protected Payload (KP0), DCID=767e0476ff4b53fe"
Messages,241,17.697585,172.30.1.250,172.30.1.1,QUIC,104,Protected Payload (KP0)
Messages,242,17.724426,172.30.1.1,172.30.1.250,QUIC,108,"Protected Payload (KP0), DCID=767e0476ff4b53fe"
Messages,243,17.725976,172.30.1.250,172.30.1.1,QUIC,100,Protected Payload (KP0)
Messages,244,18.132454,172.30.1.250,172.30.1.1,QUIC,192,Protected Payload (KP0)
Messages,245,18.134757,172.30.1.1,172.30.1.250,QUIC,112,"Protected Payload (KP0), DCID=767e0476ff4b53fe"
Messages,246,18.172187,172.30.1.250,172.30.1.1,QUIC,192,Protected Payload (KP0)
Messages,247,18.173292,172.30.1.1,172.30.1.250,QUIC,108,"Protected Payload (KP0), DCID=767e0476ff4b53fe"
Messages,248,18.202584,172.30.1.250,172.30.1.1,QUIC,100,Protected Payload (KP0)
WhatsApp,249,20.438442,172.30.1.1,172.30.1.250,TCP,92,"54988  >  443 [PSH, ACK] Seq=528 Ack=393 Win=67072 Len=3 [TCP segment of a reassembled PDU]"
WhatsApp,250,20.438957,172.30.1.250,172.30.1.1,TCP,88,443  >  54988 [ACK] Seq=393 Ack=531 Win=2096640 Len=0
WhatsApp,251,20.439406,172.30.1.1,172.30.1.250,SSL,124,Continuation Data
WhatsApp,252,20.441121,172.30.1.250,172.30.1.1,TCP,88,443  >  54988 [ACK] Seq=393 Ack=566 Win=2096640 Len=0
WhatsApp,253,20.601814,172.30.1.250,172.30.1.1,SSL,128,Continuation Data
WhatsApp,254,20.602117,172.30.1.1,172.30.1.250,TCP,88,54988  >  443 [ACK] Seq=566 Ack=434 Win=67072 Len=0
Messages,255,21.662844,172.30.1.1,172.30.1.250,QUIC,716,"Protected Payload (KP0), DCID=767e0476ff4b53fe"
Messages,256,21.663129,172.30.1.1,172.30.1.250,QUIC,108,"Protected Payload (KP0), DCID=767e0476ff4b53fe"
Messages,257,21.785056,172.30.1.250,172.30.1.1,QUIC,104,Protected Payload (KP0)
Messages,258,21.808844,172.30.1.250,172.30.1.1,QUIC,100,Protected Payload (KP0)
Messages,259,21.811875,172.30.1.1,172.30.1.250,QUIC,108,"Protected Payload (KP0), DCID=767e0476ff4b53fe"
Google Fi,260,21.883524,172.30.1.1,172.30.1.250,DNS,112,Standard query 0xdac1 A lens.l.google.com
Google Fi,261,21.938241,172.30.1.250,172.30.1.1,DNS,128,Standard query response 0xdac1 A lens.l.google.com A 142.250.111.127
Messages,262,22.113403,172.30.1.250,172.30.1.1,QUIC,192,Protected Payload (KP0)
Messages,263,22.117137,172.30.1.1,172.30.1.250,QUIC,112,"Protected Payload (KP0), DCID=767e0476ff4b53fe"
Messages,264,22.187538,172.30.1.250,172.30.1.1,QUIC,100,Protected Payload (KP0)
Messages,265,23.570352,172.30.1.1,172.30.1.250,QUIC,880,"Protected Payload (KP0), DCID=767e0476ff4b53fe"
Messages,266,23.570507,172.30.1.1,172.30.1.250,QUIC,108,"Protected Payload (KP0), DCID=767e0476ff4b53fe"
Messages,267,23.616819,172.30.1.250,172.30.1.1,QUIC,104,Protected Payload (KP0)
Messages,268,23.643582,172.30.1.1,172.30.1.250,QUIC,108,"Protected Payload (KP0), DCID=767e0476ff4b53fe"
Messages,269,23.649084,172.30.1.250,172.30.1.1,QUIC,100,Protected Payload (KP0)
Messages,270,23.891801,172.30.1.250,172.30.1.1,QUIC,192,Protected Payload (KP0)
Messages,271,23.892659,172.30.1.1,172.30.1.250,QUIC,112,"Protected Payload (KP0), DCID=767e0476ff4b53fe"
Messages,272,23.962842,172.30.1.250,172.30.1.1,QUIC,100,Protected Payload (KP0)
Google Play service,273,24.970503,172.30.1.250,172.30.1.1,TLSv1.3,432,Application Data
Google Play service,274,24.970694,172.30.1.1,172.30.1.250,TCP,88,33286  >  5228 [ACK] Seq=1081 Ack=7681 Win=109568 Len=0
Messages,275,24.971852,172.30.1.250,172.30.1.1,TLSv1.3,812,Application Data
Messages,276,24.973418,172.30.1.1,172.30.1.250,TLSv1.3,124,Application Data
Messages,277,24.973431,172.30.1.1,172.30.1.250,TLSv1.3,124,Application Data
Messages,278,24.97348,172.30.1.250,172.30.1.1,TCP,88,443  >  53696 [ACK] Seq=8477 Ack=9533 Win=2096640 Len=0
Google Play service,279,24.975112,172.30.1.1,172.30.1.250,TLSv1.3,124,Application Data
Google Play service,280,24.975174,172.30.1.250,172.30.1.1,TCP,88,5228  >  33286 [ACK] Seq=7681 Ack=1119 Win=2096640 Len=0
Messages,281,25.016579,172.30.1.1,172.30.1.250,QUIC,520,"Protected Payload (KP0), DCID=767e0476ff4b53fe"
Messages,282,25.016649,172.30.1.1,172.30.1.250,QUIC,108,"Protected Payload (KP0), DCID=767e0476ff4b53fe"
Messages,283,25.045719,172.30.1.250,172.30.1.1,TLSv1.3,124,Application Data
Messages,284,25.050114,172.30.1.250,172.30.1.1,QUIC,104,Protected Payload (KP0)
Messages,285,25.076423,172.30.1.250,172.30.1.1,QUIC,100,Protected Payload (KP0)
Messages,286,25.076674,172.30.1.1,172.30.1.250,QUIC,108,"Protected Payload (KP0), DCID=767e0476ff4b53fe"
Messages,287,25.091527,172.30.1.1,172.30.1.250,TCP,88,53696  >  443 [ACK] Seq=9533 Ack=8515 Win=133632 Len=0
Messages,288,25.136661,172.30.1.250,172.30.1.1,QUIC,184,Protected Payload (KP0)
Messages,289,25.137079,172.30.1.1,172.30.1.250,QUIC,112,"Protected Payload (KP0), DCID=767e0476ff4b53fe"
Messages,290,25.193296,172.30.1.250,172.30.1.1,QUIC,100,Protected Payload (KP0)
ChargePoint,291,27.885079,172.30.1.1,172.30.1.250,DNS,128,Standard query 0x1f35 A firebase-settings.crashlytics.com
ChargePoint,292,27.899844,172.30.1.1,172.30.1.250,DNS,108,Standard query 0x7455 A api.mixpanel.com
ChargePoint,293,27.997514,172.30.1.250,172.30.1.1,DNS,172,Standard query response 0x7455 A api.mixpanel.com A 107.178.240.159 A 130.211.34.183 A 35.186.241.51 A 35.190.25.25
ChargePoint,294,28.00046,172.30.1.1,172.30.1.250,TCP,108,35474  >  443 [SYN] Seq=0 Win=65535 Len=0 MSS=9960 SACK_PERM TSval=2727264308 TSecr=0 WS=512
ChargePoint,295,28.003336,172.30.1.1,172.30.1.250,DNS,112,Standard query 0x7b80 A decide.mixpanel.com
ChargePoint,296,28.006492,172.30.1.250,172.30.1.1,DNS,144,Standard query response 0x1f35 A firebase-settings.crashlytics.com A 142.250.80.99
ChargePoint,297,28.007684,172.30.1.1,172.30.1.250,TCP,108,47560  >  443 [SYN] Seq=0 Win=65535 Len=0 MSS=9960 SACK_PERM TSval=3289965952 TSecr=0 WS=512
ChargePoint,298,28.008399,172.30.1.1,172.30.1.250,DNS,120,Standard query 0xd3ed A discovery.chargepoint.com
ChargePoint,299,28.00909,172.30.1.1,172.30.1.250,DNS,116,Standard query 0xc864 A publish.chargepoint.com
ChargePoint,300,28.027538,172.30.1.250,172.30.1.1,TCP,96,"443  >  35474 [SYN, ACK] Seq=0 Ack=1 Win=4096 Len=0 MSS=9960 WS=512"
ChargePoint,301,28.027636,172.30.1.250,172.30.1.1,DNS,196,Standard query response 0x7b80 A decide.mixpanel.com CNAME api.mixpanel.com A 107.178.240.159 A 35.190.25.25 A 130.211.34.183 A 35.186.241.51
ChargePoint,302,28.027809,172.30.1.1,172.30.1.250,TCP,88,35474  >  443 [ACK] Seq=1 Ack=1 Win=65536 Len=0
ChargePoint,303,28.03245,172.30.1.1,172.30.1.250,TLSv1.3,604,Client Hello
ChargePoint,304,28.032631,172.30.1.250,172.30.1.1,TCP,88,443  >  35474 [ACK] Seq=1 Ack=518 Win=2096128 Len=0
ChargePoint,305,28.0391,172.30.1.250,172.30.1.1,TCP,96,"443  >  47560 [SYN, ACK] Seq=0 Ack=1 Win=4096 Len=0 MSS=9960 WS=512"
ChargePoint,306,28.039301,172.30.1.1,172.30.1.250,TCP,88,47560  >  443 [ACK] Seq=1 Ack=1 Win=65536 Len=0
ChargePoint,307,28.041048,172.30.1.1,172.30.1.250,TLSv1.3,604,Client Hello
ChargePoint,308,28.041217,172.30.1.250,172.30.1.1,TCP,88,443  >  47560 [ACK] Seq=1 Ack=518 Win=2096128 Len=0
ChargePoint,309,28.048297,172.30.1.250,172.30.1.1,DNS,148,Standard query response 0xc864 A publish.chargepoint.com A 34.218.36.2 A 54.218.223.74
ChargePoint,310,28.050172,172.30.1.1,172.30.1.250,TCP,108,36552  >  443 [SYN] Seq=0 Win=65535 Len=0 MSS=9960 SACK_PERM TSval=3486174633 TSecr=0 WS=512
ChargePoint,311,28.055206,172.30.1.250,172.30.1.1,DNS,236,Standard query response 0xd3ed A discovery.chargepoint.com CNAME default-us.chargepoint.com CNAME default-us.chargepoint.com.cdn.cloudflare.net A 172.64.152.218 A 104.18.35.38
ChargePoint,312,28.060525,172.30.1.1,172.30.1.250,TCP,108,48754  >  443 [SYN] Seq=0 Win=65535 Len=0 MSS=9960 SACK_PERM TSval=479006320 TSecr=0 WS=512
ChargePoint,313,28.067731,172.30.1.250,172.30.1.1,TLSv1.3,2760,"Server Hello, Change Cipher Spec"
ChargePoint,314,28.067919,172.30.1.1,172.30.1.250,TCP,88,35474  >  443 [ACK] Seq=518 Ack=2673 Win=85504 Len=0
ChargePoint,315,28.067937,172.30.1.250,172.30.1.1,TLSv1.3,1908,Application Data
ChargePoint,316,28.067968,172.30.1.1,172.30.1.250,TCP,88,35474  >  443 [ACK] Seq=518 Ack=4495 Win=91136 Len=0
ChargePoint,317,28.074678,172.30.1.250,172.30.1.1,TLSv1.3,2760,"Server Hello, Change Cipher Spec"
ChargePoint,318,28.074829,172.30.1.1,172.30.1.250,TCP,88,47560  >  443 [ACK] Seq=518 Ack=2673 Win=85504 Len=0
ChargePoint,319,28.074846,172.30.1.250,172.30.1.1,TLSv1.3,1732,Application Data
ChargePoint,320,28.074878,172.30.1.1,172.30.1.250,TCP,88,47560  >  443 [ACK] Seq=518 Ack=4316 Win=91136 Len=0
ChargePoint,321,28.082488,172.30.1.250,172.30.1.1,TCP,96,"443  >  48754 [SYN, ACK] Seq=0 Ack=1 Win=4096 Len=0 MSS=9960 WS=512"
ChargePoint,322,28.082784,172.30.1.1,172.30.1.250,TCP,88,48754  >  443 [ACK] Seq=1 Ack=1 Win=65536 Len=0
ChargePoint,323,28.084796,172.30.1.1,172.30.1.250,TLSv1.3,604,Client Hello
ChargePoint,324,28.085101,172.30.1.250,172.30.1.1,TCP,88,443  >  48754 [ACK] Seq=1 Ack=518 Win=2096128 Len=0
ChargePoint,325,28.094791,172.30.1.1,172.30.1.250,TLSv1.3,152,"Change Cipher Spec, Application Data"
ChargePoint,326,28.094878,172.30.1.250,172.30.1.1,TCP,88,443  >  47560 [ACK] Seq=4316 Ack=582 Win=2096640 Len=0
ChargePoint,327,28.095157,172.30.1.1,172.30.1.250,TLSv1.3,888,Application Data
ChargePoint,328,28.095201,172.30.1.250,172.30.1.1,TCP,88,443  >  47560 [ACK] Seq=4316 Ack=1384 Win=2096128 Len=0
ChargePoint,329,28.095771,172.30.1.1,172.30.1.250,TLSv1.3,152,"Change Cipher Spec, Application Data"
ChargePoint,330,28.095807,172.30.1.250,172.30.1.1,TCP,88,443  >  35474 [ACK] Seq=4495 Ack=582 Win=2096640 Len=0
ChargePoint,331,28.095922,172.30.1.1,172.30.1.250,TLSv1.3,616,Application Data
ChargePoint,332,28.095955,172.30.1.250,172.30.1.1,TCP,88,443  >  35474 [ACK] Seq=4495 Ack=1110 Win=2096128 Len=0
ChargePoint,333,28.119579,172.30.1.250,172.30.1.1,TLSv1.3,2708,"Server Hello, Change Cipher Spec, Application Data"
ChargePoint,334,28.119756,172.30.1.1,172.30.1.250,TCP,88,48754  >  443 [ACK] Seq=518 Ack=2621 Win=85504 Len=0
ChargePoint,335,28.128803,172.30.1.1,172.30.1.250,TLSv1.3,152,"Change Cipher Spec, Application Data"
ChargePoint,336,28.128885,172.30.1.250,172.30.1.1,TCP,88,443  >  48754 [ACK] Seq=2621 Ack=582 Win=2096640 Len=0
ChargePoint,337,28.130714,172.30.1.1,172.30.1.250,TLSv1.3,132,Application Data
ChargePoint,338,28.130786,172.30.1.250,172.30.1.1,TCP,88,443  >  48754 [ACK] Seq=2621 Ack=628 Win=2096640 Len=0
ChargePoint,339,28.131312,172.30.1.1,172.30.1.250,TLSv1.3,124,Application Data
ChargePoint,340,28.131359,172.30.1.250,172.30.1.1,TCP,88,443  >  48754 [ACK] Seq=2621 Ack=665 Win=2096640 Len=0
ChargePoint,341,28.131523,172.30.1.1,172.30.1.250,TLSv1.3,124,Application Data
ChargePoint,342,28.131675,172.30.1.250,172.30.1.1,TCP,88,443  >  48754 [ACK] Seq=2621 Ack=700 Win=2096640 Len=0
ChargePoint,343,28.133103,172.30.1.1,172.30.1.250,TLSv1.3,1072,Application Data
ChargePoint,344,28.133172,172.30.1.250,172.30.1.1,TCP,88,443  >  48754 [ACK] Seq=2621 Ack=1686 Win=2095616 Len=0
ChargePoint,345,28.144683,172.30.1.250,172.30.1.1,TLSv1.3,1124,"Application Data, Application Data"
ChargePoint,346,28.144777,172.30.1.1,172.30.1.250,TCP,88,35474  >  443 [ACK] Seq=1110 Ack=5532 Win=96256 Len=0
ChargePoint,347,28.147495,172.30.1.250,172.30.1.1,TCP,96,"443  >  36552 [SYN, ACK] Seq=0 Ack=1 Win=4096 Len=0 MSS=9960 WS=512"
ChargePoint,348,28.14761,172.30.1.1,172.30.1.250,TCP,88,36552  >  443 [ACK] Seq=1 Ack=1 Win=65536 Len=0
ChargePoint,349,28.149345,172.30.1.1,172.30.1.250,TLSv1.2,604,Client Hello
ChargePoint,350,28.149547,172.30.1.250,172.30.1.1,TCP,88,443  >  36552 [ACK] Seq=1 Ack=518 Win=2096128 Len=0
ChargePoint,351,28.156291,172.30.1.250,172.30.1.1,TLSv1.3,600,"Application Data, Application Data"
ChargePoint,352,28.156444,172.30.1.1,172.30.1.250,TCP,88,48754  >  443 [ACK] Seq=1686 Ack=3133 Win=91136 Len=0
ChargePoint,353,28.157889,172.30.1.1,172.30.1.250,TLSv1.3,120,Application Data
ChargePoint,354,28.15798,172.30.1.250,172.30.1.1,TCP,88,443  >  48754 [ACK] Seq=3133 Ack=1717 Win=2095616 Len=0
ChargePoint,355,28.166222,172.30.1.250,172.30.1.1,TLSv1.3,120,Application Data
ChargePoint,356,28.166488,172.30.1.1,172.30.1.250,TCP,88,48754  >  443 [ACK] Seq=1717 Ack=3164 Win=91136 Len=0
ChargePoint,357,28.199335,172.30.1.1,172.30.1.250,DNS,128,Standard query 0x6a3b A firebaseremoteconfig.googleapis.com
ChargePoint,358,28.209469,172.30.1.250,172.30.1.1,TLSv1.3,1972,"Application Data, Application Data, Application Data, Application Data"
ChargePoint,359,28.209565,172.30.1.1,172.30.1.250,TCP,88,47560  >  443 [ACK] Seq=1384 Ack=6201 Win=96256 Len=0
ChargePoint,360,28.242501,172.30.1.250,172.30.1.1,DNS,384,Standard query response 0x6a3b A firebaseremoteconfig.googleapis.com A 142.250.81.234 A 142.251.41.10 A 142.251.32.106 A 142.251.35.170 A 142.251.40.106 A 142.251.40.138 A 142.251.40.170 A 142.250.64.74 A 142.250.64.106 A 142.250.72.106 A 142.250.80.10 A 142.250.80.42 A 142.250.80.74 A 142.250.80.106 A 142.250.176.202 A 142.251.40.202
ChargePoint,361,28.244252,172.30.1.1,172.30.1.250,TCP,108,60644  >  443 [SYN] Seq=0 Win=65535 Len=0 MSS=9960 SACK_PERM TSval=62679190 TSecr=0 WS=512
ChargePoint,362,28.272302,172.30.1.250,172.30.1.1,TCP,2760,"443  >  36552 [PSH, ACK] Seq=1 Ack=518 Win=2097152 Len=2672 [TCP segment of a reassembled PDU]"
ChargePoint,363,28.272559,172.30.1.1,172.30.1.250,TCP,88,36552  >  443 [ACK] Seq=518 Ack=2673 Win=85504 Len=0
ChargePoint,364,28.27494,172.30.1.250,172.30.1.1,TLSv1.2,2276,"Server Hello, Certificate, Server Key Exchange, Server Hello Done"
ChargePoint,365,28.275171,172.30.1.1,172.30.1.250,TCP,88,36552  >  443 [ACK] Seq=518 Ack=4863 Win=105472 Len=0
ChargePoint,366,28.27813,172.30.1.250,172.30.1.1,TCP,96,"443  >  60644 [SYN, ACK] Seq=0 Ack=1 Win=4096 Len=0 MSS=9960 WS=512"
ChargePoint,367,28.278294,172.30.1.1,172.30.1.250,TCP,88,60644  >  443 [ACK] Seq=1 Ack=1 Win=65536 Len=0
ChargePoint,368,28.278991,172.30.1.1,172.30.1.250,TLSv1.3,604,Client Hello
ChargePoint,369,28.279134,172.30.1.250,172.30.1.1,TCP,88,443  >  60644 [ACK] Seq=1 Ack=518 Win=2096128 Len=0
ChargePoint,370,28.279742,172.30.1.1,172.30.1.250,TLSv1.2,212,"Client Key Exchange, Change Cipher Spec, Encrypted Handshake Message"
