App name,No.,Time,Source,Destination,Protocol,Length,Info
Google Fi,1,0,172.30.1.1,172.30.1.250,DNS,124,Standard query 0x4d54 A connectivitycheck.gstatic.com
Facebook,2,0.006051,172.30.1.1,172.30.1.250,DNS,116,Standard query 0xd299 A edge-mqtt.facebook.com
Facebook,3,0.006846,172.30.1.1,172.30.1.250,TCP,108,53892  >  443 [SYN] Seq=0 Win=65535 Len=0 MSS=9960 SACK_PERM TSval=557253987 TSecr=0 WS=512
Google Fi,4,0.031572,172.30.1.250,172.30.1.1,DNS,140,Standard query response 0x4d54 A connectivitycheck.gstatic.com A 142.250.64.99
Facebook,5,0.031846,172.30.1.250,172.30.1.1,DNS,156,Standard query response 0xd299 A edge-mqtt.facebook.com CNAME mqtt.c10r.facebook.com A 157.240.241.20
Facebook,6,0.041634,172.30.1.250,172.30.1.1,TCP,96,"443  >  53892 [SYN, ACK] Seq=0 Ack=1 Win=4096 Len=0 MSS=9960 WS=512"
Facebook,7,0.041715,172.30.1.1,172.30.1.250,TCP,88,53892  >  443 [ACK] Seq=1 Ack=1 Win=65536 Len=0
Facebook,8,0.081508,172.30.1.1,172.30.1.250,TLSv1.3,584,Client Hello
Facebook,9,0.081661,172.30.1.250,172.30.1.1,TCP,88,443  >  53892 [ACK] Seq=1 Ack=498 Win=2096640 Len=0
Facebook,10,0.1167,172.30.1.250,172.30.1.1,TLSv1.3,292,"Server Hello, Change Cipher Spec, Application Data"
Facebook,11,0.116831,172.30.1.1,172.30.1.250,TCP,88,53892  >  443 [ACK] Seq=498 Ack=204 Win=67072 Len=0
Facebook,12,0.145653,172.30.1.1,172.30.1.250,TLSv1.3,152,"Change Cipher Spec, Application Data"
Facebook,13,0.145732,172.30.1.250,172.30.1.1,TCP,88,443  >  53892 [ACK] Seq=204 Ack=562 Win=2096640 Len=0
Facebook,14,0.146439,172.30.1.1,172.30.1.250,TLSv1.3,356,Application Data
Facebook,15,0.146498,172.30.1.250,172.30.1.1,TCP,88,443  >  53892 [ACK] Seq=204 Ack=829 Win=2096640 Len=0
Facebook,16,0.171709,172.30.1.250,172.30.1.1,TLSv1.3,264,Application Data
Facebook,17,0.171809,172.30.1.1,172.30.1.250,TCP,88,53892  >  443 [ACK] Seq=829 Ack=381 Win=68096 Len=0
Facebook,18,0.199925,172.30.1.250,172.30.1.1,TLSv1.3,112,Application Data
Facebook,19,0.200046,172.30.1.1,172.30.1.250,TCP,88,53892  >  443 [ACK] Seq=829 Ack=407 Win=68096 Len=0
Facebook,20,0.210374,172.30.1.250,172.30.1.1,TLSv1.3,128,Application Data
Facebook,21,0.210486,172.30.1.1,172.30.1.250,TCP,88,53892  >  443 [ACK] Seq=829 Ack=448 Win=68096 Len=0
Facebook,22,0.214213,172.30.1.1,172.30.1.250,TLSv1.3,480,Application Data
Facebook,23,0.214347,172.30.1.250,172.30.1.1,TCP,88,443  >  53892 [ACK] Seq=448 Ack=1221 Win=2096640 Len=0
Facebook,24,0.214851,172.30.1.1,172.30.1.250,TLSv1.3,132,Application Data
Facebook,25,0.214876,172.30.1.250,172.30.1.1,TCP,88,443  >  53892 [ACK] Seq=448 Ack=1264 Win=2096640 Len=0
Facebook,26,0.228613,172.30.1.1,172.30.1.250,DNS,112,Standard query 0x9e57 A graph.facebook.com
Facebook,27,0.232068,172.30.1.1,172.30.1.250,QUIC,1308,"Initial, DCID=448520339d33ebf0, PKN: 13827524, CRYPTO, PADDING"
Facebook,28,0.232791,172.30.1.1,172.30.1.250,QUIC,144,"0-RTT, DCID=448520339d33ebf0"
Facebook,29,0.250683,172.30.1.250,172.30.1.1,DNS,152,Standard query response 0x9e57 A graph.facebook.com CNAME star.c10r.facebook.com A 157.240.241.17
Facebook,30,0.25567,172.30.1.250,172.30.1.1,TLSv1.3,140,"Application Data, Application Data"
Facebook,31,0.255823,172.30.1.1,172.30.1.250,TCP,88,53892  >  443 [ACK] Seq=1264 Ack=500 Win=68096 Len=0
Facebook,32,0.268429,172.30.1.250,172.30.1.1,QUIC,1308,"Initial, SCID=68a3454695591784, PKN: 9906362, CRYPTO, ACK, PADDING"
Facebook,33,0.268589,172.30.1.250,172.30.1.1,QUIC,268,"Handshake, SCID=68a3454695591784"
Facebook,34,0.268654,172.30.1.250,172.30.1.1,QUIC,156,Protected Payload (KP0)
Facebook,35,0.275896,172.30.1.1,172.30.1.250,QUIC,160,"Handshake, DCID=68a3454695591784"
Facebook,36,0.27605,172.30.1.1,172.30.1.250,QUIC,1308,"Protected Payload (KP0), DCID=68a3454695591784"
Facebook,37,0.27671,172.30.1.1,172.30.1.250,QUIC,380,"Protected Payload (KP0), DCID=68a3454695591784"
Facebook,38,0.301217,172.30.1.250,172.30.1.1,QUIC,116,"Handshake, SCID=68a3454695591784"
Facebook,39,0.301542,172.30.1.250,172.30.1.1,QUIC,188,Protected Payload (KP0)
Facebook,40,0.301602,172.30.1.250,172.30.1.1,QUIC,348,Protected Payload (KP0)
Facebook,41,0.30247,172.30.1.1,172.30.1.250,QUIC,124,"Protected Payload (KP0), DCID=68a3454695591784"
Facebook,42,0.320761,172.30.1.250,172.30.1.1,QUIC,124,Protected Payload (KP0)
Facebook,43,0.512214,172.30.1.250,172.30.1.1,QUIC,924,Protected Payload (KP0)
Facebook,44,0.540589,172.30.1.1,172.30.1.250,QUIC,124,"Protected Payload (KP0), DCID=68a3454695591784"
Facebook,45,0.541581,172.30.1.1,172.30.1.250,QUIC,124,"Protected Payload (KP0), DCID=68a3454695591784"
Facebook,46,0.591694,172.30.1.250,172.30.1.1,QUIC,124,Protected Payload (KP0)
Teams,47,1.250272,172.30.1.1,172.30.1.250,DNS,140,Standard query 0xec12 A trouter2-usce-0-b.trouter.teams.microsoft.com
Teams,48,1.252678,172.30.1.1,172.30.1.250,TCP,108,34363  >  443 [SYN] Seq=0 Win=65535 Len=0 MSS=9960 SACK_PERM TSval=108613196 TSecr=0 WS=512
Teams,49,1.25432,172.30.1.1,172.30.1.250,DNS,140,Standard query 0xcad2 AAAA trouter2-usce-0-b.trouter.teams.microsoft.com
Teams,50,1.36812,172.30.1.250,172.30.1.1,DNS,200,Standard query response 0xec12 A trouter2-usce-0-b.trouter.teams.microsoft.com CNAME trouter2-usce-0-b.cloudapp.net A 52.115.92.13
Teams,51,1.369221,172.30.1.250,172.30.1.1,DNS,212,Standard query response 0xcad2 AAAA trouter2-usce-0-b.trouter.teams.microsoft.com CNAME trouter2-usce-0-b.cloudapp.net AAAA 2603:1030:7:6::ad
Teams,52,1.399362,172.30.1.250,172.30.1.1,TCP,96,"443  >  34363 [SYN, ACK] Seq=0 Ack=1 Win=4096 Len=0 MSS=9960 WS=512"
Teams,53,1.399706,172.30.1.1,172.30.1.250,TCP,88,34363  >  443 [ACK] Seq=1 Ack=1 Win=65536 Len=0
Teams,54,1.40432,172.30.1.1,172.30.1.250,TLSv1.2,396,Client Hello
Teams,55,1.404704,172.30.1.250,172.30.1.1,TCP,88,443  >  34363 [ACK] Seq=1 Ack=310 Win=2096640 Len=0
Teams,56,1.486906,172.30.1.250,172.30.1.1,TLSv1.2,4288,"Server Hello, Certificate, Server Key Exchange, Server Hello Done"
Teams,57,1.488838,172.30.1.1,172.30.1.250,TCP,88,34363  >  443 [ACK] Seq=310 Ack=4203 Win=74240 Len=0
Teams,58,1.529263,172.30.1.1,172.30.1.250,TLSv1.2,244,"Client Key Exchange, Change Cipher Spec, Encrypted Handshake Message"
Teams,59,1.529751,172.30.1.250,172.30.1.1,TCP,88,443  >  34363 [ACK] Seq=4203 Ack=468 Win=2096640 Len=0
Teams,60,1.600769,172.30.1.250,172.30.1.1,TLSv1.2,140,"Change Cipher Spec, Encrypted Handshake Message"
Teams,61,1.601157,172.30.1.1,172.30.1.250,TCP,88,34363  >  443 [ACK] Seq=468 Ack=4254 Win=74240 Len=0
Teams,62,1.602448,172.30.1.1,172.30.1.250,TLSv1.2,1596,Application Data
Teams,63,1.602599,172.30.1.250,172.30.1.1,TCP,88,443  >  34363 [ACK] Seq=4254 Ack=1977 Win=2095616 Len=0
Teams,64,1.684545,172.30.1.250,172.30.1.1,TLSv1.2,472,Application Data
Teams,65,1.684693,172.30.1.1,172.30.1.250,TCP,88,34363  >  443 [ACK] Seq=1977 Ack=4639 Win=82432 Len=0
Teams,66,1.687318,172.30.1.250,172.30.1.1,TLSv1.2,924,"Application Data, Application Data"
Teams,67,1.687427,172.30.1.1,172.30.1.250,TCP,88,34363  >  443 [ACK] Seq=1977 Ack=5476 Win=91136 Len=0
Teams,68,1.690186,172.30.1.1,172.30.1.250,TLSv1.2,216,Application Data
Teams,69,1.690266,172.30.1.250,172.30.1.1,TCP,88,443  >  34363 [ACK] Seq=5476 Ack=2106 Win=2096640 Len=0
Teams,70,1.701344,172.30.1.1,172.30.1.250,DNS,112,Standard query 0xdc88 A teams.microsoft.com
Teams,71,1.742346,172.30.1.250,172.30.1.1,DNS,264,Standard query response 0xdc88 A teams.microsoft.com CNAME teams.office.com CNAME teams-mira-afd.trafficmanager.net CNAME teams-office-com.s-0005.s-msedge.net CNAME s-0005.s-msedge.net A 52.113.194.132
Teams,72,1.745344,172.30.1.1,172.30.1.250,TCP,108,51814  >  443 [SYN] Seq=0 Win=65535 Len=0 MSS=9960 SACK_PERM TSval=3752472812 TSecr=0 WS=512
Teams,73,1.746595,172.30.1.1,172.30.1.250,TCP,108,51816  >  443 [SYN] Seq=0 Win=65535 Len=0 MSS=9960 SACK_PERM TSval=3752472812 TSecr=0 WS=512
Teams,74,1.756251,172.30.1.1,172.30.1.250,TCP,108,52803  >  443 [SYN] Seq=0 Win=65535 Len=0 MSS=9960 SACK_PERM TSval=4098704860 TSecr=0 WS=512
Teams,75,1.757198,172.30.1.1,172.30.1.250,DNS,124,Standard query 0xfdfe A ic3.events.data.microsoft.com
Teams,76,1.758229,172.30.1.1,172.30.1.250,DNS,124,Standard query 0x3260 AAAA ic3.events.data.microsoft.com
Teams,77,1.7587,172.30.1.250,172.30.1.1,TLSv1.2,128,Application Data
Teams,78,1.758778,172.30.1.1,172.30.1.250,TCP,88,34363  >  443 [ACK] Seq=2106 Ack=5517 Win=91136 Len=0
Teams,79,1.770302,172.30.1.250,172.30.1.1,TCP,96,"443  >  51814 [SYN, ACK] Seq=0 Ack=1 Win=4096 Len=0 MSS=9960 WS=512"
Teams,80,1.770573,172.30.1.1,172.30.1.250,TCP,88,51814  >  443 [ACK] Seq=1 Ack=1 Win=65536 Len=0
Teams,81,1.770613,172.30.1.250,172.30.1.1,TCP,96,"443  >  51816 [SYN, ACK] Seq=0 Ack=1 Win=4096 Len=0 MSS=9960 WS=512"
Teams,82,1.770739,172.30.1.1,172.30.1.250,TCP,88,51816  >  443 [ACK] Seq=1 Ack=1 Win=65536 Len=0
Teams,83,1.773627,172.30.1.1,172.30.1.250,TLSv1.2,648,Client Hello
Teams,84,1.773834,172.30.1.1,172.30.1.250,TLSv1.2,648,Client Hello
Teams,85,1.774016,172.30.1.250,172.30.1.1,TCP,88,443  >  51814 [ACK] Seq=1 Ack=560 Win=2096128 Len=0
Teams,86,1.774103,172.30.1.250,172.30.1.1,TCP,88,443  >  51816 [ACK] Seq=1 Ack=560 Win=2096128 Len=0
Teams,87,1.791314,172.30.1.250,172.30.1.1,DNS,248,Standard query response 0xfdfe A ic3.events.data.microsoft.com CNAME teams-events-data.trafficmanager.net CNAME onedscolprdfrc07.francecentral.cloudapp.azure.com A 51.11.192.49
Teams,88,1.79185,172.30.1.250,172.30.1.1,DNS,288,Standard query response 0x3260 AAAA ic3.events.data.microsoft.com CNAME teams-events-data.trafficmanager.net CNAME onedscolprdeus06.eastus.cloudapp.azure.com SOA ns1-201.azure-dns.com
Teams,89,1.80615,172.30.1.250,172.30.1.1,TCP,1436,"443  >  51814 [PSH, ACK] Seq=1 Ack=560 Win=2097152 Len=1348 [TCP segment of a reassembled PDU]"
Teams,90,1.806536,172.30.1.1,172.30.1.250,TCP,88,51814  >  443 [ACK] Seq=560 Ack=1349 Win=85504 Len=0
Teams,91,1.808528,172.30.1.250,172.30.1.1,TLSv1.2,4688,"Server Hello, Certificate, Certificate Status, Server Key Exchange, Server Hello Done"
Teams,92,1.808999,172.30.1.1,172.30.1.250,TCP,88,51814  >  443 [ACK] Seq=560 Ack=5948 Win=105472 Len=0
Teams,93,1.811961,172.30.1.250,172.30.1.1,TCP,5480,"443  >  51816 [PSH, ACK] Seq=1 Ack=560 Win=2097152 Len=5392 [TCP segment of a reassembled PDU]"
Teams,94,1.812214,172.30.1.1,172.30.1.250,TCP,88,51816  >  443 [ACK] Seq=560 Ack=5393 Win=85504 Len=0
Teams,95,1.835802,172.30.1.1,172.30.1.250,TLSv1.2,244,"Client Key Exchange, Change Cipher Spec, Encrypted Handshake Message"
Teams,96,1.835924,172.30.1.250,172.30.1.1,TCP,88,443  >  51814 [ACK] Seq=5948 Ack=718 Win=2096640 Len=0
Teams,97,1.842613,172.30.1.250,172.30.1.1,TLSv1.2,644,"Server Hello, Certificate, Certificate Status, Server Key Exchange, Server Hello Done"
Teams,98,1.843179,172.30.1.1,172.30.1.250,TCP,88,51816  >  443 [ACK] Seq=560 Ack=5948 Win=96256 Len=0
Teams,99,1.853463,172.30.1.250,172.30.1.1,TCP,96,"443  >  52803 [SYN, ACK] Seq=0 Ack=1 Win=4096 Len=0 MSS=9960 WS=512"
Teams,100,1.853738,172.30.1.1,172.30.1.250,TCP,88,52803  >  443 [ACK] Seq=1 Ack=1 Win=65536 Len=0
Teams,101,1.854951,172.30.1.1,172.30.1.250,TLSv1.2,380,Client Hello
Teams,102,1.855315,172.30.1.250,172.30.1.1,TCP,88,443  >  52803 [ACK] Seq=1 Ack=294 Win=2096640 Len=0
Teams,103,1.864812,172.30.1.1,172.30.1.250,TLSv1.2,244,"Client Key Exchange, Change Cipher Spec, Encrypted Handshake Message"
Teams,104,1.864903,172.30.1.250,172.30.1.1,TCP,88,443  >  51816 [ACK] Seq=5948 Ack=718 Win=2096640 Len=0
Teams,105,1.867075,172.30.1.250,172.30.1.1,TLSv1.2,428,"New Session Ticket, Change Cipher Spec, Encrypted Handshake Message"
Teams,106,1.867292,172.30.1.1,172.30.1.250,TCP,88,51814  >  443 [ACK] Seq=718 Ack=6290 Win=114688 Len=0
Teams,107,1.869201,172.30.1.1,172.30.1.250,TLSv1.2,140,Application Data
Teams,108,1.869266,172.30.1.250,172.30.1.1,TLSv1.2,156,Application Data
Teams,109,1.869415,172.30.1.1,172.30.1.250,TCP,88,51814  >  443 [ACK] Seq=771 Ack=6359 Win=114688 Len=0
Teams,110,1.869517,172.30.1.250,172.30.1.1,TCP,88,443  >  51814 [ACK] Seq=6359 Ack=771 Win=2096640 Len=0
Teams,111,1.869639,172.30.1.1,172.30.1.250,TLSv1.2,172,"Application Data, Application Data"
Teams,112,1.869735,172.30.1.250,172.30.1.1,TCP,88,443  >  51814 [ACK] Seq=6359 Ack=857 Win=2096640 Len=0
Teams,113,1.871691,172.30.1.1,172.30.1.250,TLSv1.2,124,Application Data
Teams,114,1.87176,172.30.1.250,172.30.1.1,TCP,88,443  >  51814 [ACK] Seq=6359 Ack=895 Win=2096640 Len=0
Teams,115,1.873395,172.30.1.1,172.30.1.250,TLSv1.2,3832,Application Data
Teams,116,1.873495,172.30.1.250,172.30.1.1,TCP,88,443  >  51814 [ACK] Seq=6359 Ack=4640 Win=2093056 Len=0
Teams,117,1.903996,172.30.1.250,172.30.1.1,TLSv1.2,500,"New Session Ticket, Change Cipher Spec, Encrypted Handshake Message, Application Data"
Teams,118,1.904453,172.30.1.1,172.30.1.250,TCP,88,51816  >  443 [ACK] Seq=718 Ack=6359 Win=107520 Len=0
Teams,119,1.905911,172.30.1.1,172.30.1.250,TLSv1.2,140,Application Data
Teams,120,1.906158,172.30.1.250,172.30.1.1,TCP,88,443  >  51816 [ACK] Seq=6359 Ack=771 Win=2096640 Len=0
Teams,121,1.906333,172.30.1.1,172.30.1.250,TLSv1.2,172,"Application Data, Application Data"
Teams,122,1.906443,172.30.1.250,172.30.1.1,TCP,88,443  >  51816 [ACK] Seq=6359 Ack=857 Win=2096640 Len=0
Teams,123,1.906561,172.30.1.1,172.30.1.250,TLSv1.2,120,Encrypted Alert
Teams,124,1.906768,172.30.1.250,172.30.1.1,TLSv1.2,124,Application Data
Teams,125,1.90687,172.30.1.250,172.30.1.1,TCP,88,443  >  51816 [ACK] Seq=6359 Ack=888 Win=2096640 Len=0
Teams,126,1.906898,172.30.1.1,172.30.1.250,TCP,88,51814  >  443 [ACK] Seq=4640 Ack=6397 Win=114688 Len=0
Teams,127,1.907401,172.30.1.1,172.30.1.250,TCP,88,"51816  >  443 [FIN, ACK] Seq=888 Ack=6359 Win=107520 Len=0"
Teams,128,1.907411,172.30.1.250,172.30.1.1,TCP,88,443  >  51816 [ACK] Seq=6359 Ack=889 Win=2096640 Len=0
Teams,129,1.910069,172.30.1.1,172.30.1.250,TLSv1.2,3148,Application Data
Teams,130,1.910191,172.30.1.250,172.30.1.1,TCP,88,443  >  51814 [ACK] Seq=6397 Ack=7701 Win=2089984 Len=0
Teams,131,1.934917,172.30.1.250,172.30.1.1,TLSv1.2,124,Application Data
Teams,132,1.935091,172.30.1.1,172.30.1.250,TCP,88,51816  >  443 [RST] Seq=889 Win=0 Len=0
Teams,133,1.935237,172.30.1.250,172.30.1.1,TCP,88,"443  >  51816 [RST, ACK] Seq=6397 Ack=889 Win=65024 Len=0"
Teams,134,1.966526,172.30.1.250,172.30.1.1,TLSv1.2,4592,"Server Hello, Certificate, Server Key Exchange, Server Hello Done"
Teams,135,1.967038,172.30.1.1,172.30.1.250,TCP,88,52803  >  443 [ACK] Seq=294 Ack=4504 Win=85504 Len=0
Teams,136,1.992266,172.30.1.1,172.30.1.250,TLSv1.2,244,"Client Key Exchange, Change Cipher Spec, Encrypted Handshake Message"
Teams,137,1.992439,172.30.1.250,172.30.1.1,TCP,88,443  >  52803 [ACK] Seq=4504 Ack=452 Win=2096640 Len=0
Teams,138,1.998294,172.30.1.250,172.30.1.1,TLSv1.2,344,Application Data
Teams,139,2.042257,172.30.1.1,172.30.1.250,TCP,88,51814  >  443 [ACK] Seq=7701 Ack=6655 Win=123904 Len=0
Teams,140,2.059971,172.30.1.1,172.30.1.250,TLSv1.2,1024,Application Data
Teams,141,2.060156,172.30.1.250,172.30.1.1,TCP,88,443  >  51814 [ACK] Seq=6655 Ack=8636 Win=2096128 Len=0
Teams,142,2.06609,172.30.1.250,172.30.1.1,TLSv1.2,260,Application Data
Teams,143,2.066227,172.30.1.1,172.30.1.250,TCP,88,51814  >  443 [ACK] Seq=8636 Ack=6827 Win=133120 Len=0
Teams,144,2.09473,172.30.1.250,172.30.1.1,TLSv1.2,140,"Change Cipher Spec, Encrypted Handshake Message"
Teams,145,2.094872,172.30.1.1,172.30.1.250,TCP,88,52803  >  443 [ACK] Seq=452 Ack=4555 Win=85504 Len=0
Teams,146,2.09624,172.30.1.1,172.30.1.250,TLSv1.2,512,Application Data
Teams,147,2.096344,172.30.1.250,172.30.1.1,TCP,88,443  >  52803 [ACK] Seq=4555 Ack=878 Win=2096640 Len=0
Teams,148,2.096542,172.30.1.1,172.30.1.250,TLSv1.2,1300,Application Data
Teams,149,2.096599,172.30.1.250,172.30.1.1,TCP,88,443  >  52803 [ACK] Seq=4555 Ack=2091 Win=2095104 Len=0
Teams,150,2.118009,172.30.1.1,172.30.1.250,TLSv1.2,976,Application Data
Teams,151,2.118201,172.30.1.250,172.30.1.1,TCP,88,443  >  51814 [ACK] Seq=6827 Ack=9523 Win=2096128 Len=0
Teams,152,2.16052,172.30.1.250,172.30.1.1,TLSv1.2,256,Application Data
Teams,153,2.160711,172.30.1.1,172.30.1.250,TCP,88,51814  >  443 [ACK] Seq=9523 Ack=6997 Win=142336 Len=0
Teams,154,2.236437,172.30.1.250,172.30.1.1,TLSv1.2,260,Application Data
Teams,155,2.236945,172.30.1.1,172.30.1.250,TCP,88,51814  >  443 [ACK] Seq=9523 Ack=7168 Win=151552 Len=0
Teams,156,2.337278,172.30.1.250,172.30.1.1,TLSv1.2,560,Application Data
Teams,157,2.337478,172.30.1.1,172.30.1.250,TCP,88,52803  >  443 [ACK] Seq=2091 Ack=5027 Win=94720 Len=0
Accountable2You,158,4.09224,172.30.1.1,172.30.1.250,DNS,112,Standard query 0x28a1 A clients3.google.com
Google Play service,159,4.968986,172.30.1.1,172.30.1.250,DNS,108,Standard query 0xef11 A mtalk.google.com
Google Fi,160,5.09666,172.30.1.1,172.30.1.250,DNS,124,Standard query 0x11b8 A ficontinuity-pa.googleapis.com
Google Play service,161,5.851987,172.30.1.250,172.30.1.1,DNS,156,Standard query response 0xef11 A mtalk.google.com CNAME mobile-gtalk.l.google.com A 142.251.163.188
Google Fi,162,5.853368,172.30.1.250,172.30.1.1,DNS,380,Standard query response 0x11b8 A ficontinuity-pa.googleapis.com A 142.250.80.42 A 142.250.80.74 A 142.250.80.106 A 142.250.176.202 A 142.251.40.202 A 142.251.40.234 A 172.217.165.138 A 142.250.65.170 A 142.250.65.202 A 142.250.65.234 A 142.250.81.234 A 142.251.41.10 A 142.251.32.106 A 142.251.35.170 A 142.251.40.106 A 142.251.40.138
Google Fi,163,5.864928,172.30.1.1,172.30.1.250,TCP,108,42216  >  443 [SYN] Seq=0 Win=65535 Len=0 MSS=9960 SACK_PERM TSval=3313030239 TSecr=0 WS=512
Google Play service,164,5.86825,172.30.1.1,172.30.1.250,TCP,108,50062  >  5228 [SYN] Seq=0 Win=65535 Len=0 MSS=9960 SACK_PERM TSval=4187750722 TSecr=0 WS=512
Google Fi,165,5.90314,172.30.1.250,172.30.1.1,TCP,96,"443  >  42216 [SYN, ACK] Seq=0 Ack=1 Win=4096 Len=0 MSS=9960 WS=512"
Google Fi,166,5.903474,172.30.1.1,172.30.1.250,TCP,88,42216  >  443 [ACK] Seq=1 Ack=1 Win=65536 Len=0
Google Play service,167,5.913486,172.30.1.250,172.30.1.1,TCP,96,"5228  >  50062 [SYN, ACK] Seq=0 Ack=1 Win=4096 Len=0 MSS=9960 WS=512"
Google Play service,168,5.913723,172.30.1.1,172.30.1.250,TCP,88,50062  >  5228 [ACK] Seq=1 Ack=1 Win=65536 Len=0
Google Play service,169,5.917866,172.30.1.1,172.30.1.250,TLSv1.3,604,Client Hello
Google Play service,170,5.918774,172.30.1.250,172.30.1.1,TCP,88,5228  >  50062 [ACK] Seq=1 Ack=518 Win=2096128 Len=0
Google Fi,171,5.923428,172.30.1.1,172.30.1.250,TLSv1.3,604,Client Hello
Google Fi,172,5.9238,172.30.1.250,172.30.1.1,TCP,88,443  >  42216 [ACK] Seq=1 Ack=518 Win=2096128 Len=0
Google Play service,173,5.973666,172.30.1.250,172.30.1.1,TLSv1.3,1424,"Server Hello, Change Cipher Spec"
Google Play service,174,5.974792,172.30.1.1,172.30.1.250,TCP,88,50062  >  5228 [ACK] Seq=518 Ack=1337 Win=85504 Len=0
Google Fi,175,6.018608,172.30.1.250,172.30.1.1,TLSv1.3,4760,"Server Hello, Change Cipher Spec, Application Data"
Google Play service,176,6.019594,172.30.1.250,172.30.1.1,TLSv1.3,5512,Application Data
Google Fi,177,6.019858,172.30.1.1,172.30.1.250,TCP,88,42216  >  443 [ACK] Seq=518 Ack=4675 Win=85504 Len=0
Google Play service,178,6.019894,172.30.1.1,172.30.1.250,TCP,88,50062  >  5228 [ACK] Seq=518 Ack=6762 Win=105472 Len=0
Google Fi,179,6.043677,172.30.1.1,172.30.1.250,TLSv1.3,152,"Change Cipher Spec, Application Data"
Google Fi,180,6.043916,172.30.1.250,172.30.1.1,TCP,88,443  >  42216 [ACK] Seq=4675 Ack=582 Win=2096640 Len=0
Google Play service,181,6.044066,172.30.1.1,172.30.1.250,TLSv1.3,152,"Change Cipher Spec, Application Data"
Google Play service,182,6.044209,172.30.1.250,172.30.1.1,TCP,88,5228  >  50062 [ACK] Seq=6762 Ack=582 Win=2096640 Len=0
Google Fi,183,6.049883,172.30.1.1,172.30.1.250,TLSv1.3,404,Application Data
Google Fi,184,6.050118,172.30.1.250,172.30.1.1,TCP,88,443  >  42216 [ACK] Seq=4675 Ack=897 Win=2096640 Len=0
Google Play service,185,6.070823,172.30.1.1,172.30.1.250,TLSv1.3,452,Application Data
Google Play service,186,6.071071,172.30.1.250,172.30.1.1,TCP,88,5228  >  50062 [ACK] Seq=6762 Ack=945 Win=2096640 Len=0
Google Fi,187,6.123339,172.30.1.250,172.30.1.1,TLSv1.3,3240,"Application Data, Application Data, Application Data, Application Data"
Google Fi,188,6.124892,172.30.1.1,172.30.1.250,TCP,88,42216  >  443 [ACK] Seq=897 Ack=7827 Win=105472 Len=0
Google Play service,189,6.132495,172.30.1.250,172.30.1.1,TLSv1.3,708,"Application Data, Application Data, Application Data"
Google Play service,190,6.13275,172.30.1.1,172.30.1.250,TCP,88,50062  >  5228 [ACK] Seq=945 Ack=7381 Win=116736 Len=0
Google Play service,191,6.139657,172.30.1.250,172.30.1.1,TLSv1.3,120,Application Data
Google Play service,192,6.139762,172.30.1.1,172.30.1.250,TCP,88,50062  >  5228 [ACK] Seq=945 Ack=7415 Win=116736 Len=0
Google Fi,193,6.165,172.30.1.1,172.30.1.250,DNS,108,Standard query 0xcec7 A dns.google.com
Google Fi,194,6.196498,172.30.1.250,172.30.1.1,DNS,140,Standard query response 0xcec7 A dns.google.com A 8.8.8.8 A 8.8.4.4
Accountable2You,195,9.131073,172.30.1.1,172.30.1.250,DNS,112,Standard query 0x28a1 A clients3.google.com
Accountable2You,196,9.258998,172.30.1.250,172.30.1.1,DNS,152,Standard query response 0x28a1 A clients3.google.com CNAME clients.l.google.com A 142.250.80.110
Accountable2You,197,9.264202,172.30.1.1,172.30.1.250,TCP,108,38514  >  443 [SYN] Seq=0 Win=65535 Len=0 MSS=9960 SACK_PERM TSval=2415258246 TSecr=0 WS=512
Accountable2You,198,9.303988,172.30.1.250,172.30.1.1,TCP,96,"443  >  38514 [SYN, ACK] Seq=0 Ack=1 Win=4096 Len=0 MSS=9960 WS=512"
Accountable2You,199,9.3047,172.30.1.1,172.30.1.250,TCP,88,38514  >  443 [ACK] Seq=1 Ack=1 Win=65536 Len=0
Accountable2You,200,9.310924,172.30.1.1,172.30.1.250,TLSv1.3,604,Client Hello
Accountable2You,201,9.311836,172.30.1.250,172.30.1.1,TCP,88,443  >  38514 [ACK] Seq=1 Ack=518 Win=2096128 Len=0
Accountable2You,202,9.35965,172.30.1.250,172.30.1.1,TLSv1.3,6860,"Server Hello, Change Cipher Spec, Application Data"
Accountable2You,203,9.36066,172.30.1.1,172.30.1.250,TCP,88,38514  >  443 [ACK] Seq=518 Ack=6772 Win=85504 Len=0
Accountable2You,204,9.409671,172.30.1.1,172.30.1.250,TLSv1.3,152,"Change Cipher Spec, Application Data"
Accountable2You,205,9.4099,172.30.1.250,172.30.1.1,TCP,88,443  >  38514 [ACK] Seq=6772 Ack=582 Win=2096640 Len=0
Accountable2You,206,9.415352,172.30.1.1,172.30.1.250,TLSv1.3,132,Application Data
Accountable2You,207,9.41554,172.30.1.250,172.30.1.1,TCP,88,443  >  38514 [ACK] Seq=6772 Ack=628 Win=2096640 Len=0
Accountable2You,208,9.418958,172.30.1.1,172.30.1.250,TLSv1.3,124,Application Data
Accountable2You,209,9.41914,172.30.1.250,172.30.1.1,TCP,88,443  >  38514 [ACK] Seq=6772 Ack=665 Win=2096640 Len=0
Accountable2You,210,9.419621,172.30.1.1,172.30.1.250,TLSv1.3,124,Application Data
Accountable2You,211,9.419701,172.30.1.250,172.30.1.1,TCP,88,443  >  38514 [ACK] Seq=6772 Ack=700 Win=2096640 Len=0
Accountable2You,212,9.422548,172.30.1.1,172.30.1.250,TLSv1.3,160,Application Data
Accountable2You,213,9.422637,172.30.1.250,172.30.1.1,TCP,88,443  >  38514 [ACK] Seq=6772 Ack=771 Win=2096640 Len=0
Accountable2You,214,9.448994,172.30.1.250,172.30.1.1,TLSv1.3,700,"Application Data, Application Data"
Accountable2You,215,9.44942,172.30.1.1,172.30.1.250,TCP,88,38514  >  443 [ACK] Seq=771 Ack=7386 Win=99328 Len=0
Accountable2You,216,9.450854,172.30.1.1,172.30.1.250,TLSv1.3,120,Application Data
Accountable2You,217,9.450974,172.30.1.250,172.30.1.1,TCP,88,443  >  38514 [ACK] Seq=7386 Ack=802 Win=2096640 Len=0
Accountable2You,218,9.455736,172.30.1.250,172.30.1.1,TLSv1.3,120,Application Data
Accountable2You,219,9.455951,172.30.1.1,172.30.1.250,TCP,88,38514  >  443 [ACK] Seq=802 Ack=7417 Win=99328 Len=0
Accountable2You,220,9.459003,172.30.1.250,172.30.1.1,TLSv1.3,240,Application Data
Accountable2You,221,9.459148,172.30.1.1,172.30.1.250,TCP,88,38514  >  443 [ACK] Seq=802 Ack=7570 Win=112640 Len=0
Accountable2You,222,9.460249,172.30.1.1,172.30.1.250,TLSv1.3,128,Application Data
Accountable2You,223,9.460347,172.30.1.250,172.30.1.1,TCP,88,443  >  38514 [ACK] Seq=7570 Ack=841 Win=2096640 Len=0
Accountable2You,224,9.461203,172.30.1.1,172.30.1.250,TLSv1.3,112,Application Data
Accountable2You,225,9.461299,172.30.1.250,172.30.1.1,TCP,88,443  >  38514 [ACK] Seq=7570 Ack=865 Win=2096640 Len=0
Accountable2You,226,9.462509,172.30.1.1,172.30.1.250,TCP,88,"38514  >  443 [FIN, ACK] Seq=865 Ack=7570 Win=112640 Len=0"
Accountable2You,227,9.462606,172.30.1.250,172.30.1.1,TCP,88,443  >  38514 [ACK] Seq=7570 Ack=866 Win=2096640 Len=0
Accountable2You,228,9.477154,172.30.1.1,172.30.1.250,DNS,116,Standard query 0xaca9 A api.accountable2you.com
Accountable2You,229,9.503305,172.30.1.250,172.30.1.1,TCP,88,"443  >  38514 [FIN, ACK] Seq=7570 Ack=866 Win=2097152 Len=0"
Accountable2You,230,9.522961,172.30.1.250,172.30.1.1,DNS,148,Standard query response 0xaca9 A api.accountable2you.com A 104.19.163.108 A 104.19.162.108
Accountable2You,231,9.52892,172.30.1.1,172.30.1.250,TCP,108,34448  >  443 [SYN] Seq=0 Win=65535 Len=0 MSS=9960 SACK_PERM TSval=2914870915 TSecr=0 WS=512
Accountable2You,232,9.558696,172.30.1.250,172.30.1.1,TCP,96,"443  >  34448 [SYN, ACK] Seq=0 Ack=1 Win=4096 Len=0 MSS=9960 WS=512"
Accountable2You,233,9.55894,172.30.1.1,172.30.1.250,TCP,88,34448  >  443 [ACK] Seq=1 Ack=1 Win=65536 Len=0
Accountable2You,234,9.565676,172.30.1.1,172.30.1.250,TLSv1.3,616,Client Hello
Accountable2You,235,9.56649,172.30.1.250,172.30.1.1,TCP,88,443  >  34448 [ACK] Seq=1 Ack=528 Win=2096128 Len=0
Accountable2You,236,9.603161,172.30.1.250,172.30.1.1,TLSv1.3,304,"Server Hello, Change Cipher Spec, Application Data"
Accountable2You,237,9.604066,172.30.1.1,172.30.1.250,TCP,88,34448  >  443 [ACK] Seq=528 Ack=219 Win=67072 Len=0
Accountable2You,238,9.615184,172.30.1.1,172.30.1.250,TLSv1.3,152,"Change Cipher Spec, Application Data"
Accountable2You,239,9.615369,172.30.1.250,172.30.1.1,TCP,88,443  >  34448 [ACK] Seq=219 Ack=592 Win=2096640 Len=0
Accountable2You,240,9.621574,172.30.1.1,172.30.1.250,TLSv1.3,2152,Application Data
Accountable2You,241,9.621854,172.30.1.250,172.30.1.1,TCP,88,443  >  34448 [ACK] Seq=219 Ack=2655 Win=2094592 Len=0
Accountable2You,242,9.785378,172.30.1.250,172.30.1.1,TLSv1.3,1124,"Application Data, Application Data"
Accountable2You,243,9.785934,172.30.1.1,172.30.1.250,TCP,88,34448  >  443 [ACK] Seq=2655 Ack=1256 Win=69120 Len=0
Teams,244,11.692532,172.30.1.1,172.30.1.250,TLSv1.2,216,Application Data
Teams,245,11.693747,172.30.1.250,172.30.1.1,TCP,88,443  >  34363 [ACK] Seq=5517 Ack=2235 Win=2096640 Len=0
Teams,246,11.863891,172.30.1.250,172.30.1.1,TLSv1.2,128,Application Data
Teams,247,11.864651,172.30.1.1,172.30.1.250,TCP,88,34363  >  443 [ACK] Seq=2235 Ack=5558 Win=91136 Len=0
Google Connectivity,248,43.175199,172.30.1.1,172.30.1.250,TCP,108,48750  >  1849 [SYN] Seq=0 Win=65535 Len=0 MSS=9960 SACK_PERM TSval=4118336366 TSecr=0 WS=512
Google Connectivity,249,43.254221,172.30.1.250,172.30.1.1,TCP,96,"1849  >  48750 [SYN, ACK] Seq=0 Ack=1 Win=4096 Len=0 MSS=9960 WS=512"
Google Connectivity,250,43.255478,172.30.1.1,172.30.1.250,TCP,88,48750  >  1849 [ACK] Seq=1 Ack=1 Win=65536 Len=0
Google Connectivity,251,43.259458,172.30.1.1,172.30.1.250,TLSv1.3,348,Client Hello
Google Connectivity,252,43.259891,172.30.1.250,172.30.1.1,TCP,88,1849  >  48750 [ACK] Seq=1 Ack=261 Win=2096640 Len=0
Google Connectivity,253,43.300829,172.30.1.250,172.30.1.1,TLSv1.3,1924,"Server Hello, Change Cipher Spec, Application Data, Application Data, Application Data, Application Data"
Google Connectivity,254,43.301943,172.30.1.1,172.30.1.250,TCP,88,48750  >  1849 [ACK] Seq=261 Ack=1838 Win=69632 Len=0
Google Connectivity,255,43.322728,172.30.1.1,172.30.1.250,TLSv1.3,152,"Change Cipher Spec, Application Data"
Google Connectivity,256,43.322917,172.30.1.250,172.30.1.1,TCP,88,1849  >  48750 [ACK] Seq=1838 Ack=325 Win=2096640 Len=0
Google Connectivity,257,43.323977,172.30.1.1,172.30.1.250,TLSv1.3,148,Application Data
Google Connectivity,258,43.324038,172.30.1.250,172.30.1.1,TCP,88,1849  >  48750 [ACK] Seq=1838 Ack=384 Win=2096640 Len=0
Google Connectivity,259,43.793341,172.30.1.250,172.30.1.1,TLSv1.3,112,Application Data
Google Connectivity,260,43.793762,172.30.1.1,172.30.1.250,TCP,88,48750  >  1849 [ACK] Seq=384 Ack=1862 Win=69632 Len=0
Google Connectivity,261,43.793821,172.30.1.250,172.30.1.1,TLSv1.3,128,Application Data
Google Connectivity,262,43.793968,172.30.1.1,172.30.1.250,TCP,88,48750  >  1849 [ACK] Seq=384 Ack=1902 Win=69632 Len=0
Google Connectivity,263,43.799068,172.30.1.1,172.30.1.250,TLSv1.3,112,Application Data
Google Connectivity,264,43.799124,172.30.1.1,172.30.1.250,TCP,88,"48750  >  1849 [FIN, ACK] Seq=408 Ack=1902 Win=69632 Len=0"
Google Connectivity,265,43.799287,172.30.1.250,172.30.1.1,TCP,88,1849  >  48750 [ACK] Seq=1902 Ack=385 Win=2096640 Len=0
Google Connectivity,266,43.799538,172.30.1.250,172.30.1.1,TCP,88,"1849  >  48750 [RST, ACK] Seq=1902 Ack=385 Win=65024 Len=0"
Google Fi,267,66.102055,172.30.1.1,172.30.1.250,TCP,108,42240  >  443 [SYN] Seq=0 Win=65535 Len=0 MSS=9960 SACK_PERM TSval=3313056481 TSecr=0 WS=512
Google Fi,268,66.383214,172.30.1.250,172.30.1.1,TCP,96,"443  >  42240 [SYN, ACK] Seq=0 Ack=1 Win=4096 Len=0 MSS=9960 WS=512"
Google Fi,269,66.384109,172.30.1.1,172.30.1.250,TCP,88,42240  >  443 [ACK] Seq=1 Ack=1 Win=65536 Len=0
Google Fi,270,66.389898,172.30.1.1,172.30.1.250,TLSv1.3,604,Client Hello
Google Fi,271,66.390813,172.30.1.250,172.30.1.1,TCP,88,443  >  42240 [ACK] Seq=1 Ack=518 Win=2096128 Len=0
Google Fi,272,66.443841,172.30.1.250,172.30.1.1,TLSv1.3,4760,"Server Hello, Change Cipher Spec, Application Data"
Google Fi,273,66.444922,172.30.1.1,172.30.1.250,TCP,88,42240  >  443 [ACK] Seq=518 Ack=4675 Win=85504 Len=0
Google Fi,274,66.464085,172.30.1.1,172.30.1.250,TLSv1.3,152,"Change Cipher Spec, Application Data"
Google Fi,275,66.464307,172.30.1.250,172.30.1.1,TCP,88,443  >  42240 [ACK] Seq=4675 Ack=582 Win=2096640 Len=0
Google Fi,276,66.467313,172.30.1.1,172.30.1.250,TLSv1.3,404,Application Data
Google Fi,277,66.467439,172.30.1.250,172.30.1.1,TCP,88,443  >  42240 [ACK] Seq=4675 Ack=897 Win=2096640 Len=0
Google Fi,278,66.524226,172.30.1.250,172.30.1.1,TLSv1.3,1424,Application Data
Google Fi,279,66.525272,172.30.1.1,172.30.1.250,TCP,88,42240  >  443 [ACK] Seq=897 Ack=6011 Win=105472 Len=0
Google Fi,280,66.534884,172.30.1.250,172.30.1.1,TLSv1.3,1980,"Application Data, Application Data, Application Data"
Google Fi,281,66.535471,172.30.1.1,172.30.1.250,TCP,88,42240  >  443 [ACK] Seq=897 Ack=7902 Win=115200 Len=0
Teams,282,109.343697,172.30.1.250,172.30.1.1,TLSv1.2,120,Application Data
Teams,283,109.344537,172.30.1.1,172.30.1.250,TCP,88,34363  >  443 [ACK] Seq=2235 Ack=5591 Win=91136 Len=0
Teams,284,109.449888,172.30.1.250,172.30.1.1,TCP,88,"443  >  34363 [RST, ACK] Seq=5591 Ack=2235 Win=65024 Len=0"
Teams,285,117.138315,172.30.1.1,172.30.1.250,TCP,108,59523  >  443 [SYN] Seq=0 Win=65535 Len=0 MSS=9960 SACK_PERM TSval=108654893 TSecr=0 WS=512
Teams,286,117.144768,172.30.1.1,172.30.1.250,DNS,140,Standard query 0xf046 A trouter2-usce-0-b.trouter.teams.microsoft.com
Teams,287,117.150332,172.30.1.1,172.30.1.250,DNS,140,Standard query 0x8541 AAAA trouter2-usce-0-b.trouter.teams.microsoft.com
Google Play service,288,117.157027,172.30.1.250,172.30.1.1,TLSv1.3,740,"Application Data, Application Data"
Google Play service,289,117.157255,172.30.1.1,172.30.1.250,TCP,88,50062  >  5228 [ACK] Seq=945 Ack=8068 Win=127488 Len=0
Teams,290,117.202743,172.30.1.1,172.30.1.250,TLSv1.2,512,Application Data
Teams,291,117.203135,172.30.1.250,172.30.1.1,TCP,88,443  >  52803 [ACK] Seq=5027 Ack=2516 Win=2096640 Len=0
Teams,292,117.203289,172.30.1.1,172.30.1.250,TLSv1.2,984,Application Data
Teams,293,117.20334,172.30.1.250,172.30.1.1,TCP,88,443  >  52803 [ACK] Seq=5027 Ack=3414 Win=2095616 Len=0
Teams,294,117.205893,172.30.1.250,172.30.1.1,DNS,200,Standard query response 0xf046 A trouter2-usce-0-b.trouter.teams.microsoft.com CNAME trouter2-usce-0-b.cloudapp.net A 52.115.92.13
Teams,295,117.206185,172.30.1.250,172.30.1.1,DNS,212,Standard query response 0x8541 AAAA trouter2-usce-0-b.trouter.teams.microsoft.com CNAME trouter2-usce-0-b.cloudapp.net AAAA 2603:1030:7:6::ad
Google Play service,296,117.215487,172.30.1.1,172.30.1.250,TLSv1.3,124,Application Data
Google Play service,297,117.215706,172.30.1.250,172.30.1.1,TCP,88,5228  >  50062 [ACK] Seq=8068 Ack=983 Win=2096640 Len=0
Teams,298,117.230345,172.30.1.250,172.30.1.1,TCP,96,"443  >  59523 [SYN, ACK] Seq=0 Ack=1 Win=4096 Len=0 MSS=9960 WS=512"
Teams,299,117.230501,172.30.1.1,172.30.1.250,TCP,88,59523  >  443 [ACK] Seq=1 Ack=1 Win=65536 Len=0
Teams,300,117.234651,172.30.1.1,172.30.1.250,TLSv1.2,396,Client Hello
Teams,301,117.235246,172.30.1.250,172.30.1.1,TCP,88,443  >  59523 [ACK] Seq=1 Ack=310 Win=2096640 Len=0
Google Play service,302,117.279598,172.30.1.250,172.30.1.1,TLSv1.3,2456,"Application Data, Application Data, Application Data"
Google Play service,303,117.279785,172.30.1.1,172.30.1.250,TCP,88,50062  >  5228 [ACK] Seq=983 Ack=10437 Win=147456 Len=0
Google Play service,304,117.293749,172.30.1.1,172.30.1.250,TLSv1.3,124,Application Data
Google Play service,305,117.293852,172.30.1.250,172.30.1.1,TCP,88,5228  >  50062 [ACK] Seq=10437 Ack=1021 Win=2096640 Len=0
Teams,306,117.466181,172.30.1.250,172.30.1.1,TLSv1.2,560,Application Data
Teams,307,117.466508,172.30.1.250,172.30.1.1,TLSv1.2,228,"Server Hello, Change Cipher Spec, Encrypted Handshake Message"
Teams,308,117.46705,172.30.1.1,172.30.1.250,TCP,88,52803  >  443 [ACK] Seq=3414 Ack=5499 Win=103936 Len=0
Teams,309,117.467078,172.30.1.1,172.30.1.250,TCP,88,59523  >  443 [ACK] Seq=310 Ack=142 Win=67072 Len=0
Teams,310,117.467639,172.30.1.1,172.30.1.250,TLSv1.2,140,"Change Cipher Spec, Encrypted Handshake Message"
Teams,311,117.467737,172.30.1.250,172.30.1.1,TCP,88,443  >  59523 [ACK] Seq=142 Ack=361 Win=2096640 Len=0
Teams,312,117.468114,172.30.1.1,172.30.1.250,TLSv1.2,1596,Application Data
Teams,313,117.468201,172.30.1.250,172.30.1.1,TCP,88,443  >  59523 [ACK] Seq=142 Ack=1870 Win=2095104 Len=0
Teams,314,117.645967,172.30.1.250,172.30.1.1,TLSv1.2,1308,"Application Data, Application Data, Application Data"
Teams,315,117.646382,172.30.1.1,172.30.1.250,TCP,88,59523  >  443 [ACK] Seq=1870 Ack=1364 Win=86528 Len=0
Teams,316,117.64985,172.30.1.1,172.30.1.250,TLSv1.2,216,Application Data
Teams,317,117.650007,172.30.1.250,172.30.1.1,TCP,88,443  >  59523 [ACK] Seq=1364 Ack=1999 Win=2096640 Len=0
Teams,318,117.666444,172.30.1.1,172.30.1.250,TLSv1.2,3148,Application Data
Teams,319,117.666681,172.30.1.250,172.30.1.1,TCP,88,443  >  51814 [ACK] Seq=7168 Ack=12584 Win=2094080 Len=0
Teams,320,117.667416,172.30.1.1,172.30.1.250,TLSv1.2,3148,Application Data
Teams,321,117.66746,172.30.1.250,172.30.1.1,TCP,88,443  >  51814 [ACK] Seq=7168 Ack=15645 Win=2091008 Len=0
Teams,322,117.745177,172.30.1.250,172.30.1.1,TLSv1.2,128,Application Data
Teams,323,117.745343,172.30.1.1,172.30.1.250,TCP,88,59523  >  443 [ACK] Seq=1999 Ack=1405 Win=86528 Len=0
Teams,324,117.812495,172.30.1.250,172.30.1.1,TLSv1.2,260,Application Data
Teams,325,117.812795,172.30.1.1,172.30.1.250,TCP,88,51814  >  443 [ACK] Seq=15645 Ack=7339 Win=160768 Len=0
Teams,326,117.84524,172.30.1.250,172.30.1.1,TLSv1.2,256,Application Data
Teams,327,117.845413,172.30.1.1,172.30.1.250,TCP,88,51814  >  443 [ACK] Seq=15645 Ack=7509 Win=169984 Len=0
Teams,328,117.868199,172.30.1.1,172.30.1.250,TLSv1.2,976,Application Data
Teams,329,117.868382,172.30.1.250,172.30.1.1,TCP,88,443  >  51814 [ACK] Seq=7509 Ack=16532 Win=2096128 Len=0
Teams,330,117.908843,172.30.1.1,172.30.1.250,TLSv1.2,976,Application Data
Teams,331,117.909024,172.30.1.250,172.30.1.1,TCP,88,443  >  51814 [ACK] Seq=7509 Ack=17419 Win=2096128 Len=0
Teams,332,117.984888,172.30.1.250,172.30.1.1,TLSv1.2,256,Application Data
Teams,333,117.985199,172.30.1.1,172.30.1.250,TCP,88,51814  >  443 [ACK] Seq=17419 Ack=7678 Win=179200 Len=0
Teams,334,118.029194,172.30.1.250,172.30.1.1,TLSv1.2,256,Application Data
Teams,335,118.029391,172.30.1.1,172.30.1.250,TCP,88,51814  >  443 [ACK] Seq=17419 Ack=7848 Win=188416 Len=0
Outlook,336,118.198132,172.30.1.1,172.30.1.250,DNS,116,Standard query 0x9a5b A outlook.office365.com
Outlook,337,118.23929,172.30.1.250,172.30.1.1,DNS,264,Standard query response 0x9a5b A outlook.office365.com CNAME outlook.ha.office365.com CNAME outlook.ms-acdc.office.com CNAME MNZ-efz.ms-acdc.office.com A 52.96.33.82 A 52.96.111.2 A 52.96.109.178 A 52.96.9.178
Outlook,338,118.251213,172.30.1.1,172.30.1.250,TCP,108,60832  >  443 [SYN] Seq=0 Win=65535 Len=0 MSS=9960 SACK_PERM TSval=1416240782 TSecr=0 WS=512
Outlook,339,118.294487,172.30.1.250,172.30.1.1,TCP,96,"443  >  60832 [SYN, ACK] Seq=0 Ack=1 Win=4096 Len=0 MSS=9960 WS=512"
Outlook,340,118.295106,172.30.1.1,172.30.1.250,TCP,88,60832  >  443 [ACK] Seq=1 Ack=1 Win=65536 Len=0
Outlook,341,118.320846,172.30.1.1,172.30.1.250,TLSv1.2,604,Client Hello
Outlook,342,118.321429,172.30.1.250,172.30.1.1,TCP,88,443  >  60832 [ACK] Seq=1 Ack=518 Win=2096128 Len=0
Outlook,343,118.375725,172.30.1.250,172.30.1.1,TLSv1.2,4520,"Server Hello, Certificate, Certificate Status, Server Key Exchange, Server Hello Done"
Outlook,344,118.376734,172.30.1.1,172.30.1.250,TCP,88,60832  >  443 [ACK] Seq=518 Ack=4435 Win=85504 Len=0
Outlook,345,118.454016,172.30.1.1,172.30.1.250,TLSv1.2,244,"Client Key Exchange, Change Cipher Spec, Encrypted Handshake Message"
Outlook,346,118.454386,172.30.1.250,172.30.1.1,TCP,88,443  >  60832 [ACK] Seq=4435 Ack=676 Win=2096640 Len=0
Outlook,347,118.499956,172.30.1.250,172.30.1.1,TLSv1.2,444,"New Session Ticket, Change Cipher Spec, Encrypted Handshake Message"
Outlook,348,118.500405,172.30.1.1,172.30.1.250,TCP,88,60832  >  443 [ACK] Seq=676 Ack=4793 Win=94720 Len=0
Outlook,349,118.513156,172.30.1.1,172.30.1.250,TLSv1.2,5652,Application Data
Outlook,350,118.513392,172.30.1.250,172.30.1.1,TCP,88,443  >  60832 [ACK] Seq=4793 Ack=6241 Win=2091520 Len=0
Outlook,351,118.901384,172.30.1.250,172.30.1.1,TLSv1.2,1572,"Application Data, Application Data, Application Data, Application Data, Application Data, Application Data"
Outlook,352,118.902479,172.30.1.1,172.30.1.250,TCP,88,60832  >  443 [ACK] Seq=6241 Ack=6279 Win=114688 Len=0
Outlook,353,118.944659,172.30.1.250,172.30.1.1,TLSv1.2,144,Application Data
Outlook,354,118.945098,172.30.1.1,172.30.1.250,TCP,88,60832  >  443 [ACK] Seq=6241 Ack=6334 Win=114688 Len=0
Outlook,355,118.960737,172.30.1.250,172.30.1.1,TLSv1.2,516,"Application Data, Application Data, Application Data, Application Data"
Outlook,356,118.961082,172.30.1.1,172.30.1.250,TCP,88,60832  >  443 [ACK] Seq=6241 Ack=6761 Win=123392 Len=0
Outlook,357,118.96119,172.30.1.250,172.30.1.1,TLSv1.2,4328,"Application Data, Application Data, Application Data, Application Data"
Outlook,358,118.961416,172.30.1.1,172.30.1.250,TCP,88,60832  >  443 [ACK] Seq=6241 Ack=11001 Win=143360 Len=0
Outlook,359,118.969704,172.30.1.250,172.30.1.1,TLSv1.2,1588,"Application Data, Application Data"
Outlook,360,118.970362,172.30.1.1,172.30.1.250,TCP,88,60832  >  443 [ACK] Seq=6241 Ack=12502 Win=163328 Len=0
Outlook,361,119.27025,172.30.1.1,172.30.1.250,TCP,108,60836  >  443 [SYN] Seq=0 Win=65535 Len=0 MSS=9960 SACK_PERM TSval=1416241801 TSecr=0 WS=512
Outlook,362,119.364648,172.30.1.250,172.30.1.1,TCP,96,"443  >  60836 [SYN, ACK] Seq=0 Ack=1 Win=4096 Len=0 MSS=9960 WS=512"
Outlook,363,119.364933,172.30.1.1,172.30.1.250,TCP,88,60836  >  443 [ACK] Seq=1 Ack=1 Win=65536 Len=0
Outlook,364,119.368844,172.30.1.1,172.30.1.250,TLSv1.2,604,Client Hello
Outlook,365,119.369159,172.30.1.250,172.30.1.1,TCP,88,443  >  60836 [ACK] Seq=1 Ack=518 Win=2096128 Len=0
Outlook,366,119.409813,172.30.1.250,172.30.1.1,TLSv1.2,4520,"Server Hello, Certificate, Certificate Status, Server Key Exchange, Server Hello Done"
Outlook,367,119.410509,172.30.1.1,172.30.1.250,TCP,88,60836  >  443 [ACK] Seq=518 Ack=4435 Win=85504 Len=0
