App name,No.,Time,Source,Destination,Protocol,Length,Info
Pandora,1,0,172.30.1.1,172.30.1.250,DNS,112,Standard query 0x7e2c A stats.pandora.com
Pandora,2,0.153792,172.30.1.250,172.30.1.1,DNS,224,Standard query response 0x7e2c A stats.pandora.com A 199.116.164.66 A 199.116.164.68 A 199.116.164.69 A 208.85.40.144 A 208.85.40.145 A 208.85.40.146 A 208.85.40.147
Pandora,3,0.155778,172.30.1.1,172.30.1.250,TCP,108,38408  >  443 [SYN] Seq=0 Win=65535 Len=0 MSS=9960 SACK_PERM=1 TSval=3849393915 TSecr=0 WS=512
Pandora,4,0.193797,172.30.1.250,172.30.1.1,TCP,96,"443  >  38408 [SYN, ACK] Seq=0 Ack=1 Win=4096 Len=0 MSS=9960 WS=512"
Pandora,5,0.193925,172.30.1.1,172.30.1.250,TCP,88,38408  >  443 [ACK] Seq=1 Ack=1 Win=65536 Len=0
Pandora,6,0.195,172.30.1.1,172.30.1.250,TLSv1.2,604,Client Hello
Pandora,7,0.195182,172.30.1.250,172.30.1.1,TCP,88,443  >  38408 [ACK] Seq=1 Ack=518 Win=2096128 Len=0
Pandora,8,0.301207,172.30.1.250,172.30.1.1,TLSv1.2,1392,Server Hello
Pandora,9,0.301627,172.30.1.1,172.30.1.250,TCP,88,38408  >  443 [ACK] Seq=518 Ack=1307 Win=85504 Len=0
Pandora,10,0.301717,172.30.1.250,172.30.1.1,TLSv1.2,1724,"Certificate, Server Hello Done"
Pandora,11,0.30198,172.30.1.1,172.30.1.250,TCP,88,38408  >  443 [ACK] Seq=518 Ack=2945 Win=89088 Len=0
Pandora,12,0.308238,172.30.1.1,172.30.1.250,TLSv1.2,428,"Client Key Exchange, Change Cipher Spec, Encrypted Handshake Message"
Pandora,13,0.308576,172.30.1.250,172.30.1.1,TCP,88,443  >  38408 [ACK] Seq=2945 Ack=860 Win=2096640 Len=0
Pandora,14,0.368105,172.30.1.250,172.30.1.1,TLSv1.2,164,"Change Cipher Spec, Encrypted Handshake Message"
Pandora,15,0.377651,172.30.1.1,172.30.1.250,TLSv1.2,492,Application Data
Pandora,16,0.378239,172.30.1.250,172.30.1.1,TCP,88,443  >  38408 [ACK] Seq=3020 Ack=1265 Win=2096640 Len=0
Pandora,17,0.378749,172.30.1.1,172.30.1.250,TLSv1.2,8332,Application Data
Pandora,18,0.379172,172.30.1.250,172.30.1.1,TCP,88,443  >  38408 [ACK] Seq=3020 Ack=9510 Win=2088448 Len=0
Pandora,19,0.37956,172.30.1.1,172.30.1.250,TLSv1.2,8332,Application Data
Pandora,20,0.379793,172.30.1.250,172.30.1.1,TCP,88,443  >  38408 [ACK] Seq=3020 Ack=17755 Win=2080256 Len=0
Pandora,21,0.380407,172.30.1.1,172.30.1.250,TLSv1.2,8332,Application Data
Pandora,22,0.380476,172.30.1.250,172.30.1.1,TCP,88,443  >  38408 [ACK] Seq=3020 Ack=26000 Win=2071552 Len=0
Pandora,23,0.382408,172.30.1.1,172.30.1.250,TLSv1.2,8332,Application Data
Pandora,24,0.382479,172.30.1.250,172.30.1.1,TCP,88,443  >  38408 [ACK] Seq=3020 Ack=34245 Win=2063360 Len=0
Pandora,25,0.382704,172.30.1.1,172.30.1.250,TLSv1.2,8332,Application Data
Pandora,26,0.38276,172.30.1.250,172.30.1.1,TCP,88,443  >  38408 [ACK] Seq=3020 Ack=42490 Win=2055168 Len=0
Pandora,27,0.382963,172.30.1.1,172.30.1.250,TLSv1.2,8332,Application Data
Pandora,28,0.383019,172.30.1.250,172.30.1.1,TCP,88,443  >  38408 [ACK] Seq=3020 Ack=50735 Win=2046976 Len=0
Pandora,29,0.383251,172.30.1.1,172.30.1.250,TLSv1.2,8316,Application Data
Pandora,30,0.383304,172.30.1.250,172.30.1.1,TCP,88,443  >  38408 [ACK] Seq=3020 Ack=58964 Win=2038784 Len=0
WhatsApp,31,0.393108,172.30.1.1,172.30.1.250,TCP,108,40786  >  443 [SYN] Seq=0 Win=65535 Len=0 MSS=9960 SACK_PERM=1 TSval=2088819769 TSecr=0 WS=512
WhatsApp,32,0.572731,172.30.1.250,172.30.1.1,TCP,96,"443  >  40786 [SYN, ACK] Seq=0 Ack=1 Win=4096 Len=0 MSS=9960 WS=512"
WhatsApp,33,0.573089,172.30.1.1,172.30.1.250,TCP,88,40786  >  443 [ACK] Seq=1 Ack=1 Win=65536 Len=0
WhatsApp,34,0.577876,172.30.1.1,172.30.1.250,TCP,92,"40786  >  443 [PSH, ACK] Seq=1 Ack=1 Win=65536 Len=4 [TCP segment of a reassembled PDU]"
WhatsApp,35,0.578372,172.30.1.250,172.30.1.1,TCP,88,443  >  40786 [ACK] Seq=1 Ack=5 Win=2096640 Len=0
WhatsApp,36,0.57855,172.30.1.1,172.30.1.250,SSL,100,Continuation Data
WhatsApp,37,0.578803,172.30.1.250,172.30.1.1,TCP,88,443  >  40786 [ACK] Seq=1 Ack=16 Win=2096640 Len=0
WhatsApp,38,0.590166,172.30.1.1,172.30.1.250,TCP,92,"40786  >  443 [PSH, ACK] Seq=16 Ack=1 Win=65536 Len=3 [TCP segment of a reassembled PDU]"
WhatsApp,39,0.590424,172.30.1.250,172.30.1.1,TCP,88,443  >  40786 [ACK] Seq=1 Ack=19 Win=2096640 Len=0
WhatsApp,40,0.590791,172.30.1.1,172.30.1.250,SSL,364,Continuation Data
WhatsApp,41,0.590965,172.30.1.250,172.30.1.1,TCP,88,443  >  40786 [ACK] Seq=1 Ack=297 Win=2096640 Len=0
Pandora,42,0.7952,172.30.1.250,172.30.1.1,TLSv1.2,652,Application Data
WhatsApp,43,0.799735,172.30.1.250,172.30.1.1,SSL,244,Continuation Data
WhatsApp,44,0.800149,172.30.1.1,172.30.1.250,TCP,88,40786  >  443 [ACK] Seq=297 Ack=159 Win=67072 Len=0
WhatsApp,45,0.814952,172.30.1.1,172.30.1.250,TCP,92,"40786  >  443 [PSH, ACK] Seq=297 Ack=159 Win=67072 Len=3 [TCP segment of a reassembled PDU]"
WhatsApp,46,0.815204,172.30.1.250,172.30.1.1,TCP,88,443  >  40786 [ACK] Seq=159 Ack=300 Win=2096640 Len=0
WhatsApp,47,0.815303,172.30.1.1,172.30.1.250,SSL,268,Continuation Data
WhatsApp,48,0.815373,172.30.1.250,172.30.1.1,TCP,88,443  >  40786 [ACK] Seq=159 Ack=481 Win=2096640 Len=0
WhatsApp,49,0.815478,172.30.1.1,172.30.1.250,TCP,92,"40786  >  443 [PSH, ACK] Seq=481 Ack=159 Win=67072 Len=3 [TCP segment of a reassembled PDU]"
WhatsApp,50,0.815493,172.30.1.250,172.30.1.1,TCP,88,443  >  40786 [ACK] Seq=159 Ack=484 Win=2096640 Len=0
WhatsApp,51,0.815538,172.30.1.1,172.30.1.250,SSL,124,Continuation Data
WhatsApp,52,0.815549,172.30.1.250,172.30.1.1,TCP,88,443  >  40786 [ACK] Seq=159 Ack=521 Win=2096640 Len=0
Pandora,53,0.838044,172.30.1.1,172.30.1.250,TCP,88,38408  >  443 [ACK] Seq=58964 Ack=3585 Win=92160 Len=0
WhatsApp,54,0.919459,172.30.1.250,172.30.1.1,SSL,132,Continuation Data
WhatsApp,55,0.921173,172.30.1.250,172.30.1.1,SSL,284,Continuation Data
WhatsApp,56,0.922514,172.30.1.1,172.30.1.250,TCP,88,40786  >  443 [ACK] Seq=521 Ack=400 Win=68096 Len=0
WhatsApp,57,1.010198,172.30.1.250,172.30.1.1,SSL,124,Continuation Data
WhatsApp,58,1.053875,172.30.1.1,172.30.1.250,TCP,88,40786  >  443 [ACK] Seq=521 Ack=437 Win=68096 Len=0
Google Play service,59,5.132649,172.30.1.1,172.30.1.250,DNS,108,Standard query 0x2751 A mtalk.google.com
Google Play service,60,5.612838,172.30.1.250,172.30.1.1,DNS,156,Standard query response 0x2751 A mtalk.google.com CNAME mobile-gtalk.l.google.com A 172.253.63.188
Google Play service,61,5.64011,172.30.1.1,172.30.1.250,TCP,108,50468  >  5228 [SYN] Seq=0 Win=65535 Len=0 MSS=9960 SACK_PERM=1 TSval=826860635 TSecr=0 WS=512
Google Play service,62,5.69618,172.30.1.250,172.30.1.1,TCP,96,"5228  >  50468 [SYN, ACK] Seq=0 Ack=1 Win=4096 Len=0 MSS=9960 WS=512"
Google Play service,63,5.697298,172.30.1.1,172.30.1.250,TCP,88,50468  >  5228 [ACK] Seq=1 Ack=1 Win=65536 Len=0
Google Play service,64,5.711302,172.30.1.1,172.30.1.250,TLSv1.3,624,Client Hello
Google Play service,65,5.712297,172.30.1.250,172.30.1.1,TCP,88,5228  >  50468 [ACK] Seq=1 Ack=537 Win=2096128 Len=0
Google Play service,66,5.762583,172.30.1.250,172.30.1.1,TLSv1.3,292,"Server Hello, Change Cipher Spec, Application Data"
Google Play service,67,5.763101,172.30.1.1,172.30.1.250,TCP,88,50468  >  5228 [ACK] Seq=537 Ack=204 Win=67072 Len=0
Google Play service,68,5.765005,172.30.1.1,172.30.1.250,TLSv1.3,152,"Change Cipher Spec, Application Data"
Google Play service,69,5.765264,172.30.1.250,172.30.1.1,TCP,88,5228  >  50468 [ACK] Seq=204 Ack=601 Win=2096640 Len=0
OneDrive,70,5.804049,172.30.1.1,172.30.1.250,DNS,124,Standard query 0x7927 A self.events.data.microsoft.com
Google Play service,71,5.808249,172.30.1.1,172.30.1.250,TLSv1.3,516,Application Data
Google Play service,72,5.808367,172.30.1.250,172.30.1.1,TCP,88,5228  >  50468 [ACK] Seq=204 Ack=1028 Win=2096640 Len=0
OneDrive,73,5.842597,172.30.1.250,172.30.1.1,DNS,244,Standard query response 0x7927 A self.events.data.microsoft.com CNAME self-events-data.trafficmanager.net CNAME onedscolprdcus09.centralus.cloudapp.azure.com A 13.89.179.9
OneDrive,74,5.851108,172.30.1.1,172.30.1.250,TCP,108,38856  >  443 [SYN] Seq=0 Win=65535 Len=0 MSS=9960 SACK_PERM=1 TSval=2296440852 TSecr=0 WS=512
Google Play service,75,5.856738,172.30.1.250,172.30.1.1,TLSv1.3,624,"Application Data, Application Data"
Google Play service,76,5.870727,172.30.1.250,172.30.1.1,TLSv1.3,204,"Application Data, Application Data"
Google Play service,77,5.871007,172.30.1.1,172.30.1.250,TCP,88,50468  >  5228 [ACK] Seq=1028 Ack=857 Win=68096 Len=0
OneDrive,78,5.939331,172.30.1.250,172.30.1.1,TCP,96,"443  >  38856 [SYN, ACK] Seq=0 Ack=1 Win=4096 Len=0 MSS=9960 WS=512"
OneDrive,79,5.939946,172.30.1.1,172.30.1.250,TCP,88,38856  >  443 [ACK] Seq=1 Ack=1 Win=65536 Len=0
OneDrive,80,5.950212,172.30.1.1,172.30.1.250,TLSv1.2,604,Client Hello
OneDrive,81,5.951264,172.30.1.250,172.30.1.1,TCP,88,443  >  38856 [ACK] Seq=1 Ack=518 Win=2096128 Len=0
OneDrive,82,6.029661,172.30.1.250,172.30.1.1,TCP,4040,"443  >  38856 [PSH, ACK] Seq=1 Ack=518 Win=2097152 Len=3954 [TCP segment of a reassembled PDU]"
OneDrive,83,6.029875,172.30.1.1,172.30.1.250,TCP,88,38856  >  443 [ACK] Seq=518 Ack=3955 Win=73728 Len=0
OneDrive,84,6.032205,172.30.1.250,172.30.1.1,TLSv1.2,2428,"Server Hello, Certificate, Certificate Status, Server Key Exchange, Server Hello Done"
OneDrive,85,6.032664,172.30.1.1,172.30.1.250,TCP,88,38856  >  443 [ACK] Seq=518 Ack=6297 Win=93696 Len=0
OneDrive,86,6.083096,172.30.1.1,172.30.1.250,TLSv1.2,244,"Client Key Exchange, Change Cipher Spec, Encrypted Handshake Message"
OneDrive,87,6.083428,172.30.1.250,172.30.1.1,TCP,88,443  >  38856 [ACK] Seq=6297 Ack=676 Win=2096640 Len=0
OneDrive,88,6.496483,172.30.1.250,172.30.1.1,TLSv1.2,140,"Change Cipher Spec, Encrypted Handshake Message"
OneDrive,89,6.497303,172.30.1.1,172.30.1.250,TCP,88,38856  >  443 [ACK] Seq=676 Ack=6348 Win=93696 Len=0
OneDrive,90,6.507633,172.30.1.1,172.30.1.250,TLSv1.2,2064,Application Data
OneDrive,91,6.508048,172.30.1.250,172.30.1.1,TCP,88,443  >  38856 [ACK] Seq=6348 Ack=2651 Win=2095104 Len=0
OneDrive,92,6.614176,172.30.1.250,172.30.1.1,TLSv1.2,540,Application Data
OneDrive,93,6.658524,172.30.1.1,172.30.1.250,TCP,88,38856  >  443 [ACK] Seq=2651 Ack=6801 Win=101376 Len=0
Pandora,94,27.502516,172.30.1.1,172.30.1.250,DNS,120,Standard query 0x95a6 A ade.googlesyndication.com
Pandora,95,27.919668,172.30.1.250,172.30.1.1,DNS,136,Standard query response 0x95a6 A ade.googlesyndication.com A 142.251.32.98
Pandora,96,27.92845,172.30.1.1,172.30.1.250,UDP,1324,49749  >  443 Len=1250
Pandora,97,27.931769,172.30.1.1,172.30.1.250,UDP,156,49749  >  443 Len=79
Pandora,98,27.931978,172.30.1.1,172.30.1.250,UDP,604,49749  >  443 Len=527
Pandora,99,28.120012,172.30.1.250,172.30.1.1,UDP,1324,443  >  49749 Len=1250
Pandora,100,28.124179,172.30.1.1,172.30.1.250,UDP,1324,49749  >  443 Len=1250
Pandora,101,28.124837,172.30.1.1,172.30.1.250,UDP,148,49749  >  443 Len=73
Pandora,102,28.129041,172.30.1.250,172.30.1.1,UDP,880,443  >  49749 Len=804
Pandora,103,28.1294,172.30.1.250,172.30.1.1,UDP,256,443  >  49749 Len=182
Pandora,104,28.129604,172.30.1.250,172.30.1.1,UDP,100,443  >  49749 Len=24
Pandora,105,28.129778,172.30.1.250,172.30.1.1,UDP,160,443  >  49749 Len=83
Pandora,106,28.129954,172.30.1.250,172.30.1.1,UDP,96,443  >  49749 Len=21
Pandora,107,28.139503,172.30.1.1,172.30.1.250,UDP,108,49749  >  443 Len=31
Pandora,108,28.142393,172.30.1.1,172.30.1.250,UDP,108,49749  >  443 Len=31
Pandora,109,28.168704,172.30.1.1,172.30.1.250,UDP,108,49749  >  443 Len=32
Pandora,110,28.194848,172.30.1.250,172.30.1.1,UDP,468,443  >  49749 Len=394
Pandora,111,28.197972,172.30.1.1,172.30.1.250,UDP,112,49749  >  443 Len=36
Pandora,112,28.264041,172.30.1.250,172.30.1.1,UDP,100,443  >  49749 Len=25
OneDrive,113,134.059356,172.30.1.250,172.30.1.1,TCP,88,"443  >  38856 [RST, ACK] Seq=6801 Ack=2651 Win=65024 Len=0"
WhatsApp,114,152.303197,172.30.1.250,172.30.1.1,SSL,128,Continuation Data
WhatsApp,115,152.304275,172.30.1.1,172.30.1.250,TCP,88,40786  >  443 [ACK] Seq=521 Ack=476 Win=68096 Len=0
WhatsApp,116,152.306612,172.30.1.1,172.30.1.250,TCP,92,"40786  >  443 [PSH, ACK] Seq=521 Ack=476 Win=68096 Len=3 [TCP segment of a reassembled PDU]"
WhatsApp,117,152.31069,172.30.1.250,172.30.1.1,TCP,88,443  >  40786 [ACK] Seq=476 Ack=524 Win=2096640 Len=0
WhatsApp,118,152.310909,172.30.1.1,172.30.1.250,SSL,112,Continuation Data
WhatsApp,119,152.311124,172.30.1.250,172.30.1.1,TCP,88,443  >  40786 [ACK] Seq=476 Ack=550 Win=2096640 Len=0
WhatsApp,120,304.401298,172.30.1.250,172.30.1.1,SSL,128,Continuation Data
WhatsApp,121,304.404494,172.30.1.1,172.30.1.250,TCP,92,"40786  >  443 [PSH, ACK] Seq=550 Ack=515 Win=68096 Len=3 [TCP segment of a reassembled PDU]"
WhatsApp,122,304.404743,172.30.1.250,172.30.1.1,TCP,88,443  >  40786 [ACK] Seq=515 Ack=553 Win=2096640 Len=0
WhatsApp,123,304.404897,172.30.1.1,172.30.1.250,SSL,112,Continuation Data
WhatsApp,124,304.405054,172.30.1.250,172.30.1.1,TCP,88,443  >  40786 [ACK] Seq=515 Ack=579 Win=2096640 Len=0
WhatsApp,125,456.583647,172.30.1.1,172.30.1.250,TCP,88,"40786  >  443 [RST, ACK] Seq=579 Ack=515 Win=68096 Len=0"
WhatsApp,126,456.583936,172.30.1.250,172.30.1.1,TCP,88,"443  >  40786 [RST, ACK] Seq=515 Ack=579 Win=65024 Len=0"
WhatsApp,127,816.872651,172.30.1.1,172.30.1.250,TCP,108,53170  >  5222 [SYN] Seq=0 Win=65535 Len=0 MSS=9960 SACK_PERM=1 TSval=2088854970 TSecr=0 WS=512
USAA SafePilot,128,817.05476,172.30.1.1,172.30.1.250,DNS,120,Standard query 0xfb27 A api-usaa.gotruemotion.com
WhatsApp,129,817.104451,172.30.1.250,172.30.1.1,TCP,96,"5222  >  53170 [SYN, ACK] Seq=0 Ack=1 Win=4096 Len=0 MSS=9960 WS=512"
WhatsApp,130,817.10479,172.30.1.1,172.30.1.250,TCP,88,53170  >  5222 [ACK] Seq=1 Ack=1 Win=65536 Len=0
WhatsApp,131,817.108688,172.30.1.1,172.30.1.250,TCP,92,"53170  >  5222 [PSH, ACK] Seq=1 Ack=1 Win=65536 Len=4 [TCP segment of a reassembled PDU]"
WhatsApp,132,817.108982,172.30.1.250,172.30.1.1,TCP,88,5222  >  53170 [ACK] Seq=1 Ack=5 Win=2096640 Len=0
WhatsApp,133,817.109062,172.30.1.1,172.30.1.250,TCP,100,"53170  >  5222 [PSH, ACK] Seq=5 Ack=1 Win=65536 Len=11 [TCP segment of a reassembled PDU]"
WhatsApp,134,817.109159,172.30.1.250,172.30.1.1,TCP,88,5222  >  53170 [ACK] Seq=1 Ack=16 Win=2096640 Len=0
WhatsApp,135,817.11205,172.30.1.1,172.30.1.250,TCP,92,"53170  >  5222 [PSH, ACK] Seq=16 Ack=1 Win=65536 Len=3 [TCP segment of a reassembled PDU]"
WhatsApp,136,817.112239,172.30.1.250,172.30.1.1,TCP,88,5222  >  53170 [ACK] Seq=1 Ack=19 Win=2096640 Len=0
WhatsApp,137,817.112438,172.30.1.1,172.30.1.250,TCP,364,"53170  >  5222 [PSH, ACK] Seq=19 Ack=1 Win=65536 Len=278 [TCP segment of a reassembled PDU]"
WhatsApp,138,817.112582,172.30.1.250,172.30.1.1,TCP,88,5222  >  53170 [ACK] Seq=1 Ack=297 Win=2096640 Len=0
WhatsApp,139,817.2995,172.30.1.250,172.30.1.1,TCP,244,"5222  >  53170 [PSH, ACK] Seq=1 Ack=297 Win=2097152 Len=158 [TCP segment of a reassembled PDU]"
USAA SafePilot,140,817.299937,172.30.1.250,172.30.1.1,DNS,168,Standard query response 0xfb27 A api-usaa.gotruemotion.com A 52.45.123.10 A 52.20.23.5 A 23.23.252.202
WhatsApp,141,817.300316,172.30.1.1,172.30.1.250,TCP,88,53170  >  5222 [ACK] Seq=297 Ack=159 Win=67072 Len=0
USAA SafePilot,142,817.303315,172.30.1.1,172.30.1.250,TCP,108,38050  >  443 [SYN] Seq=0 Win=65535 Len=0 MSS=9960 SACK_PERM=1 TSval=2120112784 TSecr=0 WS=512
WhatsApp,143,817.305939,172.30.1.1,172.30.1.250,TCP,92,"53170  >  5222 [PSH, ACK] Seq=297 Ack=159 Win=67072 Len=3 [TCP segment of a reassembled PDU]"
WhatsApp,144,817.306157,172.30.1.250,172.30.1.1,TCP,88,5222  >  53170 [ACK] Seq=159 Ack=300 Win=2096640 Len=0
WhatsApp,145,817.306377,172.30.1.1,172.30.1.250,TCP,268,"53170  >  5222 [PSH, ACK] Seq=300 Ack=159 Win=67072 Len=181 [TCP segment of a reassembled PDU]"
WhatsApp,146,817.306474,172.30.1.250,172.30.1.1,TCP,88,5222  >  53170 [ACK] Seq=159 Ack=481 Win=2096640 Len=0
WhatsApp,147,817.306817,172.30.1.1,172.30.1.250,TCP,92,"53170  >  5222 [PSH, ACK] Seq=481 Ack=159 Win=67072 Len=3 [TCP segment of a reassembled PDU]"
WhatsApp,148,817.306841,172.30.1.250,172.30.1.1,TCP,88,5222  >  53170 [ACK] Seq=159 Ack=484 Win=2096640 Len=0
WhatsApp,149,817.306967,172.30.1.1,172.30.1.250,TCP,124,"53170  >  5222 [PSH, ACK] Seq=484 Ack=159 Win=67072 Len=37 [TCP segment of a reassembled PDU]"
WhatsApp,150,817.306987,172.30.1.250,172.30.1.1,TCP,88,5222  >  53170 [ACK] Seq=159 Ack=521 Win=2096640 Len=0
WhatsApp,151,817.423454,172.30.1.250,172.30.1.1,TCP,132,"5222  >  53170 [PSH, ACK] Seq=159 Ack=521 Win=2096640 Len=46 [TCP segment of a reassembled PDU]"
WhatsApp,152,817.426228,172.30.1.250,172.30.1.1,TCP,124,"5222  >  53170 [PSH, ACK] Seq=205 Ack=521 Win=2096640 Len=37 [TCP segment of a reassembled PDU]"
WhatsApp,153,817.432636,172.30.1.1,172.30.1.250,TCP,88,53170  >  5222 [ACK] Seq=521 Ack=242 Win=67072 Len=0
USAA SafePilot,154,817.489801,172.30.1.250,172.30.1.1,TCP,96,"443  >  38050 [SYN, ACK] Seq=0 Ack=1 Win=4096 Len=0 MSS=9960 WS=512"
USAA SafePilot,155,817.490578,172.30.1.1,172.30.1.250,TCP,88,38050  >  443 [ACK] Seq=1 Ack=1 Win=65536 Len=0
WhatsApp,156,817.497866,172.30.1.250,172.30.1.1,TCP,284,"5222  >  53170 [PSH, ACK] Seq=242 Ack=521 Win=2097152 Len=195 [TCP segment of a reassembled PDU]"
USAA SafePilot,157,817.500754,172.30.1.1,172.30.1.250,TLSv1.2,604,Client Hello
USAA SafePilot,158,817.501396,172.30.1.250,172.30.1.1,TCP,88,443  >  38050 [ACK] Seq=1 Ack=518 Win=2096128 Len=0
WhatsApp,159,817.538802,172.30.1.1,172.30.1.250,TCP,88,53170  >  5222 [ACK] Seq=521 Ack=437 Win=68096 Len=0
USAA SafePilot,160,817.580679,172.30.1.250,172.30.1.1,TLSv1.2,5508,"Server Hello, Certificate, Server Key Exchange, Server Hello Done"
USAA SafePilot,161,817.582292,172.30.1.1,172.30.1.250,TCP,88,38050  >  443 [ACK] Seq=518 Ack=5420 Win=85504 Len=0
USAA SafePilot,162,817.602196,172.30.1.1,172.30.1.250,TLSv1.2,212,"Client Key Exchange, Change Cipher Spec, Encrypted Handshake Message"
USAA SafePilot,163,817.60287,172.30.1.250,172.30.1.1,TCP,88,443  >  38050 [ACK] Seq=5420 Ack=644 Win=2096640 Len=0
USAA SafePilot,164,817.654989,172.30.1.250,172.30.1.1,TLSv1.2,328,"New Session Ticket, Change Cipher Spec, Encrypted Handshake Message, Application Data"
USAA SafePilot,165,817.66981,172.30.1.1,172.30.1.250,TLSv1.2,140,Application Data
USAA SafePilot,166,817.670324,172.30.1.250,172.30.1.1,TCP,88,443  >  38050 [ACK] Seq=5660 Ack=697 Win=2096640 Len=0
USAA SafePilot,167,817.670919,172.30.1.1,172.30.1.250,TLSv1.2,132,Application Data
USAA SafePilot,168,817.670981,172.30.1.250,172.30.1.1,TCP,88,443  >  38050 [ACK] Seq=5660 Ack=741 Win=2096640 Len=0
USAA SafePilot,169,817.671846,172.30.1.1,172.30.1.250,TLSv1.2,128,Application Data
USAA SafePilot,170,817.671902,172.30.1.250,172.30.1.1,TCP,88,443  >  38050 [ACK] Seq=5660 Ack=783 Win=2096640 Len=0
USAA SafePilot,171,817.675906,172.30.1.1,172.30.1.250,TLSv1.2,476,Application Data
USAA SafePilot,172,817.676036,172.30.1.250,172.30.1.1,TCP,88,443  >  38050 [ACK] Seq=5660 Ack=1173 Win=2096128 Len=0
USAA SafePilot,173,817.676495,172.30.1.1,172.30.1.250,TLSv1.2,124,Application Data
USAA SafePilot,174,817.676519,172.30.1.250,172.30.1.1,TCP,88,443  >  38050 [ACK] Seq=5660 Ack=1211 Win=2096128 Len=0
USAA SafePilot,175,817.712538,172.30.1.250,172.30.1.1,TLSv1.2,124,Application Data
USAA SafePilot,176,817.724145,172.30.1.250,172.30.1.1,TLSv1.2,184,Application Data
USAA SafePilot,177,817.724721,172.30.1.1,172.30.1.250,TCP,88,38050  >  443 [ACK] Seq=1211 Ack=5794 Win=96768 Len=0
USAA SafePilot,178,817.771352,172.30.1.1,172.30.1.250,TLSv1.2,1616,Application Data
USAA SafePilot,179,817.772112,172.30.1.250,172.30.1.1,TCP,88,443  >  38050 [ACK] Seq=5794 Ack=2738 Win=2095616 Len=0
USAA SafePilot,180,817.913015,172.30.1.250,172.30.1.1,TLSv1.2,208,Application Data
USAA SafePilot,181,817.955178,172.30.1.1,172.30.1.250,TCP,88,38050  >  443 [ACK] Seq=2738 Ack=5913 Win=96768 Len=0
WhatsApp,182,821.669141,172.30.1.1,172.30.1.250,TCP,88,"53170  >  5222 [RST, ACK] Seq=521 Ack=437 Win=68096 Len=0"
WhatsApp,183,821.671023,172.30.1.250,172.30.1.1,TCP,88,"5222  >  53170 [RST, ACK] Seq=437 Ack=521 Win=65024 Len=0"
USAA SafePilot,184,879.030796,172.30.1.250,172.30.1.1,TLSv1.2,164,"Application Data, Encrypted Alert"
USAA SafePilot,185,879.032543,172.30.1.1,172.30.1.250,TCP,88,38050  >  443 [ACK] Seq=2738 Ack=5990 Win=96768 Len=0
USAA SafePilot,186,879.032594,172.30.1.250,172.30.1.1,TCP,88,"443  >  38050 [FIN, ACK] Seq=5990 Ack=2738 Win=2097152 Len=0"
USAA SafePilot,187,879.033578,172.30.1.1,172.30.1.250,TLSv1.2,120,Encrypted Alert
USAA SafePilot,188,879.033591,172.30.1.250,172.30.1.1,TCP,88,443  >  38050 [ACK] Seq=5991 Ack=2769 Win=65024 Len=0
USAA SafePilot,189,879.035371,172.30.1.1,172.30.1.250,TCP,88,"38050  >  443 [FIN, ACK] Seq=2769 Ack=5991 Win=96768 Len=0"
USAA SafePilot,190,879.035381,172.30.1.250,172.30.1.1,TCP,88,443  >  38050 [ACK] Seq=5991 Ack=2770 Win=65024 Len=0
Google Play service,191,1217.508906,172.30.1.1,172.30.1.250,DNS,116,Standard query 0x53b1 A pubads.g.doubleclick.net
WhatsApp,192,1217.547038,172.30.1.1,172.30.1.250,TCP,108,53636  >  5222 [SYN] Seq=0 Win=65535 Len=0 MSS=9960 SACK_PERM=1 TSval=2088876590 TSecr=0 WS=512
Google,193,1217.663353,172.30.1.1,172.30.1.250,DNS,108,Standard query 0x0eaa A www.google.com
Google Play service,194,1217.679121,172.30.1.1,172.30.1.250,DNS,124,Standard query 0x9767 A nearbysharing-pa.googleapis.com
Google Play service,195,1217.74272,172.30.1.250,172.30.1.1,DNS,156,Standard query response 0x53b1 A pubads.g.doubleclick.net CNAME pubads46.g.doubleclick.net A 142.251.32.98
Google Play service,196,1217.745714,172.30.1.1,172.30.1.250,TCP,108,50488  >  443 [SYN] Seq=0 Win=65535 Len=0 MSS=9960 SACK_PERM=1 TSval=2850226767 TSecr=0 WS=512
WhatsApp,197,1217.774782,172.30.1.250,172.30.1.1,TCP,96,"5222  >  53636 [SYN, ACK] Seq=0 Ack=1 Win=4096 Len=0 MSS=9960 WS=512"
WhatsApp,198,1217.774976,172.30.1.1,172.30.1.250,TCP,88,53636  >  5222 [ACK] Seq=1 Ack=1 Win=65536 Len=0
WhatsApp,199,1217.783068,172.30.1.1,172.30.1.250,TCP,92,"53636  >  5222 [PSH, ACK] Seq=1 Ack=1 Win=65536 Len=4 [TCP segment of a reassembled PDU]"
WhatsApp,200,1217.783356,172.30.1.250,172.30.1.1,TCP,88,5222  >  53636 [ACK] Seq=1 Ack=5 Win=2096640 Len=0
WhatsApp,201,1217.783448,172.30.1.1,172.30.1.250,TCP,100,"53636  >  5222 [PSH, ACK] Seq=5 Ack=1 Win=65536 Len=11 [TCP segment of a reassembled PDU]"
WhatsApp,202,1217.783515,172.30.1.250,172.30.1.1,TCP,88,5222  >  53636 [ACK] Seq=1 Ack=16 Win=2096640 Len=0
WhatsApp,203,1217.790888,172.30.1.1,172.30.1.250,TCP,92,"53636  >  5222 [PSH, ACK] Seq=16 Ack=1 Win=65536 Len=3 [TCP segment of a reassembled PDU]"
WhatsApp,204,1217.791195,172.30.1.250,172.30.1.1,TCP,88,5222  >  53636 [ACK] Seq=1 Ack=19 Win=2096640 Len=0
WhatsApp,205,1217.791488,172.30.1.1,172.30.1.250,TCP,364,"53636  >  5222 [PSH, ACK] Seq=19 Ack=1 Win=65536 Len=278 [TCP segment of a reassembled PDU]"
WhatsApp,206,1217.791631,172.30.1.250,172.30.1.1,TCP,88,5222  >  53636 [ACK] Seq=1 Ack=297 Win=2096640 Len=0
Google,207,1217.860388,172.30.1.250,172.30.1.1,DNS,124,Standard query response 0x0eaa A www.google.com A 142.250.64.68
Google Play service,208,1217.863025,172.30.1.250,172.30.1.1,DNS,380,Standard query response 0x9767 A nearbysharing-pa.googleapis.com A 142.251.40.234 A 142.250.65.170 A 142.250.65.202 A 142.250.65.234 A 142.250.81.234 A 142.251.41.10 A 142.251.32.106 A 142.251.35.170 A 142.251.40.106 A 142.251.40.138 A 142.251.40.170 A 142.250.64.74 A 142.250.72.106 A 142.250.80.42 A 142.250.80.74 A 142.250.80.106
Google Play service,209,1217.863413,172.30.1.250,172.30.1.1,TCP,96,"443  >  50488 [SYN, ACK] Seq=0 Ack=1 Win=4096 Len=0 MSS=9960 WS=512"
Google Play service,210,1217.86373,172.30.1.1,172.30.1.250,TCP,88,50488  >  443 [ACK] Seq=1 Ack=1 Win=65536 Len=0
Google Play service,211,1217.865045,172.30.1.1,172.30.1.250,TLSv1.2,604,Client Hello
Google Play service,212,1217.865239,172.30.1.250,172.30.1.1,TCP,88,443  >  50488 [ACK] Seq=1 Ack=518 Win=2096128 Len=0
Google,213,1217.868639,172.30.1.1,172.30.1.250,UDP,1324,37810  >  443 Len=1250
Google,214,1217.871532,172.30.1.1,172.30.1.250,TCP,108,44716  >  443 [SYN] Seq=0 Win=65535 Len=0 MSS=9960 SACK_PERM=1 TSval=2671731406 TSecr=0 WS=512
Google Play service,215,1217.875054,172.30.1.1,172.30.1.250,TCP,108,41814  >  443 [SYN] Seq=0 Win=65535 Len=0 MSS=9960 SACK_PERM=1 TSval=3442582966 TSecr=0 WS=512
Google,216,1217.884028,172.30.1.1,172.30.1.250,UDP,156,37810  >  443 Len=79
WhatsApp,217,1217.901136,172.30.1.250,172.30.1.1,TCP,244,"5222  >  53636 [PSH, ACK] Seq=1 Ack=297 Win=2097152 Len=158 [TCP segment of a reassembled PDU]"
WhatsApp,218,1217.901496,172.30.1.1,172.30.1.250,TCP,88,53636  >  5222 [ACK] Seq=297 Ack=159 Win=67072 Len=0
WhatsApp,219,1217.906106,172.30.1.1,172.30.1.250,TCP,92,"53636  >  5222 [PSH, ACK] Seq=297 Ack=159 Win=67072 Len=3 [TCP segment of a reassembled PDU]"
WhatsApp,220,1217.906318,172.30.1.250,172.30.1.1,TCP,88,5222  >  53636 [ACK] Seq=159 Ack=300 Win=2096640 Len=0
WhatsApp,221,1217.906436,172.30.1.1,172.30.1.250,TCP,268,"53636  >  5222 [PSH, ACK] Seq=300 Ack=159 Win=67072 Len=181 [TCP segment of a reassembled PDU]"
WhatsApp,222,1217.906528,172.30.1.250,172.30.1.1,TCP,88,5222  >  53636 [ACK] Seq=159 Ack=481 Win=2096640 Len=0
WhatsApp,223,1217.906593,172.30.1.1,172.30.1.250,TCP,128,"53636  >  5222 [PSH, ACK] Seq=481 Ack=159 Win=67072 Len=40 [TCP segment of a reassembled PDU]"
WhatsApp,224,1217.906616,172.30.1.250,172.30.1.1,TCP,88,5222  >  53636 [ACK] Seq=159 Ack=521 Win=2096640 Len=0
Google Play service,225,1217.934468,172.30.1.250,172.30.1.1,TLSv1.2,248,"Server Hello, Change Cipher Spec, Encrypted Handshake Message"
Google Play service,226,1217.934805,172.30.1.1,172.30.1.250,TCP,88,50488  >  443 [ACK] Seq=518 Ack=163 Win=67072 Len=0
Google Play service,227,1217.934915,172.30.1.1,172.30.1.250,TLSv1.2,140,"Change Cipher Spec, Encrypted Handshake Message"
Google Play service,228,1217.935089,172.30.1.250,172.30.1.1,TCP,88,443  >  50488 [ACK] Seq=163 Ack=569 Win=2096640 Len=0
Google Play service,229,1217.935938,172.30.1.1,172.30.1.250,TLSv1.2,1116,Application Data
Google Play service,230,1217.936053,172.30.1.250,172.30.1.1,TCP,88,443  >  50488 [ACK] Seq=163 Ack=1597 Win=2095616 Len=0
Google Play service,231,1217.936133,172.30.1.1,172.30.1.250,TLSv1.2,10048,Application Data
Google Play service,232,1217.936297,172.30.1.1,172.30.1.250,TLSv1.2,5748,Application Data
Google Play service,233,1217.936909,172.30.1.250,172.30.1.1,TCP,88,443  >  50488 [ACK] Seq=163 Ack=17218 Win=2080256 Len=0
Google,234,1217.938711,172.30.1.1,172.30.1.250,UDP,1324,37810  >  443 Len=1250
Google,235,1218.081029,172.30.1.1,172.30.1.250,UDP,1324,37810  >  443 Len=1250
Google,236,1218.128762,172.30.1.1,172.30.1.250,TCP,108,58184  >  443 [SYN] Seq=0 Win=65535 Len=0 MSS=9960 SACK_PERM=1 TSval=2671731663 TSecr=0 WS=512
Google Play service,237,1218.130158,172.30.1.250,172.30.1.1,TCP,96,"443  >  41814 [SYN, ACK] Seq=0 Ack=1 Win=4096 Len=0 MSS=9960 WS=512"
Google Play service,238,1218.130258,172.30.1.1,172.30.1.250,TCP,88,41814  >  443 [ACK] Seq=1 Ack=1 Win=65536 Len=0
Google,239,1218.130308,172.30.1.250,172.30.1.1,TCP,96,"443  >  44716 [SYN, ACK] Seq=0 Ack=1 Win=4096 Len=0 MSS=9960 WS=512"
Google,240,1218.130385,172.30.1.1,172.30.1.250,TCP,88,44716  >  443 [ACK] Seq=1 Ack=1 Win=65536 Len=0
Google,241,1218.131859,172.30.1.1,172.30.1.250,TLSv1.3,604,Client Hello
Google,242,1218.132171,172.30.1.250,172.30.1.1,TCP,88,443  >  44716 [ACK] Seq=1 Ack=518 Win=2096128 Len=0
WhatsApp,243,1218.135762,172.30.1.250,172.30.1.1,TCP,364,"5222  >  53636 [PSH, ACK] Seq=159 Ack=521 Win=2097152 Len=278 [TCP segment of a reassembled PDU]"
Google,244,1218.135888,172.30.1.250,172.30.1.1,UDP,1324,443  >  37810 Len=1250
Google,245,1218.136026,172.30.1.250,172.30.1.1,UDP,888,443  >  37810 Len=814
Google,246,1218.136073,172.30.1.250,172.30.1.1,UDP,224,443  >  37810 Len=150
Google,247,1218.136103,172.30.1.250,172.30.1.1,UDP,100,443  >  37810 Len=24
Google,248,1218.136134,172.30.1.250,172.30.1.1,UDP,1324,443  >  37810 Len=1250
Google,249,1218.136168,172.30.1.250,172.30.1.1,UDP,1324,443  >  37810 Len=1250
Google,250,1218.139244,172.30.1.1,172.30.1.250,UDP,1324,37810  >  443 Len=1250
Google,251,1218.139506,172.30.1.1,172.30.1.250,UDP,148,37810  >  443 Len=73
Google,252,1218.140013,172.30.1.1,172.30.1.250,UDP,108,37810  >  443 Len=32
Google Play service,253,1218.140705,172.30.1.1,172.30.1.250,TLSv1.3,604,Client Hello
Google Play service,254,1218.141244,172.30.1.250,172.30.1.1,TCP,88,443  >  41814 [ACK] Seq=1 Ack=518 Win=2096128 Len=0
Google,255,1218.141363,172.30.1.1,172.30.1.250,UDP,188,37810  >  443 Len=114
Google,256,1218.141457,172.30.1.1,172.30.1.250,UDP,192,37810  >  443 Len=117
Google,257,1218.149957,172.30.1.1,172.30.1.250,UDP,1320,37810  >  443 Len=1246
Google,258,1218.150279,172.30.1.1,172.30.1.250,UDP,1324,37810  >  443 Len=1250
Google,259,1218.150374,172.30.1.1,172.30.1.250,UDP,1324,37810  >  443 Len=1250
Google,260,1218.15044,172.30.1.1,172.30.1.250,UDP,580,37810  >  443 Len=503
Google,261,1218.150493,172.30.1.1,172.30.1.250,UDP,120,37810  >  443 Len=43
Google,262,1218.172796,172.30.1.250,172.30.1.1,TCP,96,"443  >  58184 [SYN, ACK] Seq=0 Ack=1 Win=4096 Len=0 MSS=9960 WS=512"
Google,263,1218.173214,172.30.1.1,172.30.1.250,TCP,88,58184  >  443 [ACK] Seq=1 Ack=1 Win=65536 Len=0
Google,264,1218.173258,172.30.1.250,172.30.1.1,UDP,1324,443  >  37810 Len=1250
Google,265,1218.174083,172.30.1.1,172.30.1.250,TLSv1.3,604,Client Hello
Google,266,1218.174397,172.30.1.250,172.30.1.1,TCP,88,443  >  58184 [ACK] Seq=1 Ack=518 Win=2096128 Len=0
Google,267,1218.174841,172.30.1.1,172.30.1.250,UDP,1324,37810  >  443 Len=1250
WhatsApp,268,1218.177919,172.30.1.1,172.30.1.250,TCP,88,53636  >  5222 [ACK] Seq=521 Ack=437 Win=68096 Len=0
Google,269,1218.184577,172.30.1.250,172.30.1.1,TLSv1.3,2700,"Server Hello, Change Cipher Spec"
Google,270,1218.184926,172.30.1.1,172.30.1.250,TCP,88,44716  >  443 [ACK] Seq=518 Ack=2613 Win=85504 Len=0
Google,271,1218.184974,172.30.1.250,172.30.1.1,TLSv1.3,1924,Application Data
Google,272,1218.185072,172.30.1.1,172.30.1.250,TCP,88,44716  >  443 [ACK] Seq=518 Ack=4450 Win=91136 Len=0
Google,273,1218.198983,172.30.1.1,172.30.1.250,TLSv1.3,160,"Change Cipher Spec, Application Data"
Google,274,1218.199224,172.30.1.250,172.30.1.1,TCP,88,443  >  44716 [ACK] Seq=4450 Ack=592 Win=2096640 Len=0
Google,275,1218.202466,172.30.1.250,172.30.1.1,UDP,208,443  >  37810 Len=133
Google,276,1218.203085,172.30.1.1,172.30.1.250,UDP,108,37810  >  443 Len=33
Google,277,1218.205251,172.30.1.250,172.30.1.1,UDP,104,443  >  37810 Len=29
Google,278,1218.209815,172.30.1.250,172.30.1.1,UDP,104,443  >  37810 Len=29
Google,279,1218.213396,172.30.1.250,172.30.1.1,UDP,104,443  >  37810 Len=29
Google Play service,280,1218.213499,172.30.1.250,172.30.1.1,TLSv1.3,4768,"Server Hello, Change Cipher Spec, Application Data"
Google Play service,281,1218.213812,172.30.1.1,172.30.1.250,TCP,88,41814  >  443 [ACK] Seq=518 Ack=4683 Win=85504 Len=0
Google,282,1218.213829,172.30.1.250,172.30.1.1,ADwin Config,96,
Google,283,1218.21592,172.30.1.250,172.30.1.1,UDP,108,443  >  37810 Len=31
Google Play service,284,1218.225282,172.30.1.1,172.30.1.250,TLSv1.3,152,"Change Cipher Spec, Application Data"
Google Play service,285,1218.225556,172.30.1.250,172.30.1.1,TCP,88,443  >  41814 [ACK] Seq=4683 Ack=582 Win=2096640 Len=0
Google Play service,286,1218.228757,172.30.1.1,172.30.1.250,TLSv1.3,148,Application Data
Google Play service,287,1218.228971,172.30.1.250,172.30.1.1,TCP,88,443  >  41814 [ACK] Seq=4683 Ack=643 Win=2096640 Len=0
Google,288,1218.236422,172.30.1.250,172.30.1.1,TLSv1.3,2700,"Server Hello, Change Cipher Spec"
Google,289,1218.236709,172.30.1.1,172.30.1.250,TCP,88,58184  >  443 [ACK] Seq=518 Ack=2613 Win=85504 Len=0
Google,290,1218.236748,172.30.1.250,172.30.1.1,TLSv1.3,1924,Application Data
Google,291,1218.23682,172.30.1.1,172.30.1.250,TCP,88,58184  >  443 [ACK] Seq=518 Ack=4451 Win=91136 Len=0
Google,292,1218.238735,172.30.1.1,172.30.1.250,TLSv1.3,160,"Change Cipher Spec, Application Data"
Google,293,1218.238851,172.30.1.250,172.30.1.1,TCP,88,443  >  58184 [ACK] Seq=4451 Ack=592 Win=2096640 Len=0
Google,294,1218.23916,172.30.1.1,172.30.1.250,UDP,108,37810  >  443 Len=32
Google Play service,295,1218.254415,172.30.1.250,172.30.1.1,TLSv1.3,700,"Application Data, Application Data"
Google Play service,296,1218.256728,172.30.1.1,172.30.1.250,TLSv1.3,1664,Application Data
Google Play service,297,1218.256897,172.30.1.250,172.30.1.1,TCP,88,443  >  41814 [ACK] Seq=5297 Ack=2219 Win=2095104 Len=0
Google Play service,298,1218.257967,172.30.1.1,172.30.1.250,TLSv1.3,3884,Application Data
Google Play service,299,1218.258073,172.30.1.250,172.30.1.1,TCP,88,443  >  41814 [ACK] Seq=5297 Ack=6015 Win=2091520 Len=0
Google Play service,300,1218.360317,172.30.1.250,172.30.1.1,TLSv1.3,120,Application Data
Google Play service,301,1218.401009,172.30.1.1,172.30.1.250,TCP,88,41814  >  443 [ACK] Seq=6015 Ack=5328 Win=95232 Len=0
Google,302,1218.417208,172.30.1.1,172.30.1.250,UDP,104,37810  >  443 Len=29
Google,303,1218.550182,172.30.1.250,172.30.1.1,UDP,100,443  >  37810 Len=24
Google Play service,304,1218.674157,172.30.1.250,172.30.1.1,TLSv1.3,9288,"Application Data, Application Data, Application Data, Application Data, Application Data, Application Data, Application Data, Application Data, Application Data"
Google Play service,305,1218.67453,172.30.1.1,172.30.1.250,TCP,88,41814  >  443 [ACK] Seq=6015 Ack=14527 Win=115200 Len=0
Google Play service,306,1218.6804,172.30.1.1,172.30.1.250,TLSv1.3,128,Application Data
Google Play service,307,1218.680585,172.30.1.250,172.30.1.1,TCP,88,443  >  41814 [ACK] Seq=14527 Ack=6054 Win=2096640 Len=0
Google Play service,308,1218.736354,172.30.1.250,172.30.1.1,TLSv1.2,2844,Application Data
Google Play service,309,1218.737649,172.30.1.250,172.30.1.1,TLSv1.2,5456,"Application Data, Application Data, Application Data, Application Data"
Google Play service,310,1218.737809,172.30.1.1,172.30.1.250,TCP,88,50488  >  443 [ACK] Seq=17218 Ack=8289 Win=106496 Len=0
Google Play service,311,1218.737842,172.30.1.250,172.30.1.1,TLSv1.2,4004,"Application Data, Application Data, Application Data"
Google,312,1218.75215,172.30.1.1,172.30.1.250,UDP,104,37810  >  443 Len=29
Google Play service,313,1218.779918,172.30.1.250,172.30.1.1,TLSv1.2,2700,"Application Data, Application Data"
Google Play service,314,1218.780239,172.30.1.1,172.30.1.250,TCP,88,50488  >  443 [ACK] Seq=17218 Ack=14819 Win=137216 Len=0
Google Play service,315,1218.801484,172.30.1.250,172.30.1.1,TLSv1.2,6808,"Application Data, Application Data, Application Data, Application Data, Application Data, Application Data, Application Data"
Google,316,1218.807856,172.30.1.250,172.30.1.1,UDP,100,443  >  37810 Len=24
Google Play service,317,1218.849318,172.30.1.1,172.30.1.250,TCP,88,50488  >  443 [ACK] Seq=17218 Ack=21539 Win=157184 Len=0
Pandora,318,1218.925944,172.30.1.1,172.30.1.250,DNS,112,Standard query 0x60c1 A vae-bid.adsrvr.org
Pandora,319,1218.926746,172.30.1.1,172.30.1.250,DNS,120,Standard query 0xfd40 A www.googletagservices.com
Google Play service,320,1218.928459,172.30.1.1,172.30.1.250,DNS,120,Standard query 0x5e58 A safebrowsing.googleapis.com
Pandora,321,1218.933978,172.30.1.1,172.30.1.250,DNS,112,Standard query 0x54c9 A cdn.doubleverify.com
Pandora,322,1218.934814,172.30.1.1,172.30.1.250,DNS,124,Standard query 0x5d37 A pagead2.googlesyndication.com
Google,323,1218.93637,172.30.1.250,172.30.1.1,UDP,1320,443  >  37810 Len=1246
Google,324,1218.93641,172.30.1.250,172.30.1.1,UDP,1324,443  >  37810 Len=1250
Google,325,1218.93642,172.30.1.250,172.30.1.1,UDP,992,443  >  37810 Len=917
Google,326,1218.936426,172.30.1.250,172.30.1.1,UDP,188,443  >  37810 Len=111
Google,327,1218.936432,172.30.1.250,172.30.1.1,UDP,1320,443  >  37810 Len=1245
Google,328,1218.936439,172.30.1.250,172.30.1.1,UDP,1324,443  >  37810 Len=1250
Google,329,1218.936446,172.30.1.250,172.30.1.1,UDP,1324,443  >  37810 Len=1250
Google,330,1218.936453,172.30.1.250,172.30.1.1,UDP,1324,443  >  37810 Len=1250
Google,331,1218.93646,172.30.1.250,172.30.1.1,UDP,1324,443  >  37810 Len=1250
Google,332,1218.936467,172.30.1.250,172.30.1.1,UDP,1324,443  >  37810 Len=1250
Google,333,1218.936475,172.30.1.250,172.30.1.1,UDP,1320,443  >  37810 Len=1246
Google,334,1218.936484,172.30.1.250,172.30.1.1,UDP,1324,443  >  37810 Len=1250
Google,335,1218.936492,172.30.1.250,172.30.1.1,UDP,1324,443  >  37810 Len=1250
Google,336,1218.936499,172.30.1.250,172.30.1.1,UDP,1324,443  >  37810 Len=1250
Google,337,1218.937219,172.30.1.1,172.30.1.250,UDP,108,37810  >  443 Len=33
Google,338,1218.937337,172.30.1.1,172.30.1.250,UDP,108,37810  >  443 Len=33
Google,339,1218.937425,172.30.1.1,172.30.1.250,UDP,108,37810  >  443 Len=33
Google,340,1218.937508,172.30.1.1,172.30.1.250,UDP,108,37810  >  443 Len=33
Google,341,1218.937637,172.30.1.1,172.30.1.250,UDP,108,37810  >  443 Len=33
Google,342,1218.937791,172.30.1.1,172.30.1.250,UDP,108,37810  >  443 Len=33
Google,343,1218.938263,172.30.1.1,172.30.1.250,UDP,112,37810  >  443 Len=35
Google,344,1218.938532,172.30.1.1,172.30.1.250,UDP,108,37810  >  443 Len=31
Google,345,1218.964605,172.30.1.1,172.30.1.250,UDP,108,37810  >  443 Len=32
Google,346,1218.969274,172.30.1.250,172.30.1.1,UDP,1324,443  >  37810 Len=1250
Google,347,1218.969379,172.30.1.250,172.30.1.1,UDP,1324,443  >  37810 Len=1250
Google,348,1218.969424,172.30.1.250,172.30.1.1,UDP,1324,443  >  37810 Len=1250
Google,349,1218.969464,172.30.1.250,172.30.1.1,UDP,1324,443  >  37810 Len=1250
Google,350,1218.969505,172.30.1.250,172.30.1.1,UDP,1324,443  >  37810 Len=1250
Google,351,1218.969544,172.30.1.250,172.30.1.1,UDP,1324,443  >  37810 Len=1250
Google,352,1218.969585,172.30.1.250,172.30.1.1,UDP,1324,443  >  37810 Len=1250
Google,353,1218.969623,172.30.1.250,172.30.1.1,UDP,1324,443  >  37810 Len=1250
Google,354,1218.969662,172.30.1.250,172.30.1.1,UDP,1324,443  >  37810 Len=1250
Google,355,1218.969702,172.30.1.250,172.30.1.1,UDP,1324,443  >  37810 Len=1250
Google,356,1218.969758,172.30.1.250,172.30.1.1,UDP,1324,443  >  37810 Len=1250
Google,357,1218.969799,172.30.1.250,172.30.1.1,UDP,1324,443  >  37810 Len=1250
Google,358,1218.969837,172.30.1.250,172.30.1.1,UDP,1324,443  >  37810 Len=1250
Google,359,1218.969878,172.30.1.250,172.30.1.1,UDP,1324,443  >  37810 Len=1250
Google,360,1218.969936,172.30.1.250,172.30.1.1,UDP,1324,443  >  37810 Len=1250
Google,361,1218.969976,172.30.1.1,172.30.1.250,UDP,108,37810  >  443 Len=31
Google,362,1218.970103,172.30.1.1,172.30.1.250,UDP,108,37810  >  443 Len=31
Google,363,1218.970176,172.30.1.250,172.30.1.1,UDP,1324,443  >  37810 Len=1250
Google,364,1218.970221,172.30.1.1,172.30.1.250,UDP,108,37810  >  443 Len=31
Google,365,1218.971477,172.30.1.1,172.30.1.250,UDP,108,37810  >  443 Len=31
Google,366,1218.971608,172.30.1.1,172.30.1.250,UDP,108,37810  >  443 Len=31
Google,367,1218.971682,172.30.1.1,172.30.1.250,UDP,108,37810  >  443 Len=31
Google,368,1218.971751,172.30.1.1,172.30.1.250,UDP,108,37810  >  443 Len=31
Google,369,1218.971819,172.30.1.1,172.30.1.250,UDP,108,37810  >  443 Len=31
Google,370,1218.979052,172.30.1.250,172.30.1.1,UDP,1324,443  >  37810 Len=1250
Pandora,371,1218.979154,172.30.1.250,172.30.1.1,DNS,128,Standard query response 0x60c1 A vae-bid.adsrvr.org A 199.250.166.129
Pandora,372,1218.981705,172.30.1.1,172.30.1.250,TCP,108,39918  >  443 [SYN] Seq=0 Win=65535 Len=0 MSS=9960 SACK_PERM=1 TSval=1378705261 TSecr=0 WS=512
Google,373,1218.993261,172.30.1.250,172.30.1.1,UDP,1324,443  >  37810 Len=1250
Pandora,374,1218.993331,172.30.1.250,172.30.1.1,DNS,224,Standard query response 0x54c9 A cdn.doubleverify.com CNAME cdn.doubleverify.com.edgesuite.net CNAME a1241.dsct.akamai.net A 23.45.181.210 A 23.45.181.161
Google,375,1218.993518,172.30.1.250,172.30.1.1,UDP,1324,443  >  37810 Len=1250
Pandora,376,1218.99355,172.30.1.250,172.30.1.1,DNS,136,Standard query response 0xfd40 A www.googletagservices.com A 142.250.176.194
Google Play service,377,1218.993648,172.30.1.250,172.30.1.1,DNS,136,Standard query response 0x5e58 A safebrowsing.googleapis.com A 142.251.35.170
Pandora,378,1218.993749,172.30.1.250,172.30.1.1,DNS,140,Standard query response 0x5d37 A pagead2.googlesyndication.com A 142.250.65.162
Google,379,1218.993847,172.30.1.250,172.30.1.1,UDP,1324,443  >  37810 Len=1250
Google,380,1218.993949,172.30.1.1,172.30.1.250,UDP,108,37810  >  443 Len=31
